Sheet: Planning time index
C1: Planning time index () for Interstates, turnpikes, and expressways in Gloucester, New Jersey (69 TMCs)
C3: Northbound | J3: Southbound | Q3: Eastbound
C4: NPMRDS from HERE (Trucks and passenger vehicles) | J4: NPMRDS from HERE (Trucks and passenger vehicles) | Q4: NPMRDS from HERE (Trucks and passenger vehicles)
C5: 2011 (Every weekday) | D5: 2012 (Every weekday) | E5: 2013 (Every weekday) | F5: 2014 (Every weekday) | G5: 2015 (Every weekday) | H5: 2016 (Every weekday) | I5: 2017 (Every weekday) | J5: 2011 (Every weekday) | K5: 2012 (Every weekday) | L5: 2013 (Every weekday) | M5: 2014 (Every weekday) | N5: 2015 (Every weekday) | O5: 2016 (Every weekday) | P5: 2017 (Every weekday) | Q5: 2011 (Every weekday) | R5: 2012 (Every weekday) | S5: 2013 (Every weekday) | T5: 2014 (Every weekday) | U5: 2015 (Every weekday) | V5: 2016 (Every weekday) | W5: 2017 (Every weekday)
A6: 12 AM | C6: 1.36 | D6: 1.36 | E6: 1.31 | F6: 1.34 | G6: 1.3 | H6: 1.29 | I6: 1.25 | J6: 1.39 | K6: 1.47 | L6: 1.37 | M6: 1.4 | N6: 1.35 | O6: 1.35 | P6: 1.28 | S6: 2.19 | T6: 2.72 | U6: 34 | V6: 1.45 | W6: 1.55
A7: 1 AM | C7: 1.38 | D7: 1.38 | E7: 1.29 | F7: 1.36 | G7: 1.3 | H7: 1.28 | I7: 1.25 | J7: 1.37 | K7: 1.49 | L7: 1.37 | M7: 1.41 | N7: 1.35 | O7: 1.34 | P7: 1.28 | S7: 2.62 | T7: 2.62 | U7: 34 | V7: 1.51 | W7: 1.51
A8: 2 AM | C8: 1.39 | D8: 1.38 | E8: 1.29 | F8: 1.36 | G8: 1.31 | H8: 1.27 | I8: 1.24 | J8: 1.38 | K8: 1.43 | L8: 1.35 | M8: 1.38 | N8: 1.34 | O8: 1.32 | P8: 1.28 | S8: 1.66 | T8: 1.89 | U8: 34 | V8: 1.55 | W8: 1.51
A9: 3 AM | C9: 1.35 | D9: 1.37 | E9: 1.28 | F9: 1.36 | G9: 1.3 | H9: 1.26 | I9: 1.24 | J9: 1.37 | K9: 1.36 | L9: 1.31 | M9: 1.39 | N9: 1.33 | O9: 1.3 | P9: 1.27 | S9: 3.58 | T9: 2.19 | U9: 34 | V9: 1.55 | W9: 1.51
A10: 4 AM | C10: 1.43 | D10: 1.38 | E10: 1.28 | F10: 1.33 | G10: 1.26 | H10: 1.23 | I10: 1.21 | J10: 1.37 | K10: 1.42 | L10: 1.34 | M10: 1.37 | N10: 1.3 | O10: 1.28 | P10: 1.27 | S10: 3.58 | T10: 2.83 | U10: 34 | V10: 1.62 | W10: 1.45
A11: 5 AM | C11: 1.45 | D11: 1.4 | E11: 1.29 | F11: 1.32 | G11: 1.25 | H11: 1.22 | I11: 1.21 | J11: 1.39 | K11: 1.38 | L11: 1.31 | M11: 1.38 | N11: 1.31 | O11: 1.27 | P11: 1.25 | S11: 2.34 | T11: 1.94 | U11: 34 | V11: 1.45 | W11: 1.31
A12: 6 AM | C12: 1.42 | D12: 1.36 | E12: 1.26 | F12: 1.3 | G12: 1.24 | H12: 1.21 | I12: 1.21 | J12: 1.35 | K12: 1.35 | L12: 1.28 | M12: 1.32 | N12: 1.27 | O12: 1.23 | P12: 1.24 | S12: 2.34 | T12: 1.7 | U12: 34 | V12: 1.39 | W12: 1.28
A13: 7 AM | C13: 2.0299999999999998 | D13: 1.93 | E13: 1.58 | F13: 1.66 | G13: 1.44 | H13: 1.47 | I13: 1.4 | J13: 1.38 | K13: 1.36 | L13: 1.31 | M13: 1.31 | N13: 1.28 | O13: 1.23 | P13: 1.23 | S13: 1.66 | T13: 1.62 | U13: 34 | V13: 1.33 | W13: 1.26
A14: 8 AM | C14: 2.02 | D14: 2.34 | E14: 1.74 | F14: 1.73 | G14: 1.48 | H14: 1.42 | I14: 1.31 | J14: 1.37 | K14: 1.36 | L14: 1.43 | M14: 1.3 | N14: 1.28 | O14: 1.23 | P14: 1.23 | S14: 2.19 | T14: 1.62 | U14: 34 | V14: 1.39 | W14: 1.28
A15: 9 AM | C15: 1.45 | D15: 1.42 | E15: 1.28 | F15: 1.32 | G15: 1.24 | H15: 1.21 | I15: 1.21 | J15: 1.37 | K15: 1.36 | L15: 1.38 | M15: 1.31 | N15: 1.26 | O15: 1.22 | P15: 1.23 | S15: 1.89 | T15: 2 | U15: 34 | V15: 1.39 | W15: 1.33
A16: 10 AM | C16: 1.39 | D16: 1.37 | E16: 1.27 | F16: 1.3 | G16: 1.24 | H16: 1.21 | I16: 1.21 | J16: 1.35 | K16: 1.34 | L16: 1.39 | M16: 1.31 | N16: 1.26 | O16: 1.23 | P16: 1.23 | S16: 2.72 | T16: 1.84 | U16: 34 | V16: 1.51 | W16: 1.36
A17: 11 AM | C17: 1.41 | D17: 1.36 | E17: 1.27 | F17: 1.3 | G17: 1.23 | H17: 1.21 | I17: 1.21 | J17: 1.33 | K17: 1.35 | L17: 1.34 | M17: 1.32 | N17: 1.28 | O17: 1.22 | P17: 1.24 | S17: 2.34 | T17: 2.27 | U17: 34 | V17: 1.39 | W17: 1.39
A18: 12 PM | C18: 1.34 | D18: 1.32 | E18: 1.25 | F18: 1.35 | G18: 1.23 | H18: 1.21 | I18: 1.21 | J18: 1.34 | K18: 1.34 | L18: 1.33 | M18: 1.34 | N18: 1.3 | O18: 1.22 | P18: 1.23 | S18: 1.94 | T18: 1.84 | U18: 34 | V18: 1.39 | W18: 1.39
A19: 1 PM | C19: 1.38 | D19: 1.35 | E19: 1.26 | F19: 1.37 | G19: 1.24 | H19: 1.2 | I19: 1.21 | J19: 1.34 | K19: 1.34 | L19: 1.3 | M19: 1.34 | N19: 1.3 | O19: 1.23 | P19: 1.23 | S19: 1.84 | T19: 2.19 | U19: 34 | V19: 1.51 | W19: 1.45
A20: 2 PM | C20: 1.41 | D20: 1.35 | E20: 1.25 | F20: 1.32 | G20: 1.23 | H20: 1.2 | I20: 1.21 | J20: 1.37 | K20: 1.33 | L20: 1.31 | M20: 1.31 | N20: 1.27 | O20: 1.22 | P20: 1.24 | S20: 1.74 | T20: 2.19 | U20: 34 | V20: 1.39 | W20: 1.55
A21: 3 PM | C21: 1.34 | D21: 1.31 | E21: 1.24 | F21: 1.27 | G21: 1.22 | H21: 1.2 | I21: 1.21 | J21: 1.34 | K21: 1.33 | L21: 1.29 | M21: 1.28 | N21: 1.25 | O21: 1.22 | P21: 1.24 | S21: 2.34 | T21: 2.19 | U21: 34 | V21: 1.39 | W21: 1.58
A22: 4 PM | C22: 1.36 | D22: 1.32 | E22: 1.39 | F22: 1.31 | G22: 1.25 | H22: 1.23 | I22: 1.22 | J22: 1.37 | K22: 1.34 | L22: 1.3 | M22: 1.28 | N22: 1.26 | O22: 1.24 | P22: 1.25 | S22: 2.62 | T22: 2.19 | U22: 34 | V22: 1.33 | W22: 1.79
A23: 5 PM | C23: 1.47 | D23: 1.42 | E23: 1.5 | F23: 1.51 | G23: 1.34 | H23: 1.27 | I23: 1.28 | J23: 1.45 | K23: 1.36 | L23: 1.32 | M23: 1.31 | N23: 1.29 | O23: 1.25 | P23: 1.27 | S23: 2.34 | T23: 2.27 | U23: 34 | V23: 1.45 | W23: 1.84
A24: 6 PM | C24: 1.42 | D24: 1.35 | E24: 1.31 | F24: 1.35 | G24: 1.28 | H24: 1.23 | I24: 1.23 | J24: 1.43 | K24: 1.37 | L24: 1.4 | M24: 1.32 | N24: 1.3 | O24: 1.28 | P24: 1.26 | S24: 2.19 | T24: 2.19 | U24: 34 | V24: 1.39 | W24: 1.79
A25: 7 PM | C25: 1.42 | D25: 1.39 | E25: 1.31 | F25: 1.31 | G25: 1.27 | H25: 1.25 | I25: 1.24 | J25: 1.4 | K25: 1.35 | L25: 1.4 | M25: 1.35 | N25: 1.3 | O25: 1.29 | P25: 1.27 | S25: 1.94 | T25: 2.19 | U25: 34 | V25: 1.39 | W25: 1.58
A26: 8 PM | C26: 1.41 | D26: 1.4 | E26: 1.35 | F26: 1.33 | G26: 1.28 | H26: 1.27 | I26: 1.24 | J26: 1.35 | K26: 1.36 | L26: 1.4 | M26: 1.35 | N26: 1.32 | O26: 1.32 | P26: 1.27 | S26: 1.7 | T26: 2.4300000000000002 | U26: 34 | V26: 1.39 | W26: 1.58
A27: 9 PM | C27: 1.39 | D27: 1.39 | E27: 1.31 | F27: 1.34 | G27: 1.3 | H27: 1.29 | I27: 1.26 | J27: 1.38 | K27: 1.48 | L27: 1.37 | M27: 1.37 | N27: 1.33 | O27: 1.34 | P27: 1.29 | S27: 2.19 | T27: 2.34 | U27: 34 | V27: 1.51 | W27: 1.51
A28: 10 PM | C28: 1.57 | D28: 1.4 | E28: 1.31 | F28: 1.33 | G28: 1.31 | H28: 1.29 | I28: 1.25 | J28: 1.34 | K28: 1.45 | L28: 1.39 | M28: 1.36 | N28: 1.35 | O28: 1.35 | P28: 1.3 | S28: 2 | T28: 2.62 | U28: 34 | V28: 1.39 | W28: 1.51
A29: 11 PM | C29: 1.41 | D29: 1.39 | E29: 1.3 | F29: 1.34 | G29: 1.32 | H29: 1.29 | I29: 1.25 | J29: 1.39 | K29: 1.49 | L29: 1.38 | M29: 1.39 | N29: 1.37 | O29: 1.35 | P29: 1.3 | S29: 2 | T29: 2.62 | U29: 68 | V29: 1.51 | W29: 1.48
C30: =AVERAGE(R[-24]C:R[-1]C,R[-24]C[7]:R[-1]C[7],R[-24]C[14]:R[-1]C[14],R[-24]C[21]:R[-1]C[21]) -> 1.415 | D30: =AVERAGE(R[-24]C:R[-1]C,R[-24]C[7]:R[-1]C[7],R[-24]C[14]:R[-1]C[14],R[-24]C[21]:R[-1]C[21]) -> 1.409375 | E30: =AVERAGE(R[-24]C:R[-1]C,R[-24]C[7]:R[-1]C[7],R[-24]C[14]:R[-1]C[14],R[-24]C[21]:R[-1]C[21]) -> 1.6422222222222222 | F30: =AVERAGE(R[-24]C:R[-1]C,R[-24]C[7]:R[-1]C[7],R[-24]C[14]:R[-1]C[14],R[-24]C[21]:R[-1]C[21]) -> 1.6320833333333338 | G30: =AVERAGE(R[-24]C:R[-1]C,R[-24]C[7]:R[-1]C[7],R[-24]C[14]:R[-1]C[14],R[-24]C[21]:R[-1]C[21]) -> 12.668194444444445 | H30: =AVERAGE(R[-24]C:R[-1]C,R[-24]C[7]:R[-1]C[7],R[-24]C[14]:R[-1]C[14],R[-24]C[21]:R[-1]C[21]) -> 1.3237500000000002 | I30: =AVERAGE(R[-24]C:R[-1]C,R[-24]C[7]:R[-1]C[7],R[-24]C[14]:R[-1]C[14],R[-24]C[21]:R[-1]C[21]) -> 1.329583333333334
C33: Northbound | J33: Southbound | Q33: Eastbound
C34: NPMRDS from HERE (Trucks and passenger vehicles) | J34: NPMRDS from HERE (Trucks and passenger vehicles) | Q34: NPMRDS from HERE (Trucks and passenger vehicles)
C35: 2011 (Every weekday) | D35: 2012 (Every weekday) | E35: 2013 (Every weekday) | F35: 2014 (Every weekday) | G35: 2015 (Every weekday) | H35: 2016 (Every weekday) | I35: 2017 (Every weekday) | J35: 2011 (Every weekday) | K35: 2012 (Every weekday) | L35: 2013 (Every weekday) | M35: 2014 (Every weekday) | N35: 2015 (Every weekday) | O35: 2016 (Every weekday) | P35: 2017 (Every weekday) | Q35: 2011 (Every weekday) | R35: 2012 (Every weekday) | S35: 2013 (Every weekday) | T35: 2014 (Every weekday) | U35: 2015 (Every weekday) | V35: 2016 (Every weekday) | W35: 2017 (Every weekday)
C36: =RANK(R[-30]C,R6C:R29C) -> 20 | D36: =RANK(R[-30]C,R6C:R29C) -> 16 | E36: =RANK(R[-30]C,R6C:R29C) -> 6 | F36: =RANK(R[-30]C,R6C:R29C) -> 10 | G36: =RANK(R[-30]C,R6C:R29C) -> 7 | H36: =RANK(R[-30]C,R6C:R29C) -> 3 | I36: =RANK(R[-30]C,R6C:R29C) -> 5 | J36: =RANK(R[-30]C,R6C:R29C) -> 4 | K36: =RANK(R[-30]C,R6C:R29C) -> 4 | L36: =RANK(R[-30]C,R6C:R29C) -> 9 | M36: =RANK(R[-30]C,R6C:R29C) -> 2 | N36: =RANK(R[-30]C,R6C:R29C) -> 2 | O36: =RANK(R[-30]C,R6C:R29C) -> 1 | P36: =RANK(R[-30]C,R6C:R29C) -> 4 | Q36: =RANK(R[-30]C,R6C:R29C) -> #VALUE! | R36: =RANK(R[-30]C,R6C:R29C) -> #VALUE! | S36: =RANK(R[-30]C,R6C:R29C) -> 11 | T36: =RANK(R[-30]C,R6C:R29C) -> 2 | U36: =RANK(R[-30]C,R6C:R29C) -> 2 | V36: =RANK(R[-30]C,R6C:R29C) -> 9 | W36: =RANK(R[-30]C,R6C:R29C) -> 7
C37: =RANK(R[-30]C,R6C:R29C) -> 18 | D37: =RANK(R[-30]C,R6C:R29C) -> 11 | E37: =RANK(R[-30]C,R6C:R29C) -> 12 | F37: =RANK(R[-30]C,R6C:R29C) -> 5 | G37: =RANK(R[-30]C,R6C:R29C) -> 7 | H37: =RANK(R[-30]C,R6C:R29C) -> 7 | I37: =RANK(R[-30]C,R6C:R29C) -> 5 | J37: =RANK(R[-30]C,R6C:R29C) -> 10 | K37: =RANK(R[-30]C,R6C:R29C) -> 1 | L37: =RANK(R[-30]C,R6C:R29C) -> 9 | M37: =RANK(R[-30]C,R6C:R29C) -> 1 | N37: =RANK(R[-30]C,R6C:R29C) -> 2 | O37: =RANK(R[-30]C,R6C:R29C) -> 4 | P37: =RANK(R[-30]C,R6C:R29C) -> 4 | Q37: =RANK(R[-30]C,R6C:R29C) -> #VALUE! | R37: =RANK(R[-30]C,R6C:R29C) -> #VALUE! | S37: =RANK(R[-30]C,R6C:R29C) -> 4 | T37: =RANK(R[-30]C,R6C:R29C) -> 3 | U37: =RANK(R[-30]C,R6C:R29C) -> 2 | V37: =RANK(R[-30]C,R6C:R29C) -> 4 | W37: =RANK(R[-30]C,R6C:R29C) -> 9
C38: =RANK(R[-30]C,R6C:R29C) -> 15 | D38: =RANK(R[-30]C,R6C:R29C) -> 11 | E38: =RANK(R[-30]C,R6C:R29C) -> 12 | F38: =RANK(R[-30]C,R6C:R29C) -> 5 | G38: =RANK(R[-30]C,R6C:R29C) -> 5 | H38: =RANK(R[-30]C,R6C:R29C) -> 8 | I38: =RANK(R[-30]C,R6C:R29C) -> 9 | J38: =RANK(R[-30]C,R6C:R29C) -> 7 | K38: =RANK(R[-30]C,R6C:R29C) -> 6 | L38: =RANK(R[-30]C,R6C:R29C) -> 12 | M38: =RANK(R[-30]C,R6C:R29C) -> 5 | N38: =RANK(R[-30]C,R6C:R29C) -> 5 | O38: =RANK(R[-30]C,R6C:R29C) -> 6 | P38: =RANK(R[-30]C,R6C:R29C) -> 4 | Q38: =RANK(R[-30]C,R6C:R29C) -> #VALUE! | R38: =RANK(R[-30]C,R6C:R29C) -> #VALUE! | S38: =RANK(R[-30]C,R6C:R29C) -> 23 | T38: =RANK(R[-30]C,R6C:R29C) -> 19 | U38: =RANK(R[-30]C,R6C:R29C) -> 2 | V38: =RANK(R[-30]C,R6C:R29C) -> 2 | W38: =RANK(R[-30]C,R6C:R29C) -> 9
C39: =RANK(R[-30]C,R6C:R29C) -> 22 | D39: =RANK(R[-30]C,R6C:R29C) -> 14 | E39: =RANK(R[-30]C,R6C:R29C) -> 15 | F39: =RANK(R[-30]C,R6C:R29C) -> 5 | G39: =RANK(R[-30]C,R6C:R29C) -> 7 | H39: =RANK(R[-30]C,R6C:R29C) -> 11 | I39: =RANK(R[-30]C,R6C:R29C) -> 9 | J39: =RANK(R[-30]C,R6C:R29C) -> 10 | K39: =RANK(R[-30]C,R6C:R29C) -> 10 | L39: =RANK(R[-30]C,R6C:R29C) -> 17 | M39: =RANK(R[-30]C,R6C:R29C) -> 3 | N39: =RANK(R[-30]C,R6C:R29C) -> 6 | O39: =RANK(R[-30]C,R6C:R29C) -> 8 | P39: =RANK(R[-30]C,R6C:R29C) -> 7 | Q39: =RANK(R[-30]C,R6C:R29C) -> #VALUE! | R39: =RANK(R[-30]C,R6C:R29C) -> #VALUE! | S39: =RANK(R[-30]C,R6C:R29C) -> 1 | T39: =RANK(R[-30]C,R6C:R29C) -> 10 | U39: =RANK(R[-30]C,R6C:R29C) -> 2 | V39: =RANK(R[-30]C,R6C:R29C) -> 2 | W39: =RANK(R[-30]C,R6C:R29C) -> 9
C40: =RANK(R[-30]C,R6C:R29C) -> 7 | D40: =RANK(R[-30]C,R6C:R29C) -> 11 | E40: =RANK(R[-30]C,R6C:R29C) -> 15 | F40: =RANK(R[-30]C,R6C:R29C) -> 13 | G40: =RANK(R[-30]C,R6C:R29C) -> 14 | H40: =RANK(R[-30]C,R6C:R29C) -> 13 | I40: =RANK(R[-30]C,R6C:R29C) -> 15 | J40: =RANK(R[-30]C,R6C:R29C) -> 10 | K40: =RANK(R[-30]C,R6C:R29C) -> 7 | L40: =RANK(R[-30]C,R6C:R29C) -> 13 | M40: =RANK(R[-30]C,R6C:R29C) -> 7 | N40: =RANK(R[-30]C,R6C:R29C) -> 10 | O40: =RANK(R[-30]C,R6C:R29C) -> 10 | P40: =RANK(R[-30]C,R6C:R29C) -> 7 | Q40: =RANK(R[-30]C,R6C:R29C) -> #VALUE! | R40: =RANK(R[-30]C,R6C:R29C) -> #VALUE! | S40: =RANK(R[-30]C,R6C:R29C) -> 1 | T40: =RANK(R[-30]C,R6C:R29C) -> 1 | U40: =RANK(R[-30]C,R6C:R29C) -> 2 | V40: =RANK(R[-30]C,R6C:R29C) -> 1 | W40: =RANK(R[-30]C,R6C:R29C) -> 15
C41: =RANK(R[-30]C,R6C:R29C) -> 5 | D41: =RANK(R[-30]C,R6C:R29C) -> 5 | E41: =RANK(R[-30]C,R6C:R29C) -> 12 | F41: =RANK(R[-30]C,R6C:R29C) -> 16 | G41: =RANK(R[-30]C,R6C:R29C) -> 15 | H41: =RANK(R[-30]C,R6C:R29C) -> 16 | I41: =RANK(R[-30]C,R6C:R29C) -> 15 | J41: =RANK(R[-30]C,R6C:R29C) -> 4 | K41: =RANK(R[-30]C,R6C:R29C) -> 8 | L41: =RANK(R[-30]C,R6C:R29C) -> 17 | M41: =RANK(R[-30]C,R6C:R29C) -> 5 | N41: =RANK(R[-30]C,R6C:R29C) -> 9 | O41: =RANK(R[-30]C,R6C:R29C) -> 12 | P41: =RANK(R[-30]C,R6C:R29C) -> 13 | Q41: =RANK(R[-30]C,R6C:R29C) -> #VALUE! | R41: =RANK(R[-30]C,R6C:R29C) -> #VALUE! | S41: =RANK(R[-30]C,R6C:R29C) -> 6 | T41: =RANK(R[-30]C,R6C:R29C) -> 18 | U41: =RANK(R[-30]C,R6C:R29C) -> 2 | V41: =RANK(R[-30]C,R6C:R29C) -> 9 | W41: =RANK(R[-30]C,R6C:R29C) -> 21
C42: =RANK(R[-30]C,R6C:R29C) -> 8 | D42: =RANK(R[-30]C,R6C:R29C) -> 16 | E42: =RANK(R[-30]C,R6C:R29C) -> 20 | F42: =RANK(R[-30]C,R6C:R29C) -> 21 | G42: =RANK(R[-30]C,R6C:R29C) -> 17 | H42: =RANK(R[-30]C,R6C:R29C) -> 17 | I42: =RANK(R[-30]C,R6C:R29C) -> 15 | J42: =RANK(R[-30]C,R6C:R29C) -> 17 | K42: =RANK(R[-30]C,R6C:R29C) -> 16 | L42: =RANK(R[-30]C,R6C:R29C) -> 24 | M42: =RANK(R[-30]C,R6C:R29C) -> 14 | N42: =RANK(R[-30]C,R6C:R29C) -> 19 | O42: =RANK(R[-30]C,R6C:R29C) -> 15 | P42: =RANK(R[-30]C,R6C:R29C) -> 15 | Q42: =RANK(R[-30]C,R6C:R29C) -> #VALUE! | R42: =RANK(R[-30]C,R6C:R29C) -> #VALUE! | S42: =RANK(R[-30]C,R6C:R29C) -> 6 | T42: =RANK(R[-30]C,R6C:R29C) -> 22 | U42: =RANK(R[-30]C,R6C:R29C) -> 2 | V42: =RANK(R[-30]C,R6C:R29C) -> 12 | W42: =RANK(R[-30]C,R6C:R29C) -> 22
C43: =RANK(R[-30]C,R6C:R29C) -> 1 | D43: =RANK(R[-30]C,R6C:R29C) -> 2 | E43: =RANK(R[-30]C,R6C:R29C) -> 2 | F43: =RANK(R[-30]C,R6C:R29C) -> 2 | G43: =RANK(R[-30]C,R6C:R29C) -> 2 | H43: =RANK(R[-30]C,R6C:R29C) -> 1 | I43: =RANK(R[-30]C,R6C:R29C) -> 1 | J43: =RANK(R[-30]C,R6C:R29C) -> 7 | K43: =RANK(R[-30]C,R6C:R29C) -> 10 | L43: =RANK(R[-30]C,R6C:R29C) -> 17 | M43: =RANK(R[-30]C,R6C:R29C) -> 17 | N43: =RANK(R[-30]C,R6C:R29C) -> 16 | O43: =RANK(R[-30]C,R6C:R29C) -> 15 | P43: =RANK(R[-30]C,R6C:R29C) -> 19 | Q43: =RANK(R[-30]C,R6C:R29C) -> #VALUE! | R43: =RANK(R[-30]C,R6C:R29C) -> #VALUE! | S43: =RANK(R[-30]C,R6C:R29C) -> 23 | T43: =RANK(R[-30]C,R6C:R29C) -> 23 | U43: =RANK(R[-30]C,R6C:R29C) -> 2 | V43: =RANK(R[-30]C,R6C:R29C) -> 23 | W43: =RANK(R[-30]C,R6C:R29C) -> 24
C44: =RANK(R[-30]C,R6C:R29C) -> 2 | D44: =RANK(R[-30]C,R6C:R29C) -> 1 | E44: =RANK(R[-30]C,R6C:R29C) -> 1 | F44: =RANK(R[-30]C,R6C:R29C) -> 1 | G44: =RANK(R[-30]C,R6C:R29C) -> 1 | H44: =RANK(R[-30]C,R6C:R29C) -> 2 | I44: =RANK(R[-30]C,R6C:R29C) -> 2 | J44: =RANK(R[-30]C,R6C:R29C) -> 10 | K44: =RANK(R[-30]C,R6C:R29C) -> 10 | L44: =RANK(R[-30]C,R6C:R29C) -> 1 | M44: =RANK(R[-30]C,R6C:R29C) -> 22 | N44: =RANK(R[-30]C,R6C:R29C) -> 16 | O44: =RANK(R[-30]C,R6C:R29C) -> 15 | P44: =RANK(R[-30]C,R6C:R29C) -> 19 | Q44: =RANK(R[-30]C,R6C:R29C) -> #VALUE! | R44: =RANK(R[-30]C,R6C:R29C) -> #VALUE! | S44: =RANK(R[-30]C,R6C:R29C) -> 11 | T44: =RANK(R[-30]C,R6C:R29C) -> 23 | U44: =RANK(R[-30]C,R6C:R29C) -> 2 | V44: =RANK(R[-30]C,R6C:R29C) -> 12 | W44: =RANK(R[-30]C,R6C:R29C) -> 22
C45: =RANK(R[-30]C,R6C:R29C) -> 5 | D45: =RANK(R[-30]C,R6C:R29C) -> 3 | E45: =RANK(R[-30]C,R6C:R29C) -> 15 | F45: =RANK(R[-30]C,R6C:R29C) -> 16 | G45: =RANK(R[-30]C,R6C:R29C) -> 17 | H45: =RANK(R[-30]C,R6C:R29C) -> 17 | I45: =RANK(R[-30]C,R6C:R29C) -> 15 | J45: =RANK(R[-30]C,R6C:R29C) -> 10 | K45: =RANK(R[-30]C,R6C:R29C) -> 10 | L45: =RANK(R[-30]C,R6C:R29C) -> 7 | M45: =RANK(R[-30]C,R6C:R29C) -> 17 | N45: =RANK(R[-30]C,R6C:R29C) -> 21 | O45: =RANK(R[-30]C,R6C:R29C) -> 20 | P45: =RANK(R[-30]C,R6C:R29C) -> 19 | Q45: =RANK(R[-30]C,R6C:R29C) -> #VALUE! | R45: =RANK(R[-30]C,R6C:R29C) -> #VALUE! | S45: =RANK(R[-30]C,R6C:R29C) -> 19 | T45: =RANK(R[-30]C,R6C:R29C) -> 17 | U45: =RANK(R[-30]C,R6C:R29C) -> 2 | V45: =RANK(R[-30]C,R6C:R29C) -> 12 | W45: =RANK(R[-30]C,R6C:R29C) -> 20
C46: =RANK(R[-30]C,R6C:R29C) -> 15 | D46: =RANK(R[-30]C,R6C:R29C) -> 14 | E46: =RANK(R[-30]C,R6C:R29C) -> 18 | F46: =RANK(R[-30]C,R6C:R29C) -> 21 | G46: =RANK(R[-30]C,R6C:R29C) -> 17 | H46: =RANK(R[-30]C,R6C:R29C) -> 17 | I46: =RANK(R[-30]C,R6C:R29C) -> 15 | J46: =RANK(R[-30]C,R6C:R29C) -> 17 | K46: =RANK(R[-30]C,R6C:R29C) -> 19 | L46: =RANK(R[-30]C,R6C:R29C) -> 5 | M46: =RANK(R[-30]C,R6C:R29C) -> 17 | N46: =RANK(R[-30]C,R6C:R29C) -> 21 | O46: =RANK(R[-30]C,R6C:R29C) -> 15 | P46: =RANK(R[-30]C,R6C:R29C) -> 19 | Q46: =RANK(R[-30]C,R6C:R29C) -> #VALUE! | R46: =RANK(R[-30]C,R6C:R29C) -> #VALUE! | S46: =RANK(R[-30]C,R6C:R29C) -> 3 | T46: =RANK(R[-30]C,R6C:R29C) -> 20 | U46: =RANK(R[-30]C,R6C:R29C) -> 2 | V46: =RANK(R[-30]C,R6C:R29C) -> 4 | W46: =RANK(R[-30]C,R6C:R29C) -> 19
C47: =RANK(R[-30]C,R6C:R29C) -> 11 | D47: =RANK(R[-30]C,R6C:R29C) -> 16 | E47: =RANK(R[-30]C,R6C:R29C) -> 18 | F47: =RANK(R[-30]C,R6C:R29C) -> 21 | G47: =RANK(R[-30]C,R6C:R29C) -> 21 | H47: =RANK(R[-30]C,R6C:R29C) -> 17 | I47: =RANK(R[-30]C,R6C:R29C) -> 15 | J47: =RANK(R[-30]C,R6C:R29C) -> 24 | K47: =RANK(R[-30]C,R6C:R29C) -> 16 | L47: =RANK(R[-30]C,R6C:R29C) -> 13 | M47: =RANK(R[-30]C,R6C:R29C) -> 14 | N47: =RANK(R[-30]C,R6C:R29C) -> 16 | O47: =RANK(R[-30]C,R6C:R29C) -> 20 | P47: =RANK(R[-30]C,R6C:R29C) -> 15 | Q47: =RANK(R[-30]C,R6C:R29C) -> #VALUE! | R47: =RANK(R[-30]C,R6C:R29C) -> #VALUE! | S47: =RANK(R[-30]C,R6C:R29C) -> 6 | T47: =RANK(R[-30]C,R6C:R29C) -> 8 | U47: =RANK(R[-30]C,R6C:R29C) -> 2 | V47: =RANK(R[-30]C,R6C:R29C) -> 12 | W47: =RANK(R[-30]C,R6C:R29C) -> 17
C48: =RANK(R[-30]C,R6C:R29C) -> 23 | D48: =RANK(R[-30]C,R6C:R29C) -> 22 | E48: =RANK(R[-30]C,R6C:R29C) -> 22 | F48: =RANK(R[-30]C,R6C:R29C) -> 8 | G48: =RANK(R[-30]C,R6C:R29C) -> 21 | H48: =RANK(R[-30]C,R6C:R29C) -> 17 | I48: =RANK(R[-30]C,R6C:R29C) -> 15 | J48: =RANK(R[-30]C,R6C:R29C) -> 20 | K48: =RANK(R[-30]C,R6C:R29C) -> 19 | L48: =RANK(R[-30]C,R6C:R29C) -> 15 | M48: =RANK(R[-30]C,R6C:R29C) -> 12 | N48: =RANK(R[-30]C,R6C:R29C) -> 10 | O48: =RANK(R[-30]C,R6C:R29C) -> 20 | P48: =RANK(R[-30]C,R6C:R29C) -> 19 | Q48: =RANK(R[-30]C,R6C:R29C) -> #VALUE! | R48: =RANK(R[-30]C,R6C:R29C) -> #VALUE! | S48: =RANK(R[-30]C,R6C:R29C) -> 17 | T48: =RANK(R[-30]C,R6C:R29C) -> 20 | U48: =RANK(R[-30]C,R6C:R29C) -> 2 | V48: =RANK(R[-30]C,R6C:R29C) -> 12 | W48: =RANK(R[-30]C,R6C:R29C) -> 17
C49: =RANK(R[-30]C,R6C:R29C) -> 18 | D49: =RANK(R[-30]C,R6C:R29C) -> 19 | E49: =RANK(R[-30]C,R6C:R29C) -> 20 | F49: =RANK(R[-30]C,R6C:R29C) -> 4 | G49: =RANK(R[-30]C,R6C:R29C) -> 17 | H49: =RANK(R[-30]C,R6C:R29C) -> 22 | I49: =RANK(R[-30]C,R6C:R29C) -> 15 | J49: =RANK(R[-30]C,R6C:R29C) -> 20 | K49: =RANK(R[-30]C,R6C:R29C) -> 19 | L49: =RANK(R[-30]C,R6C:R29C) -> 21 | M49: =RANK(R[-30]C,R6C:R29C) -> 12 | N49: =RANK(R[-30]C,R6C:R29C) -> 10 | O49: =RANK(R[-30]C,R6C:R29C) -> 15 | P49: =RANK(R[-30]C,R6C:R29C) -> 19 | Q49: =RANK(R[-30]C,R6C:R29C) -> #VALUE! | R49: =RANK(R[-30]C,R6C:R29C) -> #VALUE! | S49: =RANK(R[-30]C,R6C:R29C) -> 20 | T49: =RANK(R[-30]C,R6C:R29C) -> 10 | U49: =RANK(R[-30]C,R6C:R29C) -> 2 | V49: =RANK(R[-30]C,R6C:R29C) -> 4 | W49: =RANK(R[-30]C,R6C:R29C) -> 15
C50: =RANK(R[-30]C,R6C:R29C) -> 11 | D50: =RANK(R[-30]C,R6C:R29C) -> 19 | E50: =RANK(R[-30]C,R6C:R29C) -> 22 | F50: =RANK(R[-30]C,R6C:R29C) -> 16 | G50: =RANK(R[-30]C,R6C:R29C) -> 21 | H50: =RANK(R[-30]C,R6C:R29C) -> 22 | I50: =RANK(R[-30]C,R6C:R29C) -> 15 | J50: =RANK(R[-30]C,R6C:R29C) -> 10 | K50: =RANK(R[-30]C,R6C:R29C) -> 23 | L50: =RANK(R[-30]C,R6C:R29C) -> 17 | M50: =RANK(R[-30]C,R6C:R29C) -> 17 | N50: =RANK(R[-30]C,R6C:R29C) -> 19 | O50: =RANK(R[-30]C,R6C:R29C) -> 20 | P50: =RANK(R[-30]C,R6C:R29C) -> 15 | Q50: =RANK(R[-30]C,R6C:R29C) -> #VALUE! | R50: =RANK(R[-30]C,R6C:R29C) -> #VALUE! | S50: =RANK(R[-30]C,R6C:R29C) -> 21 | T50: =RANK(R[-30]C,R6C:R29C) -> 10 | U50: =RANK(R[-30]C,R6C:R29C) -> 2 | V50: =RANK(R[-30]C,R6C:R29C) -> 12 | W50: =RANK(R[-30]C,R6C:R29C) -> 7
C51: =RANK(R[-30]C,R6C:R29C) -> 23 | D51: =RANK(R[-30]C,R6C:R29C) -> 24 | E51: =RANK(R[-30]C,R6C:R29C) -> 24 | F51: =RANK(R[-30]C,R6C:R29C) -> 24 | G51: =RANK(R[-30]C,R6C:R29C) -> 24 | H51: =RANK(R[-30]C,R6C:R29C) -> 22 | I51: =RANK(R[-30]C,R6C:R29C) -> 15 | J51: =RANK(R[-30]C,R6C:R29C) -> 20 | K51: =RANK(R[-30]C,R6C:R29C) -> 23 | L51: =RANK(R[-30]C,R6C:R29C) -> 23 | M51: =RANK(R[-30]C,R6C:R29C) -> 23 | N51: =RANK(R[-30]C,R6C:R29C) -> 24 | O51: =RANK(R[-30]C,R6C:R29C) -> 20 | P51: =RANK(R[-30]C,R6C:R29C) -> 15 | Q51: =RANK(R[-30]C,R6C:R29C) -> #VALUE! | R51: =RANK(R[-30]C,R6C:R29C) -> #VALUE! | S51: =RANK(R[-30]C,R6C:R29C) -> 6 | T51: =RANK(R[-30]C,R6C:R29C) -> 10 | U51: =RANK(R[-30]C,R6C:R29C) -> 2 | V51: =RANK(R[-30]C,R6C:R29C) -> 12 | W51: =RANK(R[-30]C,R6C:R29C) -> 4
C52: =RANK(R[-30]C,R6C:R29C) -> 20 | D52: =RANK(R[-30]C,R6C:R29C) -> 22 | E52: =RANK(R[-30]C,R6C:R29C) -> 4 | F52: =RANK(R[-30]C,R6C:R29C) -> 19 | G52: =RANK(R[-30]C,R6C:R29C) -> 15 | H52: =RANK(R[-30]C,R6C:R29C) -> 13 | I52: =RANK(R[-30]C,R6C:R29C) -> 14 | J52: =RANK(R[-30]C,R6C:R29C) -> 10 | K52: =RANK(R[-30]C,R6C:R29C) -> 19 | L52: =RANK(R[-30]C,R6C:R29C) -> 21 | M52: =RANK(R[-30]C,R6C:R29C) -> 23 | N52: =RANK(R[-30]C,R6C:R29C) -> 21 | O52: =RANK(R[-30]C,R6C:R29C) -> 14 | P52: =RANK(R[-30]C,R6C:R29C) -> 13 | Q52: =RANK(R[-30]C,R6C:R29C) -> #VALUE! | R52: =RANK(R[-30]C,R6C:R29C) -> #VALUE! | S52: =RANK(R[-30]C,R6C:R29C) -> 4 | T52: =RANK(R[-30]C,R6C:R29C) -> 10 | U52: =RANK(R[-30]C,R6C:R29C) -> 2 | V52: =RANK(R[-30]C,R6C:R29C) -> 23 | W52: =RANK(R[-30]C,R6C:R29C) -> 2
C53: =RANK(R[-30]C,R6C:R29C) -> 4 | D53: =RANK(R[-30]C,R6C:R29C) -> 3 | E53: =RANK(R[-30]C,R6C:R29C) -> 3 | F53: =RANK(R[-30]C,R6C:R29C) -> 3 | G53: =RANK(R[-30]C,R6C:R29C) -> 3 | H53: =RANK(R[-30]C,R6C:R29C) -> 8 | I53: =RANK(R[-30]C,R6C:R29C) -> 3 | J53: =RANK(R[-30]C,R6C:R29C) -> 1 | K53: =RANK(R[-30]C,R6C:R29C) -> 10 | L53: =RANK(R[-30]C,R6C:R29C) -> 16 | M53: =RANK(R[-30]C,R6C:R29C) -> 17 | N53: =RANK(R[-30]C,R6C:R29C) -> 15 | O53: =RANK(R[-30]C,R6C:R29C) -> 13 | P53: =RANK(R[-30]C,R6C:R29C) -> 7 | Q53: =RANK(R[-30]C,R6C:R29C) -> #VALUE! | R53: =RANK(R[-30]C,R6C:R29C) -> #VALUE! | S53: =RANK(R[-30]C,R6C:R29C) -> 6 | T53: =RANK(R[-30]C,R6C:R29C) -> 8 | U53: =RANK(R[-30]C,R6C:R29C) -> 2 | V53: =RANK(R[-30]C,R6C:R29C) -> 9 | W53: =RANK(R[-30]C,R6C:R29C) -> 1
C54: =RANK(R[-30]C,R6C:R29C) -> 8 | D54: =RANK(R[-30]C,R6C:R29C) -> 19 | E54: =RANK(R[-30]C,R6C:R29C) -> 6 | F54: =RANK(R[-30]C,R6C:R29C) -> 8 | G54: =RANK(R[-30]C,R6C:R29C) -> 11 | H54: =RANK(R[-30]C,R6C:R29C) -> 13 | I54: =RANK(R[-30]C,R6C:R29C) -> 13 | J54: =RANK(R[-30]C,R6C:R29C) -> 2 | K54: =RANK(R[-30]C,R6C:R29C) -> 9 | L54: =RANK(R[-30]C,R6C:R29C) -> 2 | M54: =RANK(R[-30]C,R6C:R29C) -> 14 | N54: =RANK(R[-30]C,R6C:R29C) -> 10 | O54: =RANK(R[-30]C,R6C:R29C) -> 10 | P54: =RANK(R[-30]C,R6C:R29C) -> 12 | Q54: =RANK(R[-30]C,R6C:R29C) -> #VALUE! | R54: =RANK(R[-30]C,R6C:R29C) -> #VALUE! | S54: =RANK(R[-30]C,R6C:R29C) -> 11 | T54: =RANK(R[-30]C,R6C:R29C) -> 10 | U54: =RANK(R[-30]C,R6C:R29C) -> 2 | V54: =RANK(R[-30]C,R6C:R29C) -> 12 | W54: =RANK(R[-30]C,R6C:R29C) -> 2
C55: =RANK(R[-30]C,R6C:R29C) -> 8 | D55: =RANK(R[-30]C,R6C:R29C) -> 8 | E55: =RANK(R[-30]C,R6C:R29C) -> 6 | F55: =RANK(R[-30]C,R6C:R29C) -> 19 | G55: =RANK(R[-30]C,R6C:R29C) -> 13 | H55: =RANK(R[-30]C,R6C:R29C) -> 12 | I55: =RANK(R[-30]C,R6C:R29C) -> 9 | J55: =RANK(R[-30]C,R6C:R29C) -> 3 | K55: =RANK(R[-30]C,R6C:R29C) -> 16 | L55: =RANK(R[-30]C,R6C:R29C) -> 2 | M55: =RANK(R[-30]C,R6C:R29C) -> 10 | N55: =RANK(R[-30]C,R6C:R29C) -> 10 | O55: =RANK(R[-30]C,R6C:R29C) -> 9 | P55: =RANK(R[-30]C,R6C:R29C) -> 7 | Q55: =RANK(R[-30]C,R6C:R29C) -> #VALUE! | R55: =RANK(R[-30]C,R6C:R29C) -> #VALUE! | S55: =RANK(R[-30]C,R6C:R29C) -> 17 | T55: =RANK(R[-30]C,R6C:R29C) -> 10 | U55: =RANK(R[-30]C,R6C:R29C) -> 2 | V55: =RANK(R[-30]C,R6C:R29C) -> 12 | W55: =RANK(R[-30]C,R6C:R29C) -> 4
C56: =RANK(R[-30]C,R6C:R29C) -> 11 | D56: =RANK(R[-30]C,R6C:R29C) -> 5 | E56: =RANK(R[-30]C,R6C:R29C) -> 5 | F56: =RANK(R[-30]C,R6C:R29C) -> 13 | G56: =RANK(R[-30]C,R6C:R29C) -> 11 | H56: =RANK(R[-30]C,R6C:R29C) -> 8 | I56: =RANK(R[-30]C,R6C:R29C) -> 9 | J56: =RANK(R[-30]C,R6C:R29C) -> 17 | K56: =RANK(R[-30]C,R6C:R29C) -> 10 | L56: =RANK(R[-30]C,R6C:R29C) -> 2 | M56: =RANK(R[-30]C,R6C:R29C) -> 10 | N56: =RANK(R[-30]C,R6C:R29C) -> 8 | O56: =RANK(R[-30]C,R6C:R29C) -> 6 | P56: =RANK(R[-30]C,R6C:R29C) -> 7 | Q56: =RANK(R[-30]C,R6C:R29C) -> #VALUE! | R56: =RANK(R[-30]C,R6C:R29C) -> #VALUE! | S56: =RANK(R[-30]C,R6C:R29C) -> 22 | T56: =RANK(R[-30]C,R6C:R29C) -> 6 | U56: =RANK(R[-30]C,R6C:R29C) -> 2 | V56: =RANK(R[-30]C,R6C:R29C) -> 12 | W56: =RANK(R[-30]C,R6C:R29C) -> 4
C57: =RANK(R[-30]C,R6C:R29C) -> 15 | D57: =RANK(R[-30]C,R6C:R29C) -> 8 | E57: =RANK(R[-30]C,R6C:R29C) -> 6 | F57: =RANK(R[-30]C,R6C:R29C) -> 10 | G57: =RANK(R[-30]C,R6C:R29C) -> 7 | H57: =RANK(R[-30]C,R6C:R29C) -> 3 | I57: =RANK(R[-30]C,R6C:R29C) -> 4 | J57: =RANK(R[-30]C,R6C:R29C) -> 7 | K57: =RANK(R[-30]C,R6C:R29C) -> 3 | L57: =RANK(R[-30]C,R6C:R29C) -> 9 | M57: =RANK(R[-30]C,R6C:R29C) -> 7 | N57: =RANK(R[-30]C,R6C:R29C) -> 6 | O57: =RANK(R[-30]C,R6C:R29C) -> 4 | P57: =RANK(R[-30]C,R6C:R29C) -> 3 | Q57: =RANK(R[-30]C,R6C:R29C) -> #VALUE! | R57: =RANK(R[-30]C,R6C:R29C) -> #VALUE! | S57: =RANK(R[-30]C,R6C:R29C) -> 11 | T57: =RANK(R[-30]C,R6C:R29C) -> 7 | U57: =RANK(R[-30]C,R6C:R29C) -> 2 | V57: =RANK(R[-30]C,R6C:R29C) -> 4 | W57: =RANK(R[-30]C,R6C:R29C) -> 9
C58: =RANK(R[-30]C,R6C:R29C) -> 3 | D58: =RANK(R[-30]C,R6C:R29C) -> 5 | E58: =RANK(R[-30]C,R6C:R29C) -> 6 | F58: =RANK(R[-30]C,R6C:R29C) -> 13 | G58: =RANK(R[-30]C,R6C:R29C) -> 5 | H58: =RANK(R[-30]C,R6C:R29C) -> 3 | I58: =RANK(R[-30]C,R6C:R29C) -> 5 | J58: =RANK(R[-30]C,R6C:R29C) -> 20 | K58: =RANK(R[-30]C,R6C:R29C) -> 5 | L58: =RANK(R[-30]C,R6C:R29C) -> 5 | M58: =RANK(R[-30]C,R6C:R29C) -> 9 | N58: =RANK(R[-30]C,R6C:R29C) -> 2 | O58: =RANK(R[-30]C,R6C:R29C) -> 1 | P58: =RANK(R[-30]C,R6C:R29C) -> 1 | Q58: =RANK(R[-30]C,R6C:R29C) -> #VALUE! | R58: =RANK(R[-30]C,R6C:R29C) -> #VALUE! | S58: =RANK(R[-30]C,R6C:R29C) -> 15 | T58: =RANK(R[-30]C,R6C:R29C) -> 3 | U58: =RANK(R[-30]C,R6C:R29C) -> 2 | V58: =RANK(R[-30]C,R6C:R29C) -> 12 | W58: =RANK(R[-30]C,R6C:R29C) -> 9
C59: =RANK(R[-30]C,R6C:R29C) -> 11 | D59: =RANK(R[-30]C,R6C:R29C) -> 8 | E59: =RANK(R[-30]C,R6C:R29C) -> 11 | F59: =RANK(R[-30]C,R6C:R29C) -> 10 | G59: =RANK(R[-30]C,R6C:R29C) -> 4 | H59: =RANK(R[-30]C,R6C:R29C) -> 3 | I59: =RANK(R[-30]C,R6C:R29C) -> 5 | J59: =RANK(R[-30]C,R6C:R29C) -> 4 | K59: =RANK(R[-30]C,R6C:R29C) -> 1 | L59: =RANK(R[-30]C,R6C:R29C) -> 7 | M59: =RANK(R[-30]C,R6C:R29C) -> 3 | N59: =RANK(R[-30]C,R6C:R29C) -> 1 | O59: =RANK(R[-30]C,R6C:R29C) -> 1 | P59: =RANK(R[-30]C,R6C:R29C) -> 1 | Q59: =RANK(R[-30]C,R6C:R29C) -> #VALUE! | R59: =RANK(R[-30]C,R6C:R29C) -> #VALUE! | S59: =RANK(R[-30]C,R6C:R29C) -> 15 | T59: =RANK(R[-30]C,R6C:R29C) -> 3 | U59: =RANK(R[-30]C,R6C:R29C) -> 1 | V59: =RANK(R[-30]C,R6C:R29C) -> 4 | W59: =RANK(R[-30]C,R6C:R29C) -> 14
C62: Northbound | J62: Southbound | Q62: Eastbound
C63: NPMRDS from HERE (Trucks and passenger vehicles) | J63: NPMRDS from HERE (Trucks and passenger vehicles) | Q63: NPMRDS from HERE (Trucks and passenger vehicles)
C64: 2011 (Every weekday) | D64: 2012 (Every weekday) | E64: 2013 (Every weekday) | F64: 2014 (Every weekday) | G64: 2015 (Every weekday) | H64: 2016 (Every weekday) | I64: 2017 (Every weekday) | J64: 2011 (Every weekday) | K64: 2012 (Every weekday) | L64: 2013 (Every weekday) | M64: 2014 (Every weekday) | N64: 2015 (Every weekday) | O64: 2016 (Every weekday) | P64: 2017 (Every weekday) | Q64: 2011 (Every weekday) | R64: 2012 (Every weekday) | S64: 2013 (Every weekday) | T64: 2014 (Every weekday) | U64: 2015 (Every weekday) | V64: 2016 (Every weekday) | W64: 2017 (Every weekday)
C65: =IF(R[-29]C<3,R[-59]C,"") ->  | D65: =IF(R[-29]C<3,R[-59]C,"") ->  | E65: =IF(R[-29]C<3,R[-59]C,"") ->  | F65: =IF(R[-29]C<3,R[-59]C,"") ->  | G65: =IF(R[-29]C<3,R[-59]C,"") ->  | H65: =IF(R[-29]C<3,R[-59]C,"") ->  | I65: =IF(R[-29]C<3,R[-59]C,"") ->  | J65: =IF(R[-29]C<3,R[-59]C,"") ->  | K65: =IF(R[-29]C<3,R[-59]C,"") ->  | L65: =IF(R[-29]C<3,R[-59]C,"") ->  | M65: =IF(R[-29]C<3,R[-59]C,"") -> 1.4 | N65: =IF(R[-29]C<3,R[-59]C,"") -> 1.35 | O65: =IF(R[-29]C<3,R[-59]C,"") -> 1.35 | P65: =IF(R[-29]C<3,R[-59]C,"") ->  | Q65: =IF(R[-29]C<3,R[-59]C,"") -> #VALUE! | R65: =IF(R[-29]C<3,R[-59]C,"") -> #VALUE! | S65: =IF(R[-29]C<3,R[-59]C,"") ->  | T65: =IF(R[-29]C<3,R[-59]C,"") -> 2.72 | U65: =IF(R[-29]C<3,R[-59]C,"") -> 34 | V65: =IF(R[-29]C<3,R[-59]C,"") ->  | W65: =IF(R[-29]C<3,R[-59]C,"") -> 
C66: =IF(R[-29]C<3,R[-59]C,"") ->  | D66: =IF(R[-29]C<3,R[-59]C,"") ->  | E66: =IF(R[-29]C<3,R[-59]C,"") ->  | F66: =IF(R[-29]C<3,R[-59]C,"") ->  | G66: =IF(R[-29]C<3,R[-59]C,"") ->  | H66: =IF(R[-29]C<3,R[-59]C,"") ->  | I66: =IF(R[-29]C<3,R[-59]C,"") ->  | J66: =IF(R[-29]C<3,R[-59]C,"") ->  | K66: =IF(R[-29]C<3,R[-59]C,"") -> 1.49 | L66: =IF(R[-29]C<3,R[-59]C,"") ->  | M66: =IF(R[-29]C<3,R[-59]C,"") -> 1.41 | N66: =IF(R[-29]C<3,R[-59]C,"") -> 1.35 | O66: =IF(R[-29]C<3,R[-59]C,"") ->  | P66: =IF(R[-29]C<3,R[-59]C,"") ->  | Q66: =IF(R[-29]C<3,R[-59]C,"") -> #VALUE! | R66: =IF(R[-29]C<3,R[-59]C,"") -> #VALUE! | S66: =IF(R[-29]C<3,R[-59]C,"") ->  | T66: =IF(R[-29]C<3,R[-59]C,"") ->  | U66: =IF(R[-29]C<3,R[-59]C,"") -> 34 | V66: =IF(R[-29]C<3,R[-59]C,"") ->  | W66: =IF(R[-29]C<3,R[-59]C,"") -> 
C67: =IF(R[-29]C<3,R[-59]C,"") ->  | D67: =IF(R[-29]C<3,R[-59]C,"") ->  | E67: =IF(R[-29]C<3,R[-59]C,"") ->  | F67: =IF(R[-29]C<3,R[-59]C,"") ->  | G67: =IF(R[-29]C<3,R[-59]C,"") ->  | H67: =IF(R[-29]C<3,R[-59]C,"") ->  | I67: =IF(R[-29]C<3,R[-59]C,"") ->  | J67: =IF(R[-29]C<3,R[-59]C,"") ->  | K67: =IF(R[-29]C<3,R[-59]C,"") ->  | L67: =IF(R[-29]C<3,R[-59]C,"") ->  | M67: =IF(R[-29]C<3,R[-59]C,"") ->  | N67: =IF(R[-29]C<3,R[-59]C,"") ->  | O67: =IF(R[-29]C<3,R[-59]C,"") ->  | P67: =IF(R[-29]C<3,R[-59]C,"") ->  | Q67: =IF(R[-29]C<3,R[-59]C,"") -> #VALUE! | R67: =IF(R[-29]C<3,R[-59]C,"") -> #VALUE! | S67: =IF(R[-29]C<3,R[-59]C,"") ->  | T67: =IF(R[-29]C<3,R[-59]C,"") ->  | U67: =IF(R[-29]C<3,R[-59]C,"") -> 34 | V67: =IF(R[-29]C<3,R[-59]C,"") -> 1.55 | W67: =IF(R[-29]C<3,R[-59]C,"") -> 
C68: =IF(R[-29]C<3,R[-59]C,"") ->  | D68: =IF(R[-29]C<3,R[-59]C,"") ->  | E68: =IF(R[-29]C<3,R[-59]C,"") ->  | F68: =IF(R[-29]C<3,R[-59]C,"") ->  | G68: =IF(R[-29]C<3,R[-59]C,"") ->  | H68: =IF(R[-29]C<3,R[-59]C,"") ->  | I68: =IF(R[-29]C<3,R[-59]C,"") ->  | J68: =IF(R[-29]C<3,R[-59]C,"") ->  | K68: =IF(R[-29]C<3,R[-59]C,"") ->  | L68: =IF(R[-29]C<3,R[-59]C,"") ->  | M68: =IF(R[-29]C<3,R[-59]C,"") ->  | N68: =IF(R[-29]C<3,R[-59]C,"") ->  | O68: =IF(R[-29]C<3,R[-59]C,"") ->  | P68: =IF(R[-29]C<3,R[-59]C,"") ->  | Q68: =IF(R[-29]C<3,R[-59]C,"") -> #VALUE! | R68: =IF(R[-29]C<3,R[-59]C,"") -> #VALUE! | S68: =IF(R[-29]C<3,R[-59]C,"") -> 3.58 | T68: =IF(R[-29]C<3,R[-59]C,"") ->  | U68: =IF(R[-29]C<3,R[-59]C,"") -> 34 | V68: =IF(R[-29]C<3,R[-59]C,"") -> 1.55 | W68: =IF(R[-29]C<3,R[-59]C,"") -> 
C69: =IF(R[-29]C<3,R[-59]C,"") ->  | D69: =IF(R[-29]C<3,R[-59]C,"") ->  | E69: =IF(R[-29]C<3,R[-59]C,"") ->  | F69: =IF(R[-29]C<3,R[-59]C,"") ->  | G69: =IF(R[-29]C<3,R[-59]C,"") ->  | H69: =IF(R[-29]C<3,R[-59]C,"") ->  | I69: =IF(R[-29]C<3,R[-59]C,"") ->  | J69: =IF(R[-29]C<3,R[-59]C,"") ->  | K69: =IF(R[-29]C<3,R[-59]C,"") ->  | L69: =IF(R[-29]C<3,R[-59]C,"") ->  | M69: =IF(R[-29]C<3,R[-59]C,"") ->  | N69: =IF(R[-29]C<3,R[-59]C,"") ->  | O69: =IF(R[-29]C<3,R[-59]C,"") ->  | P69: =IF(R[-29]C<3,R[-59]C,"") ->  | Q69: =IF(R[-29]C<3,R[-59]C,"") -> #VALUE! | R69: =IF(R[-29]C<3,R[-59]C,"") -> #VALUE! | S69: =IF(R[-29]C<3,R[-59]C,"") -> 3.58 | T69: =IF(R[-29]C<3,R[-59]C,"") -> 2.83 | U69: =IF(R[-29]C<3,R[-59]C,"") -> 34 | V69: =IF(R[-29]C<3,R[-59]C,"") -> 1.62 | W69: =IF(R[-29]C<3,R[-59]C,"") -> 
C70: =IF(R[-29]C<3,R[-59]C,"") ->  | D70: =IF(R[-29]C<3,R[-59]C,"") ->  | E70: =IF(R[-29]C<3,R[-59]C,"") ->  | F70: =IF(R[-29]C<3,R[-59]C,"") ->  | G70: =IF(R[-29]C<3,R[-59]C,"") ->  | H70: =IF(R[-29]C<3,R[-59]C,"") ->  | I70: =IF(R[-29]C<3,R[-59]C,"") ->  | J70: =IF(R[-29]C<3,R[-59]C,"") ->  | K70: =IF(R[-29]C<3,R[-59]C,"") ->  | L70: =IF(R[-29]C<3,R[-59]C,"") ->  | M70: =IF(R[-29]C<3,R[-59]C,"") ->  | N70: =IF(R[-29]C<3,R[-59]C,"") ->  | O70: =IF(R[-29]C<3,R[-59]C,"") ->  | P70: =IF(R[-29]C<3,R[-59]C,"") ->  | Q70: =IF(R[-29]C<3,R[-59]C,"") -> #VALUE! | R70: =IF(R[-29]C<3,R[-59]C,"") -> #VALUE! | S70: =IF(R[-29]C<3,R[-59]C,"") ->  | T70: =IF(R[-29]C<3,R[-59]C,"") ->  | U70: =IF(R[-29]C<3,R[-59]C,"") -> 34 | V70: =IF(R[-29]C<3,R[-59]C,"") ->  | W70: =IF(R[-29]C<3,R[-59]C,"") -> 
C71: =IF(R[-29]C<3,R[-59]C,"") ->  | D71: =IF(R[-29]C<3,R[-59]C,"") ->  | E71: =IF(R[-29]C<3,R[-59]C,"") ->  | F71: =IF(R[-29]C<3,R[-59]C,"") ->  | G71: =IF(R[-29]C<3,R[-59]C,"") ->  | H71: =IF(R[-29]C<3,R[-59]C,"") ->  | I71: =IF(R[-29]C<3,R[-59]C,"") ->  | J71: =IF(R[-29]C<3,R[-59]C,"") ->  | K71: =IF(R[-29]C<3,R[-59]C,"") ->  | L71: =IF(R[-29]C<3,R[-59]C,"") ->  | M71: =IF(R[-29]C<3,R[-59]C,"") ->  | N71: =IF(R[-29]C<3,R[-59]C,"") ->  | O71: =IF(R[-29]C<3,R[-59]C,"") ->  | P71: =IF(R[-29]C<3,R[-59]C,"") ->  | Q71: =IF(R[-29]C<3,R[-59]C,"") -> #VALUE! | R71: =IF(R[-29]C<3,R[-59]C,"") -> #VALUE! | S71: =IF(R[-29]C<3,R[-59]C,"") ->  | T71: =IF(R[-29]C<3,R[-59]C,"") ->  | U71: =IF(R[-29]C<3,R[-59]C,"") -> 34 | V71: =IF(R[-29]C<3,R[-59]C,"") ->  | W71: =IF(R[-29]C<3,R[-59]C,"") -> 
C72: =IF(R[-29]C<3,R[-59]C,"") -> 2.0299999999999998 | D72: =IF(R[-29]C<3,R[-59]C,"") -> 1.93 | E72: =IF(R[-29]C<3,R[-59]C,"") -> 1.58 | F72: =IF(R[-29]C<3,R[-59]C,"") -> 1.66 | G72: =IF(R[-29]C<3,R[-59]C,"") -> 1.44 | H72: =IF(R[-29]C<3,R[-59]C,"") -> 1.47 | I72: =IF(R[-29]C<3,R[-59]C,"") -> 1.4 | J72: =IF(R[-29]C<3,R[-59]C,"") ->  | K72: =IF(R[-29]C<3,R[-59]C,"") ->  | L72: =IF(R[-29]C<3,R[-59]C,"") ->  | M72: =IF(R[-29]C<3,R[-59]C,"") ->  | N72: =IF(R[-29]C<3,R[-59]C,"") ->  | O72: =IF(R[-29]C<3,R[-59]C,"") ->  | P72: =IF(R[-29]C<3,R[-59]C,"") ->  | Q72: =IF(R[-29]C<3,R[-59]C,"") -> #VALUE! | R72: =IF(R[-29]C<3,R[-59]C,"") -> #VALUE! | S72: =IF(R[-29]C<3,R[-59]C,"") ->  | T72: =IF(R[-29]C<3,R[-59]C,"") ->  | U72: =IF(R[-29]C<3,R[-59]C,"") -> 34 | V72: =IF(R[-29]C<3,R[-59]C,"") ->  | W72: =IF(R[-29]C<3,R[-59]C,"") -> 
C73: =IF(R[-29]C<3,R[-59]C,"") -> 2.02 | D73: =IF(R[-29]C<3,R[-59]C,"") -> 2.34 | E73: =IF(R[-29]C<3,R[-59]C,"") -> 1.74 | F73: =IF(R[-29]C<3,R[-59]C,"") -> 1.73 | G73: =IF(R[-29]C<3,R[-59]C,"") -> 1.48 | H73: =IF(R[-29]C<3,R[-59]C,"") -> 1.42 | I73: =IF(R[-29]C<3,R[-59]C,"") -> 1.31 | J73: =IF(R[-29]C<3,R[-59]C,"") ->  | K73: =IF(R[-29]C<3,R[-59]C,"") ->  | L73: =IF(R[-29]C<3,R[-59]C,"") -> 1.43 | M73: =IF(R[-29]C<3,R[-59]C,"") ->  | N73: =IF(R[-29]C<3,R[-59]C,"") ->  | O73: =IF(R[-29]C<3,R[-59]C,"") ->  | P73: =IF(R[-29]C<3,R[-59]C,"") ->  | Q73: =IF(R[-29]C<3,R[-59]C,"") -> #VALUE! | R73: =IF(R[-29]C<3,R[-59]C,"") -> #VALUE! | S73: =IF(R[-29]C<3,R[-59]C,"") ->  | T73: =IF(R[-29]C<3,R[-59]C,"") ->  | U73: =IF(R[-29]C<3,R[-59]C,"") -> 34 | V73: =IF(R[-29]C<3,R[-59]C,"") ->  | W73: =IF(R[-29]C<3,R[-59]C,"") -> 
C74: =IF(R[-29]C<3,R[-59]C,"") ->  | D74: =IF(R[-29]C<3,R[-59]C,"") ->  | E74: =IF(R[-29]C<3,R[-59]C,"") ->  | F74: =IF(R[-29]C<3,R[-59]C,"") ->  | G74: =IF(R[-29]C<3,R[-59]C,"") ->  | H74: =IF(R[-29]C<3,R[-59]C,"") ->  | I74: =IF(R[-29]C<3,R[-59]C,"") ->  | J74: =IF(R[-29]C<3,R[-59]C,"") ->  | K74: =IF(R[-29]C<3,R[-59]C,"") ->  | L74: =IF(R[-29]C<3,R[-59]C,"") ->  | M74: =IF(R[-29]C<3,R[-59]C,"") ->  | N74: =IF(R[-29]C<3,R[-59]C,"") ->  | O74: =IF(R[-29]C<3,R[-59]C,"") ->  | P74: =IF(R[-29]C<3,R[-59]C,"") ->  | Q74: =IF(R[-29]C<3,R[-59]C,"") -> #VALUE! | R74: =IF(R[-29]C<3,R[-59]C,"") -> #VALUE! | S74: =IF(R[-29]C<3,R[-59]C,"") ->  | T74: =IF(R[-29]C<3,R[-59]C,"") ->  | U74: =IF(R[-29]C<3,R[-59]C,"") -> 34 | V74: =IF(R[-29]C<3,R[-59]C,"") ->  | W74: =IF(R[-29]C<3,R[-59]C,"") -> 
C75: =IF(R[-29]C<3,R[-59]C,"") ->  | D75: =IF(R[-29]C<3,R[-59]C,"") ->  | E75: =IF(R[-29]C<3,R[-59]C,"") ->  | F75: =IF(R[-29]C<3,R[-59]C,"") ->  | G75: =IF(R[-29]C<3,R[-59]C,"") ->  | H75: =IF(R[-29]C<3,R[-59]C,"") ->  | I75: =IF(R[-29]C<3,R[-59]C,"") ->  | J75: =IF(R[-29]C<3,R[-59]C,"") ->  | K75: =IF(R[-29]C<3,R[-59]C,"") ->  | L75: =IF(R[-29]C<3,R[-59]C,"") ->  | M75: =IF(R[-29]C<3,R[-59]C,"") ->  | N75: =IF(R[-29]C<3,R[-59]C,"") ->  | O75: =IF(R[-29]C<3,R[-59]C,"") ->  | P75: =IF(R[-29]C<3,R[-59]C,"") ->  | Q75: =IF(R[-29]C<3,R[-59]C,"") -> #VALUE! | R75: =IF(R[-29]C<3,R[-59]C,"") -> #VALUE! | S75: =IF(R[-29]C<3,R[-59]C,"") ->  | T75: =IF(R[-29]C<3,R[-59]C,"") ->  | U75: =IF(R[-29]C<3,R[-59]C,"") -> 34 | V75: =IF(R[-29]C<3,R[-59]C,"") ->  | W75: =IF(R[-29]C<3,R[-59]C,"") -> 
C76: =IF(R[-29]C<3,R[-59]C,"") ->  | D76: =IF(R[-29]C<3,R[-59]C,"") ->  | E76: =IF(R[-29]C<3,R[-59]C,"") ->  | F76: =IF(R[-29]C<3,R[-59]C,"") ->  | G76: =IF(R[-29]C<3,R[-59]C,"") ->  | H76: =IF(R[-29]C<3,R[-59]C,"") ->  | I76: =IF(R[-29]C<3,R[-59]C,"") ->  | J76: =IF(R[-29]C<3,R[-59]C,"") ->  | K76: =IF(R[-29]C<3,R[-59]C,"") ->  | L76: =IF(R[-29]C<3,R[-59]C,"") ->  | M76: =IF(R[-29]C<3,R[-59]C,"") ->  | N76: =IF(R[-29]C<3,R[-59]C,"") ->  | O76: =IF(R[-29]C<3,R[-59]C,"") ->  | P76: =IF(R[-29]C<3,R[-59]C,"") ->  | Q76: =IF(R[-29]C<3,R[-59]C,"") -> #VALUE! | R76: =IF(R[-29]C<3,R[-59]C,"") -> #VALUE! | S76: =IF(R[-29]C<3,R[-59]C,"") ->  | T76: =IF(R[-29]C<3,R[-59]C,"") ->  | U76: =IF(R[-29]C<3,R[-59]C,"") -> 34 | V76: =IF(R[-29]C<3,R[-59]C,"") ->  | W76: =IF(R[-29]C<3,R[-59]C,"") -> 
C77: =IF(R[-29]C<3,R[-59]C,"") ->  | D77: =IF(R[-29]C<3,R[-59]C,"") ->  | E77: =IF(R[-29]C<3,R[-59]C,"") ->  | F77: =IF(R[-29]C<3,R[-59]C,"") ->  | G77: =IF(R[-29]C<3,R[-59]C,"") ->  | H77: =IF(R[-29]C<3,R[-59]C,"") ->  | I77: =IF(R[-29]C<3,R[-59]C,"") ->  | J77: =IF(R[-29]C<3,R[-59]C,"") ->  | K77: =IF(R[-29]C<3,R[-59]C,"") ->  | L77: =IF(R[-29]C<3,R[-59]C,"") ->  | M77: =IF(R[-29]C<3,R[-59]C,"") ->  | N77: =IF(R[-29]C<3,R[-59]C,"") ->  | O77: =IF(R[-29]C<3,R[-59]C,"") ->  | P77: =IF(R[-29]C<3,R[-59]C,"") ->  | Q77: =IF(R[-29]C<3,R[-59]C,"") -> #VALUE! | R77: =IF(R[-29]C<3,R[-59]C,"") -> #VALUE! | S77: =IF(R[-29]C<3,R[-59]C,"") ->  | T77: =IF(R[-29]C<3,R[-59]C,"") ->  | U77: =IF(R[-29]C<3,R[-59]C,"") -> 34 | V77: =IF(R[-29]C<3,R[-59]C,"") ->  | W77: =IF(R[-29]C<3,R[-59]C,"") -> 
C78: =IF(R[-29]C<3,R[-59]C,"") ->  | D78: =IF(R[-29]C<3,R[-59]C,"") ->  | E78: =IF(R[-29]C<3,R[-59]C,"") ->  | F78: =IF(R[-29]C<3,R[-59]C,"") ->  | G78: =IF(R[-29]C<3,R[-59]C,"") ->  | H78: =IF(R[-29]C<3,R[-59]C,"") ->  | I78: =IF(R[-29]C<3,R[-59]C,"") ->  | J78: =IF(R[-29]C<3,R[-59]C,"") ->  | K78: =IF(R[-29]C<3,R[-59]C,"") ->  | L78: =IF(R[-29]C<3,R[-59]C,"") ->  | M78: =IF(R[-29]C<3,R[-59]C,"") ->  | N78: =IF(R[-29]C<3,R[-59]C,"") ->  | O78: =IF(R[-29]C<3,R[-59]C,"") ->  | P78: =IF(R[-29]C<3,R[-59]C,"") ->  | Q78: =IF(R[-29]C<3,R[-59]C,"") -> #VALUE! | R78: =IF(R[-29]C<3,R[-59]C,"") -> #VALUE! | S78: =IF(R[-29]C<3,R[-59]C,"") ->  | T78: =IF(R[-29]C<3,R[-59]C,"") ->  | U78: =IF(R[-29]C<3,R[-59]C,"") -> 34 | V78: =IF(R[-29]C<3,R[-59]C,"") ->  | W78: =IF(R[-29]C<3,R[-59]C,"") -> 
C79: =IF(R[-29]C<3,R[-59]C,"") ->  | D79: =IF(R[-29]C<3,R[-59]C,"") ->  | E79: =IF(R[-29]C<3,R[-59]C,"") ->  | F79: =IF(R[-29]C<3,R[-59]C,"") ->  | G79: =IF(R[-29]C<3,R[-59]C,"") ->  | H79: =IF(R[-29]C<3,R[-59]C,"") ->  | I79: =IF(R[-29]C<3,R[-59]C,"") ->  | J79: =IF(R[-29]C<3,R[-59]C,"") ->  | K79: =IF(R[-29]C<3,R[-59]C,"") ->  | L79: =IF(R[-29]C<3,R[-59]C,"") ->  | M79: =IF(R[-29]C<3,R[-59]C,"") ->  | N79: =IF(R[-29]C<3,R[-59]C,"") ->  | O79: =IF(R[-29]C<3,R[-59]C,"") ->  | P79: =IF(R[-29]C<3,R[-59]C,"") ->  | Q79: =IF(R[-29]C<3,R[-59]C,"") -> #VALUE! | R79: =IF(R[-29]C<3,R[-59]C,"") -> #VALUE! | S79: =IF(R[-29]C<3,R[-59]C,"") ->  | T79: =IF(R[-29]C<3,R[-59]C,"") ->  | U79: =IF(R[-29]C<3,R[-59]C,"") -> 34 | V79: =IF(R[-29]C<3,R[-59]C,"") ->  | W79: =IF(R[-29]C<3,R[-59]C,"") -> 
C80: =IF(R[-29]C<3,R[-59]C,"") ->  | D80: =IF(R[-29]C<3,R[-59]C,"") ->  | E80: =IF(R[-29]C<3,R[-59]C,"") ->  | F80: =IF(R[-29]C<3,R[-59]C,"") ->  | G80: =IF(R[-29]C<3,R[-59]C,"") ->  | H80: =IF(R[-29]C<3,R[-59]C,"") ->  | I80: =IF(R[-29]C<3,R[-59]C,"") ->  | J80: =IF(R[-29]C<3,R[-59]C,"") ->  | K80: =IF(R[-29]C<3,R[-59]C,"") ->  | L80: =IF(R[-29]C<3,R[-59]C,"") ->  | M80: =IF(R[-29]C<3,R[-59]C,"") ->  | N80: =IF(R[-29]C<3,R[-59]C,"") ->  | O80: =IF(R[-29]C<3,R[-59]C,"") ->  | P80: =IF(R[-29]C<3,R[-59]C,"") ->  | Q80: =IF(R[-29]C<3,R[-59]C,"") -> #VALUE! | R80: =IF(R[-29]C<3,R[-59]C,"") -> #VALUE! | S80: =IF(R[-29]C<3,R[-59]C,"") ->  | T80: =IF(R[-29]C<3,R[-59]C,"") ->  | U80: =IF(R[-29]C<3,R[-59]C,"") -> 34 | V80: =IF(R[-29]C<3,R[-59]C,"") ->  | W80: =IF(R[-29]C<3,R[-59]C,"") -> 
C81: =IF(R[-29]C<3,R[-59]C,"") ->  | D81: =IF(R[-29]C<3,R[-59]C,"") ->  | E81: =IF(R[-29]C<3,R[-59]C,"") ->  | F81: =IF(R[-29]C<3,R[-59]C,"") ->  | G81: =IF(R[-29]C<3,R[-59]C,"") ->  | H81: =IF(R[-29]C<3,R[-59]C,"") ->  | I81: =IF(R[-29]C<3,R[-59]C,"") ->  | J81: =IF(R[-29]C<3,R[-59]C,"") ->  | K81: =IF(R[-29]C<3,R[-59]C,"") ->  | L81: =IF(R[-29]C<3,R[-59]C,"") ->  | M81: =IF(R[-29]C<3,R[-59]C,"") ->  | N81: =IF(R[-29]C<3,R[-59]C,"") ->  | O81: =IF(R[-29]C<3,R[-59]C,"") ->  | P81: =IF(R[-29]C<3,R[-59]C,"") ->  | Q81: =IF(R[-29]C<3,R[-59]C,"") -> #VALUE! | R81: =IF(R[-29]C<3,R[-59]C,"") -> #VALUE! | S81: =IF(R[-29]C<3,R[-59]C,"") ->  | T81: =IF(R[-29]C<3,R[-59]C,"") ->  | U81: =IF(R[-29]C<3,R[-59]C,"") -> 34 | V81: =IF(R[-29]C<3,R[-59]C,"") ->  | W81: =IF(R[-29]C<3,R[-59]C,"") -> 1.79
C82: =IF(R[-29]C<3,R[-59]C,"") ->  | D82: =IF(R[-29]C<3,R[-59]C,"") ->  | E82: =IF(R[-29]C<3,R[-59]C,"") ->  | F82: =IF(R[-29]C<3,R[-59]C,"") ->  | G82: =IF(R[-29]C<3,R[-59]C,"") ->  | H82: =IF(R[-29]C<3,R[-59]C,"") ->  | I82: =IF(R[-29]C<3,R[-59]C,"") ->  | J82: =IF(R[-29]C<3,R[-59]C,"") -> 1.45 | K82: =IF(R[-29]C<3,R[-59]C,"") ->  | L82: =IF(R[-29]C<3,R[-59]C,"") ->  | M82: =IF(R[-29]C<3,R[-59]C,"") ->  | N82: =IF(R[-29]C<3,R[-59]C,"") ->  | O82: =IF(R[-29]C<3,R[-59]C,"") ->  | P82: =IF(R[-29]C<3,R[-59]C,"") ->  | Q82: =IF(R[-29]C<3,R[-59]C,"") -> #VALUE! | R82: =IF(R[-29]C<3,R[-59]C,"") -> #VALUE! | S82: =IF(R[-29]C<3,R[-59]C,"") ->  | T82: =IF(R[-29]C<3,R[-59]C,"") ->  | U82: =IF(R[-29]C<3,R[-59]C,"") -> 34 | V82: =IF(R[-29]C<3,R[-59]C,"") ->  | W82: =IF(R[-29]C<3,R[-59]C,"") -> 1.84
C83: =IF(R[-29]C<3,R[-59]C,"") ->  | D83: =IF(R[-29]C<3,R[-59]C,"") ->  | E83: =IF(R[-29]C<3,R[-59]C,"") ->  | F83: =IF(R[-29]C<3,R[-59]C,"") ->  | G83: =IF(R[-29]C<3,R[-59]C,"") ->  | H83: =IF(R[-29]C<3,R[-59]C,"") ->  | I83: =IF(R[-29]C<3,R[-59]C,"") ->  | J83: =IF(R[-29]C<3,R[-59]C,"") -> 1.43 | K83: =IF(R[-29]C<3,R[-59]C,"") ->  | L83: =IF(R[-29]C<3,R[-59]C,"") -> 1.4 | M83: =IF(R[-29]C<3,R[-59]C,"") ->  | N83: =IF(R[-29]C<3,R[-59]C,"") ->  | O83: =IF(R[-29]C<3,R[-59]C,"") ->  | P83: =IF(R[-29]C<3,R[-59]C,"") ->  | Q83: =IF(R[-29]C<3,R[-59]C,"") -> #VALUE! | R83: =IF(R[-29]C<3,R[-59]C,"") -> #VALUE! | S83: =IF(R[-29]C<3,R[-59]C,"") ->  | T83: =IF(R[-29]C<3,R[-59]C,"") ->  | U83: =IF(R[-29]C<3,R[-59]C,"") -> 34 | V83: =IF(R[-29]C<3,R[-59]C,"") ->  | W83: =IF(R[-29]C<3,R[-59]C,"") -> 1.79
C84: =IF(R[-29]C<3,R[-59]C,"") ->  | D84: =IF(R[-29]C<3,R[-59]C,"") ->  | E84: =IF(R[-29]C<3,R[-59]C,"") ->  | F84: =IF(R[-29]C<3,R[-59]C,"") ->  | G84: =IF(R[-29]C<3,R[-59]C,"") ->  | H84: =IF(R[-29]C<3,R[-59]C,"") ->  | I84: =IF(R[-29]C<3,R[-59]C,"") ->  | J84: =IF(R[-29]C<3,R[-59]C,"") ->  | K84: =IF(R[-29]C<3,R[-59]C,"") ->  | L84: =IF(R[-29]C<3,R[-59]C,"") -> 1.4 | M84: =IF(R[-29]C<3,R[-59]C,"") ->  | N84: =IF(R[-29]C<3,R[-59]C,"") ->  | O84: =IF(R[-29]C<3,R[-59]C,"") ->  | P84: =IF(R[-29]C<3,R[-59]C,"") ->  | Q84: =IF(R[-29]C<3,R[-59]C,"") -> #VALUE! | R84: =IF(R[-29]C<3,R[-59]C,"") -> #VALUE! | S84: =IF(R[-29]C<3,R[-59]C,"") ->  | T84: =IF(R[-29]C<3,R[-59]C,"") ->  | U84: =IF(R[-29]C<3,R[-59]C,"") -> 34 | V84: =IF(R[-29]C<3,R[-59]C,"") ->  | W84: =IF(R[-29]C<3,R[-59]C,"") -> 
C85: =IF(R[-29]C<3,R[-59]C,"") ->  | D85: =IF(R[-29]C<3,R[-59]C,"") ->  | E85: =IF(R[-29]C<3,R[-59]C,"") ->  | F85: =IF(R[-29]C<3,R[-59]C,"") ->  | G85: =IF(R[-29]C<3,R[-59]C,"") ->  | H85: =IF(R[-29]C<3,R[-59]C,"") ->  | I85: =IF(R[-29]C<3,R[-59]C,"") ->  | J85: =IF(R[-29]C<3,R[-59]C,"") ->  | K85: =IF(R[-29]C<3,R[-59]C,"") ->  | L85: =IF(R[-29]C<3,R[-59]C,"") -> 1.4 | M85: =IF(R[-29]C<3,R[-59]C,"") ->  | N85: =IF(R[-29]C<3,R[-59]C,"") ->  | O85: =IF(R[-29]C<3,R[-59]C,"") ->  | P85: =IF(R[-29]C<3,R[-59]C,"") ->  | Q85: =IF(R[-29]C<3,R[-59]C,"") -> #VALUE! | R85: =IF(R[-29]C<3,R[-59]C,"") -> #VALUE! | S85: =IF(R[-29]C<3,R[-59]C,"") ->  | T85: =IF(R[-29]C<3,R[-59]C,"") ->  | U85: =IF(R[-29]C<3,R[-59]C,"") -> 34 | V85: =IF(R[-29]C<3,R[-59]C,"") ->  | W85: =IF(R[-29]C<3,R[-59]C,"") -> 
C86: =IF(R[-29]C<3,R[-59]C,"") ->  | D86: =IF(R[-29]C<3,R[-59]C,"") ->  | E86: =IF(R[-29]C<3,R[-59]C,"") ->  | F86: =IF(R[-29]C<3,R[-59]C,"") ->  | G86: =IF(R[-29]C<3,R[-59]C,"") ->  | H86: =IF(R[-29]C<3,R[-59]C,"") ->  | I86: =IF(R[-29]C<3,R[-59]C,"") ->  | J86: =IF(R[-29]C<3,R[-59]C,"") ->  | K86: =IF(R[-29]C<3,R[-59]C,"") ->  | L86: =IF(R[-29]C<3,R[-59]C,"") ->  | M86: =IF(R[-29]C<3,R[-59]C,"") ->  | N86: =IF(R[-29]C<3,R[-59]C,"") ->  | O86: =IF(R[-29]C<3,R[-59]C,"") ->  | P86: =IF(R[-29]C<3,R[-59]C,"") ->  | Q86: =IF(R[-29]C<3,R[-59]C,"") -> #VALUE! | R86: =IF(R[-29]C<3,R[-59]C,"") -> #VALUE! | S86: =IF(R[-29]C<3,R[-59]C,"") ->  | T86: =IF(R[-29]C<3,R[-59]C,"") ->  | U86: =IF(R[-29]C<3,R[-59]C,"") -> 34 | V86: =IF(R[-29]C<3,R[-59]C,"") ->  | W86: =IF(R[-29]C<3,R[-59]C,"") -> 
C87: =IF(R[-29]C<3,R[-59]C,"") ->  | D87: =IF(R[-29]C<3,R[-59]C,"") ->  | E87: =IF(R[-29]C<3,R[-59]C,"") ->  | F87: =IF(R[-29]C<3,R[-59]C,"") ->  | G87: =IF(R[-29]C<3,R[-59]C,"") ->  | H87: =IF(R[-29]C<3,R[-59]C,"") ->  | I87: =IF(R[-29]C<3,R[-59]C,"") ->  | J87: =IF(R[-29]C<3,R[-59]C,"") ->  | K87: =IF(R[-29]C<3,R[-59]C,"") ->  | L87: =IF(R[-29]C<3,R[-59]C,"") ->  | M87: =IF(R[-29]C<3,R[-59]C,"") ->  | N87: =IF(R[-29]C<3,R[-59]C,"") -> 1.35 | O87: =IF(R[-29]C<3,R[-59]C,"") -> 1.35 | P87: =IF(R[-29]C<3,R[-59]C,"") -> 1.3 | Q87: =IF(R[-29]C<3,R[-59]C,"") -> #VALUE! | R87: =IF(R[-29]C<3,R[-59]C,"") -> #VALUE! | S87: =IF(R[-29]C<3,R[-59]C,"") ->  | T87: =IF(R[-29]C<3,R[-59]C,"") ->  | U87: =IF(R[-29]C<3,R[-59]C,"") -> 34 | V87: =IF(R[-29]C<3,R[-59]C,"") ->  | W87: =IF(R[-29]C<3,R[-59]C,"") -> 
C88: =IF(R[-29]C<3,R[-59]C,"") ->  | D88: =IF(R[-29]C<3,R[-59]C,"") ->  | E88: =IF(R[-29]C<3,R[-59]C,"") ->  | F88: =IF(R[-29]C<3,R[-59]C,"") ->  | G88: =IF(R[-29]C<3,R[-59]C,"") ->  | H88: =IF(R[-29]C<3,R[-59]C,"") ->  | I88: =IF(R[-29]C<3,R[-59]C,"") ->  | J88: =IF(R[-29]C<3,R[-59]C,"") ->  | K88: =IF(R[-29]C<3,R[-59]C,"") -> 1.49 | L88: =IF(R[-29]C<3,R[-59]C,"") ->  | M88: =IF(R[-29]C<3,R[-59]C,"") ->  | N88: =IF(R[-29]C<3,R[-59]C,"") -> 1.37 | O88: =IF(R[-29]C<3,R[-59]C,"") -> 1.35 | P88: =IF(R[-29]C<3,R[-59]C,"") -> 1.3 | Q88: =IF(R[-29]C<3,R[-59]C,"") -> #VALUE! | R88: =IF(R[-29]C<3,R[-59]C,"") -> #VALUE! | S88: =IF(R[-29]C<3,R[-59]C,"") ->  | T88: =IF(R[-29]C<3,R[-59]C,"") ->  | U88: =IF(R[-29]C<3,R[-59]C,"") -> 68 | V88: =IF(R[-29]C<3,R[-59]C,"") ->  | W88: =IF(R[-29]C<3,R[-59]C,"") -> 
C91: 2011 | D91: 2012 | E91: 2013 | F91: 2014 | G91: 2015 | H91: 2016 | I91: 2017 | J91: 2011-17 | K91: 2013-17
A92: Gloucester | B92: 1 | C92: =AVERAGE(R[-27]C:R[-4]C,R[-27]C[7]:R[-4]C[7],,R[-27]C[21]:R[-4]C[21]) -> 1.3859999999999999 | D92: =AVERAGE(R[-27]C:R[-4]C,R[-27]C[7]:R[-4]C[7],,R[-27]C[21]:R[-4]C[21]) -> 1.45 | E92: =AVERAGE(R[-27]C:R[-4]C,R[-27]C[7]:R[-4]C[7],R[-27]C[14]:R[-4]C[14],R[-27]C[21]:R[-4]C[21]) -> 2.0137499999999999 | F92: =AVERAGE(R[-27]C:R[-4]C,R[-27]C[7]:R[-4]C[7],R[-27]C[14]:R[-4]C[14],R[-27]C[21]:R[-4]C[21]) -> 1.9583333333333333 | G92: =AVERAGE(R[-27]C:R[-4]C,R[-27]C[7]:R[-4]C[7],R[-27]C[14]:R[-4]C[14],R[-27]C[21]:R[-4]C[21]) -> 28.611333333333334 | H92: =AVERAGE(R[-27]C:R[-4]C,R[-27]C[7]:R[-4]C[7],R[-27]C[14]:R[-4]C[14],R[-27]C[21]:R[-4]C[21]) -> 1.4575 | I92: =AVERAGE(R[-27]C:R[-4]C,R[-27]C[7]:R[-4]C[7],R[-27]C[14]:R[-4]C[14],R[-27]C[21]:R[-4]C[21]) -> 1.5328571428571429
A93: Gloucester | B93: 2 | C93: =R[-63]C -> 1.415 | D93: =R[-63]C -> 1.409375 | E93: =R[-63]C -> 1.6422222222222222 | F93: =R[-63]C -> 1.6320833333333338 | G93: =R[-63]C -> 12.668194444444445 | H93: =R[-63]C -> 1.3237500000000002 | I93: =R[-63]C -> 1.329583333333334