Sheet: Planning time index
A1: PA Cntys Freeway | C1: Planning time index () for Interstates, turnpikes, and expressways in Montgomery, Pennsylvania (95 TMCs), Interstates, turnpikes, and expressways in Delaware, Pennsylvania (70 TMCs), Interstates, turnpikes, and expressways in Chester, Pennsylvania (18 TMCs), Interstates, turnpikes, and expressways in Bucks, Pennsylvania (57 TMCs), and Interstates, turnpikes, and expressways in Philadelphia, Pennsylvania (156 TMCs)
C3: Northbound | J3: Southbound | Q3: Eastbound | X3: Westbound
C4: NPMRDS from HERE (Trucks and passenger vehicles) | J4: NPMRDS from HERE (Trucks and passenger vehicles) | Q4: NPMRDS from HERE (Trucks and passenger vehicles) | X4: NPMRDS from HERE (Trucks and passenger vehicles)
C5: 2011 (Every weekday) | D5: 2012 (Every weekday) | E5: 2013 (Every weekday) | F5: 2014 (Every weekday) | G5: 2015 (Every weekday) | H5: 2016 (Every weekday) | I5: 2017 (Every weekday) | J5: 2011 (Every weekday) | K5: 2012 (Every weekday) | L5: 2013 (Every weekday) | M5: 2014 (Every weekday) | N5: 2015 (Every weekday) | O5: 2016 (Every weekday) | P5: 2017 (Every weekday) | Q5: 2011 (Every weekday) | R5: 2012 (Every weekday) | S5: 2013 (Every weekday) | T5: 2014 (Every weekday) | U5: 2015 (Every weekday) | V5: 2016 (Every weekday) | W5: 2017 (Every weekday) | X5: 2011 (Every weekday) | Y5: 2012 (Every weekday) | Z5: 2013 (Every weekday) | AA5: 2014 (Every weekday) | AB5: 2015 (Every weekday) | AC5: 2016 (Every weekday) | AD5: 2017 (Every weekday)
A6: 12 AM | C6: 1.65 | D6: 1.57 | E6: 1.65 | F6: 1.6 | G6: 2.21 | H6: 1.84 | I6: 1.72 | J6: 1.52 | K6: 1.44 | L6: 1.55 | M6: 1.59 | N6: 2.11 | O6: 1.75 | P6: 1.72 | Q6: 1.77 | R6: 1.76 | S6: 1.88 | T6: 1.74 | U6: 2.36 | V6: 2.08 | W6: 1.85 | X6: 1.73 | Y6: 1.92 | Z6: 1.84 | AA6: 1.8 | AB6: 2.69 | AC6: 2.2599999999999998 | AD6: 2.0299999999999998
A7: 1 AM | C7: 1.86 | D7: 1.48 | E7: 1.57 | F7: 1.69 | G7: 2.21 | H7: 1.84 | I7: 1.72 | J7: 1.51 | K7: 1.43 | L7: 1.5 | M7: 1.8 | N7: 2.16 | O7: 1.76 | P7: 1.69 | Q7: 1.63 | R7: 1.73 | S7: 1.87 | T7: 1.75 | U7: 2.37 | V7: 2.06 | W7: 1.82 | X7: 1.77 | Y7: 1.86 | Z7: 1.88 | AA7: 1.82 | AB7: 2.5299999999999998 | AC7: 2.0299999999999998 | AD7: 1.98
A8: 2 AM | C8: 1.57 | D8: 1.46 | E8: 1.54 | F8: 1.61 | G8: 2.19 | H8: 1.83 | I8: 1.7 | J8: 1.65 | K8: 1.42 | L8: 1.71 | M8: 1.98 | N8: 2.09 | O8: 1.72 | P8: 1.67 | Q8: 1.92 | R8: 1.89 | S8: 1.83 | T8: 1.75 | U8: 2.35 | V8: 2.0499999999999998 | W8: 1.77 | X8: 1.7 | Y8: 1.92 | Z8: 1.8 | AA8: 1.76 | AB8: 2.4700000000000002 | AC8: 1.97 | AD8: 1.91
A9: 3 AM | C9: 1.55 | D9: 1.45 | E9: 1.47 | F9: 1.58 | G9: 2.13 | H9: 1.75 | I9: 1.66 | J9: 1.46 | K9: 1.38 | L9: 1.47 | M9: 1.75 | N9: 1.98 | O9: 1.65 | P9: 1.63 | Q9: 1.67 | R9: 1.61 | S9: 1.71 | T9: 1.67 | U9: 2.2999999999999998 | V9: 1.94 | W9: 1.72 | X9: 1.63 | Y9: 1.7 | Z9: 1.66 | AA9: 1.67 | AB9: 2.4300000000000002 | AC9: 1.91 | AD9: 1.87
A10: 4 AM | C10: 1.52 | D10: 1.5 | E10: 1.49 | F10: 1.57 | G10: 2.0499999999999998 | H10: 1.67 | I10: 1.61 | J10: 1.37 | K10: 1.35 | L10: 1.38 | M10: 1.47 | N10: 1.91 | O10: 1.6 | P10: 1.58 | Q10: 1.59 | R10: 1.55 | S10: 1.56 | T10: 1.56 | U10: 2.1800000000000002 | V10: 1.83 | W10: 1.67 | X10: 1.6 | Y10: 1.59 | Z10: 1.58 | AA10: 1.6 | AB10: 2.35 | AC10: 1.86 | AD10: 1.81
A11: 5 AM | C11: 1.49 | D11: 1.44 | E11: 1.42 | F11: 1.48 | G11: 1.98 | H11: 1.63 | I11: 1.58 | J11: 1.36 | K11: 1.34 | L11: 1.37 | M11: 1.44 | N11: 1.89 | O11: 1.58 | P11: 1.56 | Q11: 1.55 | R11: 1.46 | S11: 1.44 | T11: 1.46 | U11: 2.0499999999999998 | V11: 1.7 | W11: 1.64 | X11: 1.54 | Y11: 1.55 | Z11: 1.53 | AA11: 1.53 | AB11: 2.29 | AC11: 1.82 | AD11: 1.77
A12: 6 AM | C12: 1.45 | D12: 1.39 | E12: 1.46 | F12: 1.59 | G12: 2.1800000000000002 | H12: 1.82 | I12: 1.79 | J12: 1.69 | K12: 1.57 | L12: 1.75 | M12: 1.89 | N12: 2.38 | O12: 2.06 | P12: 2.11 | Q12: 1.78 | R12: 1.72 | S12: 1.74 | T12: 1.86 | U12: 2.4700000000000002 | V12: 2.2000000000000002 | W12: 2.13 | X12: 2.13 | Y12: 1.89 | Z12: 1.97 | AA12: 2.04 | AB12: 2.85 | AC12: 2.41 | AD12: 2.4300000000000002
A13: 7 AM | C13: 2.15 | D13: 2.0299999999999998 | E13: 2.29 | F13: 2.46 | G13: 3.03 | H13: 2.62 | I13: 2.67 | J13: 2.5 | K13: 2.29 | L13: 2.4500000000000002 | M13: 2.6 | N13: 3.1 | O13: 2.84 | P13: 3.21 | Q13: 2.68 | R13: 2.48 | S13: 2.4 | T13: 2.4700000000000002 | U13: 3.03 | V13: 2.72 | W13: 2.56 | X13: 3.25 | Y13: 3.03 | Z13: 2.93 | AA13: 3.19 | AB13: 3.94 | AC13: 3.5 | AD13: 3.53
A14: 8 AM | C14: 2.2999999999999998 | D14: 2.16 | E14: 2.5099999999999998 | F14: 2.66 | G14: 3.24 | H14: 2.85 | I14: 2.8 | J14: 2.5 | K14: 2.3199999999999998 | L14: 2.54 | M14: 2.64 | N14: 3.12 | O14: 2.88 | P14: 3.11 | Q14: 2.69 | R14: 2.57 | S14: 2.4900000000000002 | T14: 2.56 | U14: 3.12 | V14: 2.82 | W14: 2.61 | X14: 3.35 | Y14: 3.4 | Z14: 3.28 | AA14: 3.46 | AB14: 4.47 | AC14: 3.88 | AD14: 3.81
A15: 9 AM | C15: 1.97 | D15: 1.72 | E15: 2 | F15: 1.96 | G15: 2.56 | H15: 2.1 | I15: 2.0299999999999998 | J15: 1.89 | K15: 1.8 | L15: 2 | M15: 2.02 | N15: 2.52 | O15: 2.2200000000000002 | P15: 2.2400000000000002 | Q15: 2.12 | R15: 2.2400000000000002 | S15: 2.17 | T15: 2.2000000000000002 | U15: 2.85 | V15: 2.56 | W15: 2.36 | X15: 2.4700000000000002 | Y15: 2.48 | Z15: 2.59 | AA15: 2.6 | AB15: 3.46 | AC15: 3.04 | AD15: 2.85
A16: 10 AM | C16: 1.79 | D16: 1.57 | E16: 1.64 | F16: 1.58 | G16: 2.2000000000000002 | H16: 1.83 | I16: 1.91 | J16: 1.63 | K16: 1.57 | L16: 1.71 | M16: 1.76 | N16: 2.29 | O16: 1.93 | P16: 2.09 | Q16: 1.89 | R16: 2.33 | S16: 2.14 | T16: 2.09 | U16: 2.85 | V16: 2.4300000000000002 | W16: 2.4 | X16: 2.1 | Y16: 2.2999999999999998 | Z16: 2.21 | AA16: 2.14 | AB16: 3.07 | AC16: 2.77 | AD16: 2.54
A17: 11 AM | C17: 1.8 | D17: 1.53 | E17: 1.57 | F17: 1.59 | G17: 2.2000000000000002 | H17: 1.81 | I17: 1.88 | J17: 1.57 | K17: 1.54 | L17: 1.67 | M17: 1.66 | N17: 2.25 | O17: 1.89 | P17: 2.12 | Q17: 1.79 | R17: 2.33 | S17: 2.02 | T17: 2.0099999999999998 | U17: 2.75 | V17: 2.2799999999999998 | W17: 2.35 | X17: 2.27 | Y17: 2.27 | Z17: 2.2200000000000002 | AA17: 2.1 | AB17: 3.04 | AC17: 2.62 | AD17: 2.54
A18: 12 PM | C18: 1.78 | D18: 1.55 | E18: 1.6 | F18: 1.57 | G18: 2.2599999999999998 | H18: 1.85 | I18: 1.84 | J18: 1.46 | K18: 1.56 | L18: 1.6 | M18: 1.6 | N18: 2.2000000000000002 | O18: 1.91 | P18: 2.09 | Q18: 1.73 | R18: 2.19 | S18: 1.88 | T18: 2.0299999999999998 | U18: 2.69 | V18: 2.33 | W18: 2.19 | X18: 2.0499999999999998 | Y18: 2.4 | Z18: 2.2599999999999998 | AA18: 2.19 | AB18: 3.09 | AC18: 2.61 | AD18: 2.56
A19: 1 PM | C19: 1.89 | D19: 1.56 | E19: 1.68 | F19: 1.63 | G19: 2.35 | H19: 1.97 | I19: 1.95 | J19: 1.48 | K19: 1.52 | L19: 1.65 | M19: 1.66 | N19: 2.19 | O19: 2.02 | P19: 2.17 | Q19: 1.83 | R19: 2.21 | S19: 1.98 | T19: 2.0699999999999998 | U19: 2.68 | V19: 2.38 | W19: 2.31 | X19: 2.25 | Y19: 2.4300000000000002 | Z19: 2.2999999999999998 | AA19: 2.29 | AB19: 3.11 | AC19: 2.79 | AD19: 2.63
A20: 2 PM | C20: 2.0299999999999998 | D20: 1.63 | E20: 1.89 | F20: 1.82 | G20: 2.5499999999999998 | H20: 2.15 | I20: 2.12 | J20: 1.58 | K20: 1.69 | L20: 1.88 | M20: 1.8 | N20: 2.39 | O20: 2.17 | P20: 2.33 | Q20: 2.23 | R20: 2.36 | S20: 2.21 | T20: 2.36 | U20: 2.91 | V20: 2.64 | W20: 2.5099999999999998 | X20: 2.62 | Y20: 2.6 | Z20: 2.69 | AA20: 2.58 | AB20: 3.26 | AC20: 3 | AD20: 2.87
A21: 3 PM | C21: 2.0299999999999998 | D21: 2.02 | E21: 2.38 | F21: 2.2999999999999998 | G21: 3.09 | H21: 2.62 | I21: 2.59 | J21: 1.92 | K21: 1.96 | L21: 2.2200000000000002 | M21: 2.2000000000000002 | N21: 2.8 | O21: 2.58 | P21: 2.66 | Q21: 2.99 | R21: 2.97 | S21: 2.83 | T21: 3 | U21: 3.48 | V21: 3.29 | W21: 3.18 | X21: 3.23 | Y21: 3.17 | Z21: 3.13 | AA21: 2.94 | AB21: 3.73 | AC21: 3.31 | AD21: 3.13
A22: 4 PM | C22: 2.58 | D22: 2.61 | E22: 3.08 | F22: 2.88 | G22: 3.78 | H22: 3.27 | I22: 3.15 | J22: 2.5 | K22: 2.5 | L22: 2.91 | M22: 2.77 | N22: 3.35 | O22: 3.12 | P22: 3.15 | Q22: 3.8 | R22: 3.72 | S22: 3.8 | T22: 3.96 | U22: 4.66 | V22: 4.2300000000000004 | W22: 3.75 | X22: 3.68 | Y22: 3.48 | Z22: 3.47 | AA22: 3.34 | AB22: 4.04 | AC22: 3.7 | AD22: 3.43
A23: 5 PM | C23: 3.28 | D23: 2.99 | E23: 3.59 | F23: 3.18 | G23: 4.07 | H23: 3.5 | I23: 3.37 | J23: 3.1 | K23: 2.91 | L23: 3.21 | M23: 3.07 | N23: 3.59 | O23: 3.24 | P23: 3.27 | Q23: 4.95 | R23: 4.51 | S23: 4.42 | T23: 4.7300000000000004 | U23: 5.31 | V23: 4.82 | W23: 4.1100000000000003 | X23: 4.04 | Y23: 3.67 | Z23: 3.78 | AA23: 3.81 | AB23: 4.53 | AC23: 4.03 | AD23: 3.53
A24: 6 PM | C24: 2.91 | D24: 2.61 | E24: 2.91 | F24: 2.61 | G24: 3.39 | H24: 2.84 | I24: 2.64 | J24: 2.5499999999999998 | K24: 2.41 | L24: 2.61 | M24: 2.4500000000000002 | N24: 3.01 | O24: 2.73 | P24: 2.66 | Q24: 4.13 | R24: 3.58 | S24: 3.76 | T24: 3.97 | U24: 4.54 | V24: 3.97 | W24: 3.48 | X24: 3.28 | Y24: 3.08 | Z24: 3.05 | AA24: 3.02 | AB24: 3.72 | AC24: 3.2 | AD24: 2.9
A25: 7 PM | C25: 1.74 | D25: 1.87 | E25: 2.0699999999999998 | F25: 1.74 | G25: 2.29 | H25: 1.93 | I25: 1.81 | J25: 1.92 | K25: 1.73 | L25: 1.91 | M25: 1.77 | N25: 2.27 | O25: 2.02 | P25: 1.95 | Q25: 2.81 | R25: 2.37 | S25: 2.5499999999999998 | T25: 2.48 | U25: 2.96 | V25: 2.71 | W25: 2.37 | X25: 2.5099999999999998 | Y25: 2.21 | Z25: 2.2799999999999998 | AA25: 2.12 | AB25: 2.89 | AC25: 2.4 | AD25: 2.3199999999999998
A26: 8 PM | C26: 1.79 | D26: 1.72 | E26: 1.81 | F26: 1.52 | G26: 2.17 | H26: 1.82 | I26: 1.68 | J26: 1.73 | K26: 1.66 | L26: 1.91 | M26: 1.51 | N26: 2.06 | O26: 1.73 | P26: 1.66 | Q26: 2.0099999999999998 | R26: 2.09 | S26: 2.33 | T26: 1.88 | U26: 2.44 | V26: 2.2599999999999998 | W26: 1.96 | X26: 2.2799999999999998 | Y26: 2.37 | Z26: 2.4300000000000002 | AA26: 1.8 | AB26: 2.56 | AC26: 2.15 | AD26: 2.0099999999999998
A27: 9 PM | C27: 1.77 | D27: 1.52 | E27: 1.53 | F27: 1.59 | G27: 2.2000000000000002 | H27: 1.84 | I27: 1.69 | J27: 1.93 | K27: 1.43 | L27: 1.48 | M27: 1.53 | N27: 2.2200000000000002 | O27: 1.76 | P27: 1.67 | Q27: 1.83 | R27: 1.78 | S27: 1.99 | T27: 1.85 | U27: 2.39 | V27: 2.12 | W27: 2.46 | X27: 1.87 | Y27: 1.89 | Z27: 1.97 | AA27: 1.88 | AB27: 2.61 | AC27: 2.13 | AD27: 2.67
A28: 10 PM | C28: 1.66 | D28: 1.58 | E28: 1.55 | F28: 1.68 | G28: 2.34 | H28: 1.9 | I28: 1.73 | J28: 2.21 | K28: 1.45 | L28: 1.58 | M28: 1.58 | N28: 2.37 | O28: 1.75 | P28: 1.73 | Q28: 1.74 | R28: 1.93 | S28: 2.52 | T28: 1.86 | U28: 2.41 | V28: 2.06 | W28: 2.5299999999999998 | X28: 1.67 | Y28: 2.16 | Z28: 2.23 | AA28: 2.12 | AB28: 2.81 | AC28: 2.15 | AD28: 2.84
A29: 11 PM | C29: 1.56 | D29: 1.59 | E29: 1.66 | F29: 1.7 | G29: 2.42 | H29: 1.91 | I29: 1.73 | J29: 1.83 | K29: 1.46 | L29: 1.62 | M29: 1.63 | N29: 2.34 | O29: 1.77 | P29: 1.79 | Q29: 1.73 | R29: 1.81 | S29: 2.36 | T29: 1.77 | U29: 2.38 | V29: 2.09 | W29: 2.12 | X29: 1.73 | Y29: 2 | Z29: 2.06 | AA29: 2 | AB29: 2.93 | AC29: 2.33 | AD29: 2.57
C30: =AVERAGE(R[-24]C:R[-1]C,R[-24]C[7]:R[-1]C[7],R[-24]C[14]:R[-1]C[14],R[-24]C[21]:R[-1]C[21]) -> 2.1103124999999996 | D30: =AVERAGE(R[-24]C:R[-1]C,R[-24]C[7]:R[-1]C[7],R[-24]C[14]:R[-1]C[14],R[-24]C[21]:R[-1]C[21]) -> 2.0504166666666666 | E30: =AVERAGE(R[-24]C:R[-1]C,R[-24]C[7]:R[-1]C[7],R[-24]C[14]:R[-1]C[14],R[-24]C[21]:R[-1]C[21]) -> 2.1360416666666668 | F30: =AVERAGE(R[-24]C:R[-1]C,R[-24]C[7]:R[-1]C[7],R[-24]C[14]:R[-1]C[14],R[-24]C[21]:R[-1]C[21]) -> 2.1108333333333329 | G30: =AVERAGE(R[-24]C:R[-1]C,R[-24]C[7]:R[-1]C[7],R[-24]C[14]:R[-1]C[14],R[-24]C[21]:R[-1]C[21]) -> 2.7508333333333326 | H30: =AVERAGE(R[-24]C:R[-1]C,R[-24]C[7]:R[-1]C[7],R[-24]C[14]:R[-1]C[14],R[-24]C[21]:R[-1]C[21]) -> 2.3678124999999999 | I30: =AVERAGE(R[-24]C:R[-1]C,R[-24]C[7]:R[-1]C[7],R[-24]C[14]:R[-1]C[14],R[-24]C[21]:R[-1]C[21]) -> 2.3084374999999997
C33: Northbound | J33: Southbound | Q33: Eastbound | X33: Westbound
C34: NPMRDS from HERE (Trucks and passenger vehicles) | J34: NPMRDS from HERE (Trucks and passenger vehicles) | Q34: NPMRDS from HERE (Trucks and passenger vehicles) | X34: NPMRDS from HERE (Trucks and passenger vehicles)
C35: 2011 (Every weekday) | D35: 2012 (Every weekday) | E35: 2013 (Every weekday) | F35: 2014 (Every weekday) | G35: 2015 (Every weekday) | H35: 2016 (Every weekday) | I35: 2017 (Every weekday) | J35: 2011 (Every weekday) | K35: 2012 (Every weekday) | L35: 2013 (Every weekday) | M35: 2014 (Every weekday) | N35: 2015 (Every weekday) | O35: 2016 (Every weekday) | P35: 2017 (Every weekday) | Q35: 2011 (Every weekday) | R35: 2012 (Every weekday) | S35: 2013 (Every weekday) | T35: 2014 (Every weekday) | U35: 2015 (Every weekday) | V35: 2016 (Every weekday) | W35: 2017 (Every weekday) | X35: 2011 (Every weekday) | Y35: 2012 (Every weekday) | Z35: 2013 (Every weekday) | AA35: 2014 (Every weekday) | AB35: 2015 (Every weekday) | AC35: 2016 (Every weekday) | AD35: 2017 (Every weekday)
C36: =RANK(R[-30]C,R6C:R29C) -> 18 | D36: =RANK(R[-30]C,R6C:R29C) -> 13 | E36: =RANK(R[-30]C,R6C:R29C) -> 13 | F36: =RANK(R[-30]C,R6C:R29C) -> 15 | G36: =RANK(R[-30]C,R6C:R29C) -> 14 | H36: =RANK(R[-30]C,R6C:R29C) -> 14 | I36: =RANK(R[-30]C,R6C:R29C) -> 17 | J36: =RANK(R[-30]C,R6C:R29C) -> 18 | K36: =RANK(R[-30]C,R6C:R29C) -> 18 | L36: =RANK(R[-30]C,R6C:R29C) -> 19 | M36: =RANK(R[-30]C,R6C:R29C) -> 19 | N36: =RANK(R[-30]C,R6C:R29C) -> 19 | O36: =RANK(R[-30]C,R6C:R29C) -> 18 | P36: =RANK(R[-30]C,R6C:R29C) -> 17 | Q36: =RANK(R[-30]C,R6C:R29C) -> 17 | R36: =RANK(R[-30]C,R6C:R29C) -> 19 | S36: =RANK(R[-30]C,R6C:R29C) -> 17 | T36: =RANK(R[-30]C,R6C:R29C) -> 21 | U36: =RANK(R[-30]C,R6C:R29C) -> 20 | V36: =RANK(R[-30]C,R6C:R29C) -> 18 | W36: =RANK(R[-30]C,R6C:R29C) -> 19 | X36: =RANK(R[-30]C,R6C:R29C) -> 18 | Y36: =RANK(R[-30]C,R6C:R29C) -> 17 | Z36: =RANK(R[-30]C,R6C:R29C) -> 20 | AA36: =RANK(R[-30]C,R6C:R29C) -> 19 | AB36: =RANK(R[-30]C,R6C:R29C) -> 17 | AC36: =RANK(R[-30]C,R6C:R29C) -> 16 | AD36: =RANK(R[-30]C,R6C:R29C) -> 18
C37: =RANK(R[-30]C,R6C:R29C) -> 10 | D37: =RANK(R[-30]C,R6C:R29C) -> 20 | E37: =RANK(R[-30]C,R6C:R29C) -> 16 | F37: =RANK(R[-30]C,R6C:R29C) -> 11 | G37: =RANK(R[-30]C,R6C:R29C) -> 14 | H37: =RANK(R[-30]C,R6C:R29C) -> 14 | I37: =RANK(R[-30]C,R6C:R29C) -> 17 | J37: =RANK(R[-30]C,R6C:R29C) -> 19 | K37: =RANK(R[-30]C,R6C:R29C) -> 19 | L37: =RANK(R[-30]C,R6C:R29C) -> 20 | M37: =RANK(R[-30]C,R6C:R29C) -> 10 | N37: =RANK(R[-30]C,R6C:R29C) -> 18 | O37: =RANK(R[-30]C,R6C:R29C) -> 16 | P37: =RANK(R[-30]C,R6C:R29C) -> 18 | Q37: =RANK(R[-30]C,R6C:R29C) -> 22 | R37: =RANK(R[-30]C,R6C:R29C) -> 20 | S37: =RANK(R[-30]C,R6C:R29C) -> 19 | T37: =RANK(R[-30]C,R6C:R29C) -> 19 | U37: =RANK(R[-30]C,R6C:R29C) -> 19 | V37: =RANK(R[-30]C,R6C:R29C) -> 19 | W37: =RANK(R[-30]C,R6C:R29C) -> 20 | X37: =RANK(R[-30]C,R6C:R29C) -> 17 | Y37: =RANK(R[-30]C,R6C:R29C) -> 21 | Z37: =RANK(R[-30]C,R6C:R29C) -> 19 | AA37: =RANK(R[-30]C,R6C:R29C) -> 18 | AB37: =RANK(R[-30]C,R6C:R29C) -> 20 | AC37: =RANK(R[-30]C,R6C:R29C) -> 20 | AD37: =RANK(R[-30]C,R6C:R29C) -> 20
C38: =RANK(R[-30]C,R6C:R29C) -> 19 | D38: =RANK(R[-30]C,R6C:R29C) -> 21 | E38: =RANK(R[-30]C,R6C:R29C) -> 19 | F38: =RANK(R[-30]C,R6C:R29C) -> 14 | G38: =RANK(R[-30]C,R6C:R29C) -> 19 | H38: =RANK(R[-30]C,R6C:R29C) -> 17 | I38: =RANK(R[-30]C,R6C:R29C) -> 19 | J38: =RANK(R[-30]C,R6C:R29C) -> 14 | K38: =RANK(R[-30]C,R6C:R29C) -> 21 | L38: =RANK(R[-30]C,R6C:R29C) -> 12 | M38: =RANK(R[-30]C,R6C:R29C) -> 8 | N38: =RANK(R[-30]C,R6C:R29C) -> 20 | O38: =RANK(R[-30]C,R6C:R29C) -> 21 | P38: =RANK(R[-30]C,R6C:R29C) -> 19 | Q38: =RANK(R[-30]C,R6C:R29C) -> 11 | R38: =RANK(R[-30]C,R6C:R29C) -> 16 | S38: =RANK(R[-30]C,R6C:R29C) -> 20 | T38: =RANK(R[-30]C,R6C:R29C) -> 19 | U38: =RANK(R[-30]C,R6C:R29C) -> 21 | V38: =RANK(R[-30]C,R6C:R29C) -> 21 | W38: =RANK(R[-30]C,R6C:R29C) -> 21 | X38: =RANK(R[-30]C,R6C:R29C) -> 20 | Y38: =RANK(R[-30]C,R6C:R29C) -> 17 | Z38: =RANK(R[-30]C,R6C:R29C) -> 21 | AA38: =RANK(R[-30]C,R6C:R29C) -> 21 | AB38: =RANK(R[-30]C,R6C:R29C) -> 21 | AC38: =RANK(R[-30]C,R6C:R29C) -> 21 | AD38: =RANK(R[-30]C,R6C:R29C) -> 21
C39: =RANK(R[-30]C,R6C:R29C) -> 21 | D39: =RANK(R[-30]C,R6C:R29C) -> 22 | E39: =RANK(R[-30]C,R6C:R29C) -> 22 | F39: =RANK(R[-30]C,R6C:R29C) -> 19 | G39: =RANK(R[-30]C,R6C:R29C) -> 22 | H39: =RANK(R[-30]C,R6C:R29C) -> 22 | I39: =RANK(R[-30]C,R6C:R29C) -> 22 | J39: =RANK(R[-30]C,R6C:R29C) -> 21 | K39: =RANK(R[-30]C,R6C:R29C) -> 22 | L39: =RANK(R[-30]C,R6C:R29C) -> 22 | M39: =RANK(R[-30]C,R6C:R29C) -> 14 | N39: =RANK(R[-30]C,R6C:R29C) -> 22 | O39: =RANK(R[-30]C,R6C:R29C) -> 22 | P39: =RANK(R[-30]C,R6C:R29C) -> 22 | Q39: =RANK(R[-30]C,R6C:R29C) -> 21 | R39: =RANK(R[-30]C,R6C:R29C) -> 22 | S39: =RANK(R[-30]C,R6C:R29C) -> 22 | T39: =RANK(R[-30]C,R6C:R29C) -> 22 | U39: =RANK(R[-30]C,R6C:R29C) -> 22 | V39: =RANK(R[-30]C,R6C:R29C) -> 22 | W39: =RANK(R[-30]C,R6C:R29C) -> 22 | X39: =RANK(R[-30]C,R6C:R29C) -> 22 | Y39: =RANK(R[-30]C,R6C:R29C) -> 22 | Z39: =RANK(R[-30]C,R6C:R29C) -> 22 | AA39: =RANK(R[-30]C,R6C:R29C) -> 22 | AB39: =RANK(R[-30]C,R6C:R29C) -> 22 | AC39: =RANK(R[-30]C,R6C:R29C) -> 22 | AD39: =RANK(R[-30]C,R6C:R29C) -> 22
C40: =RANK(R[-30]C,R6C:R29C) -> 22 | D40: =RANK(R[-30]C,R6C:R29C) -> 19 | E40: =RANK(R[-30]C,R6C:R29C) -> 21 | F40: =RANK(R[-30]C,R6C:R29C) -> 21 | G40: =RANK(R[-30]C,R6C:R29C) -> 23 | H40: =RANK(R[-30]C,R6C:R29C) -> 23 | I40: =RANK(R[-30]C,R6C:R29C) -> 23 | J40: =RANK(R[-30]C,R6C:R29C) -> 23 | K40: =RANK(R[-30]C,R6C:R29C) -> 23 | L40: =RANK(R[-30]C,R6C:R29C) -> 23 | M40: =RANK(R[-30]C,R6C:R29C) -> 23 | N40: =RANK(R[-30]C,R6C:R29C) -> 23 | O40: =RANK(R[-30]C,R6C:R29C) -> 23 | P40: =RANK(R[-30]C,R6C:R29C) -> 23 | Q40: =RANK(R[-30]C,R6C:R29C) -> 23 | R40: =RANK(R[-30]C,R6C:R29C) -> 23 | S40: =RANK(R[-30]C,R6C:R29C) -> 23 | T40: =RANK(R[-30]C,R6C:R29C) -> 23 | U40: =RANK(R[-30]C,R6C:R29C) -> 23 | V40: =RANK(R[-30]C,R6C:R29C) -> 23 | W40: =RANK(R[-30]C,R6C:R29C) -> 23 | X40: =RANK(R[-30]C,R6C:R29C) -> 23 | Y40: =RANK(R[-30]C,R6C:R29C) -> 23 | Z40: =RANK(R[-30]C,R6C:R29C) -> 23 | AA40: =RANK(R[-30]C,R6C:R29C) -> 23 | AB40: =RANK(R[-30]C,R6C:R29C) -> 23 | AC40: =RANK(R[-30]C,R6C:R29C) -> 23 | AD40: =RANK(R[-30]C,R6C:R29C) -> 23
C41: =RANK(R[-30]C,R6C:R29C) -> 23 | D41: =RANK(R[-30]C,R6C:R29C) -> 23 | E41: =RANK(R[-30]C,R6C:R29C) -> 24 | F41: =RANK(R[-30]C,R6C:R29C) -> 24 | G41: =RANK(R[-30]C,R6C:R29C) -> 24 | H41: =RANK(R[-30]C,R6C:R29C) -> 24 | I41: =RANK(R[-30]C,R6C:R29C) -> 24 | J41: =RANK(R[-30]C,R6C:R29C) -> 24 | K41: =RANK(R[-30]C,R6C:R29C) -> 24 | L41: =RANK(R[-30]C,R6C:R29C) -> 24 | M41: =RANK(R[-30]C,R6C:R29C) -> 24 | N41: =RANK(R[-30]C,R6C:R29C) -> 24 | O41: =RANK(R[-30]C,R6C:R29C) -> 24 | P41: =RANK(R[-30]C,R6C:R29C) -> 24 | Q41: =RANK(R[-30]C,R6C:R29C) -> 24 | R41: =RANK(R[-30]C,R6C:R29C) -> 24 | S41: =RANK(R[-30]C,R6C:R29C) -> 24 | T41: =RANK(R[-30]C,R6C:R29C) -> 24 | U41: =RANK(R[-30]C,R6C:R29C) -> 24 | V41: =RANK(R[-30]C,R6C:R29C) -> 24 | W41: =RANK(R[-30]C,R6C:R29C) -> 24 | X41: =RANK(R[-30]C,R6C:R29C) -> 24 | Y41: =RANK(R[-30]C,R6C:R29C) -> 24 | Z41: =RANK(R[-30]C,R6C:R29C) -> 24 | AA41: =RANK(R[-30]C,R6C:R29C) -> 24 | AB41: =RANK(R[-30]C,R6C:R29C) -> 24 | AC41: =RANK(R[-30]C,R6C:R29C) -> 24 | AD41: =RANK(R[-30]C,R6C:R29C) -> 24
C42: =RANK(R[-30]C,R6C:R29C) -> 24 | D42: =RANK(R[-30]C,R6C:R29C) -> 24 | E42: =RANK(R[-30]C,R6C:R29C) -> 23 | F42: =RANK(R[-30]C,R6C:R29C) -> 16 | G42: =RANK(R[-30]C,R6C:R29C) -> 20 | H42: =RANK(R[-30]C,R6C:R29C) -> 19 | I42: =RANK(R[-30]C,R6C:R29C) -> 14 | J42: =RANK(R[-30]C,R6C:R29C) -> 13 | K42: =RANK(R[-30]C,R6C:R29C) -> 11 | L42: =RANK(R[-30]C,R6C:R29C) -> 11 | M42: =RANK(R[-30]C,R6C:R29C) -> 9 | N42: =RANK(R[-30]C,R6C:R29C) -> 9 | O42: =RANK(R[-30]C,R6C:R29C) -> 9 | P42: =RANK(R[-30]C,R6C:R29C) -> 11 | Q42: =RANK(R[-30]C,R6C:R29C) -> 16 | R42: =RANK(R[-30]C,R6C:R29C) -> 21 | S42: =RANK(R[-30]C,R6C:R29C) -> 21 | T42: =RANK(R[-30]C,R6C:R29C) -> 15 | U42: =RANK(R[-30]C,R6C:R29C) -> 14 | V42: =RANK(R[-30]C,R6C:R29C) -> 15 | W42: =RANK(R[-30]C,R6C:R29C) -> 16 | X42: =RANK(R[-30]C,R6C:R29C) -> 13 | Y42: =RANK(R[-30]C,R6C:R29C) -> 19 | Z42: =RANK(R[-30]C,R6C:R29C) -> 17 | AA42: =RANK(R[-30]C,R6C:R29C) -> 15 | AB42: =RANK(R[-30]C,R6C:R29C) -> 15 | AC42: =RANK(R[-30]C,R6C:R29C) -> 13 | AD42: =RANK(R[-30]C,R6C:R29C) -> 16
C43: =RANK(R[-30]C,R6C:R29C) -> 5 | D43: =RANK(R[-30]C,R6C:R29C) -> 5 | E43: =RANK(R[-30]C,R6C:R29C) -> 6 | F43: =RANK(R[-30]C,R6C:R29C) -> 5 | G43: =RANK(R[-30]C,R6C:R29C) -> 6 | H43: =RANK(R[-30]C,R6C:R29C) -> 5 | I43: =RANK(R[-30]C,R6C:R29C) -> 4 | J43: =RANK(R[-30]C,R6C:R29C) -> 3 | K43: =RANK(R[-30]C,R6C:R29C) -> 5 | L43: =RANK(R[-30]C,R6C:R29C) -> 5 | M43: =RANK(R[-30]C,R6C:R29C) -> 4 | N43: =RANK(R[-30]C,R6C:R29C) -> 4 | O43: =RANK(R[-30]C,R6C:R29C) -> 4 | P43: =RANK(R[-30]C,R6C:R29C) -> 2 | Q43: =RANK(R[-30]C,R6C:R29C) -> 7 | R43: =RANK(R[-30]C,R6C:R29C) -> 6 | S43: =RANK(R[-30]C,R6C:R29C) -> 8 | T43: =RANK(R[-30]C,R6C:R29C) -> 7 | U43: =RANK(R[-30]C,R6C:R29C) -> 6 | V43: =RANK(R[-30]C,R6C:R29C) -> 6 | W43: =RANK(R[-30]C,R6C:R29C) -> 6 | X43: =RANK(R[-30]C,R6C:R29C) -> 5 | Y43: =RANK(R[-30]C,R6C:R29C) -> 6 | Z43: =RANK(R[-30]C,R6C:R29C) -> 6 | AA43: =RANK(R[-30]C,R6C:R29C) -> 4 | AB43: =RANK(R[-30]C,R6C:R29C) -> 4 | AC43: =RANK(R[-30]C,R6C:R29C) -> 4 | AD43: =RANK(R[-30]C,R6C:R29C) -> 2
C44: =RANK(R[-30]C,R6C:R29C) -> 4 | D44: =RANK(R[-30]C,R6C:R29C) -> 4 | E44: =RANK(R[-30]C,R6C:R29C) -> 4 | F44: =RANK(R[-30]C,R6C:R29C) -> 3 | G44: =RANK(R[-30]C,R6C:R29C) -> 4 | H44: =RANK(R[-30]C,R6C:R29C) -> 3 | I44: =RANK(R[-30]C,R6C:R29C) -> 3 | J44: =RANK(R[-30]C,R6C:R29C) -> 3 | K44: =RANK(R[-30]C,R6C:R29C) -> 4 | L44: =RANK(R[-30]C,R6C:R29C) -> 4 | M44: =RANK(R[-30]C,R6C:R29C) -> 3 | N44: =RANK(R[-30]C,R6C:R29C) -> 3 | O44: =RANK(R[-30]C,R6C:R29C) -> 3 | P44: =RANK(R[-30]C,R6C:R29C) -> 4 | Q44: =RANK(R[-30]C,R6C:R29C) -> 6 | R44: =RANK(R[-30]C,R6C:R29C) -> 5 | S44: =RANK(R[-30]C,R6C:R29C) -> 7 | T44: =RANK(R[-30]C,R6C:R29C) -> 5 | U44: =RANK(R[-30]C,R6C:R29C) -> 5 | V44: =RANK(R[-30]C,R6C:R29C) -> 5 | W44: =RANK(R[-30]C,R6C:R29C) -> 5 | X44: =RANK(R[-30]C,R6C:R29C) -> 3 | Y44: =RANK(R[-30]C,R6C:R29C) -> 3 | Z44: =RANK(R[-30]C,R6C:R29C) -> 3 | AA44: =RANK(R[-30]C,R6C:R29C) -> 2 | AB44: =RANK(R[-30]C,R6C:R29C) -> 2 | AC44: =RANK(R[-30]C,R6C:R29C) -> 2 | AD44: =RANK(R[-30]C,R6C:R29C) -> 1
C45: =RANK(R[-30]C,R6C:R29C) -> 8 | D45: =RANK(R[-30]C,R6C:R29C) -> 8 | E45: =RANK(R[-30]C,R6C:R29C) -> 8 | F45: =RANK(R[-30]C,R6C:R29C) -> 7 | G45: =RANK(R[-30]C,R6C:R29C) -> 7 | H45: =RANK(R[-30]C,R6C:R29C) -> 8 | I45: =RANK(R[-30]C,R6C:R29C) -> 8 | J45: =RANK(R[-30]C,R6C:R29C) -> 10 | K45: =RANK(R[-30]C,R6C:R29C) -> 7 | L45: =RANK(R[-30]C,R6C:R29C) -> 7 | M45: =RANK(R[-30]C,R6C:R29C) -> 7 | N45: =RANK(R[-30]C,R6C:R29C) -> 7 | O45: =RANK(R[-30]C,R6C:R29C) -> 7 | P45: =RANK(R[-30]C,R6C:R29C) -> 8 | Q45: =RANK(R[-30]C,R6C:R29C) -> 9 | R45: =RANK(R[-30]C,R6C:R29C) -> 11 | S45: =RANK(R[-30]C,R6C:R29C) -> 12 | T45: =RANK(R[-30]C,R6C:R29C) -> 9 | U45: =RANK(R[-30]C,R6C:R29C) -> 9 | V45: =RANK(R[-30]C,R6C:R29C) -> 9 | W45: =RANK(R[-30]C,R6C:R29C) -> 12 | X45: =RANK(R[-30]C,R6C:R29C) -> 9 | Y45: =RANK(R[-30]C,R6C:R29C) -> 8 | Z45: =RANK(R[-30]C,R6C:R29C) -> 8 | AA45: =RANK(R[-30]C,R6C:R29C) -> 7 | AB45: =RANK(R[-30]C,R6C:R29C) -> 7 | AC45: =RANK(R[-30]C,R6C:R29C) -> 7 | AD45: =RANK(R[-30]C,R6C:R29C) -> 8
C46: =RANK(R[-30]C,R6C:R29C) -> 12 | D46: =RANK(R[-30]C,R6C:R29C) -> 13 | E46: =RANK(R[-30]C,R6C:R29C) -> 14 | F46: =RANK(R[-30]C,R6C:R29C) -> 19 | G46: =RANK(R[-30]C,R6C:R29C) -> 16 | H46: =RANK(R[-30]C,R6C:R29C) -> 17 | I46: =RANK(R[-30]C,R6C:R29C) -> 10 | J46: =RANK(R[-30]C,R6C:R29C) -> 15 | K46: =RANK(R[-30]C,R6C:R29C) -> 11 | L46: =RANK(R[-30]C,R6C:R29C) -> 12 | M46: =RANK(R[-30]C,R6C:R29C) -> 13 | N46: =RANK(R[-30]C,R6C:R29C) -> 12 | O46: =RANK(R[-30]C,R6C:R29C) -> 12 | P46: =RANK(R[-30]C,R6C:R29C) -> 12 | Q46: =RANK(R[-30]C,R6C:R29C) -> 12 | R46: =RANK(R[-30]C,R6C:R29C) -> 9 | S46: =RANK(R[-30]C,R6C:R29C) -> 13 | T46: =RANK(R[-30]C,R6C:R29C) -> 10 | U46: =RANK(R[-30]C,R6C:R29C) -> 9 | V46: =RANK(R[-30]C,R6C:R29C) -> 10 | W46: =RANK(R[-30]C,R6C:R29C) -> 10 | X46: =RANK(R[-30]C,R6C:R29C) -> 14 | Y46: =RANK(R[-30]C,R6C:R29C) -> 12 | Z46: =RANK(R[-30]C,R6C:R29C) -> 15 | AA46: =RANK(R[-30]C,R6C:R29C) -> 11 | AB46: =RANK(R[-30]C,R6C:R29C) -> 11 | AC46: =RANK(R[-30]C,R6C:R29C) -> 10 | AD46: =RANK(R[-30]C,R6C:R29C) -> 14
C47: =RANK(R[-30]C,R6C:R29C) -> 11 | D47: =RANK(R[-30]C,R6C:R29C) -> 17 | E47: =RANK(R[-30]C,R6C:R29C) -> 16 | F47: =RANK(R[-30]C,R6C:R29C) -> 16 | G47: =RANK(R[-30]C,R6C:R29C) -> 16 | H47: =RANK(R[-30]C,R6C:R29C) -> 21 | I47: =RANK(R[-30]C,R6C:R29C) -> 11 | J47: =RANK(R[-30]C,R6C:R29C) -> 17 | K47: =RANK(R[-30]C,R6C:R29C) -> 14 | L47: =RANK(R[-30]C,R6C:R29C) -> 14 | M47: =RANK(R[-30]C,R6C:R29C) -> 15 | N47: =RANK(R[-30]C,R6C:R29C) -> 14 | O47: =RANK(R[-30]C,R6C:R29C) -> 14 | P47: =RANK(R[-30]C,R6C:R29C) -> 10 | Q47: =RANK(R[-30]C,R6C:R29C) -> 15 | R47: =RANK(R[-30]C,R6C:R29C) -> 9 | S47: =RANK(R[-30]C,R6C:R29C) -> 14 | T47: =RANK(R[-30]C,R6C:R29C) -> 13 | U47: =RANK(R[-30]C,R6C:R29C) -> 11 | V47: =RANK(R[-30]C,R6C:R29C) -> 13 | W47: =RANK(R[-30]C,R6C:R29C) -> 13 | X47: =RANK(R[-30]C,R6C:R29C) -> 11 | Y47: =RANK(R[-30]C,R6C:R29C) -> 13 | Z47: =RANK(R[-30]C,R6C:R29C) -> 14 | AA47: =RANK(R[-30]C,R6C:R29C) -> 14 | AB47: =RANK(R[-30]C,R6C:R29C) -> 12 | AC47: =RANK(R[-30]C,R6C:R29C) -> 11 | AD47: =RANK(R[-30]C,R6C:R29C) -> 14
C48: =RANK(R[-30]C,R6C:R29C) -> 14 | D48: =RANK(R[-30]C,R6C:R29C) -> 16 | E48: =RANK(R[-30]C,R6C:R29C) -> 15 | F48: =RANK(R[-30]C,R6C:R29C) -> 21 | G48: =RANK(R[-30]C,R6C:R29C) -> 13 | H48: =RANK(R[-30]C,R6C:R29C) -> 13 | I48: =RANK(R[-30]C,R6C:R29C) -> 12 | J48: =RANK(R[-30]C,R6C:R29C) -> 21 | K48: =RANK(R[-30]C,R6C:R29C) -> 13 | L48: =RANK(R[-30]C,R6C:R29C) -> 17 | M48: =RANK(R[-30]C,R6C:R29C) -> 18 | N48: =RANK(R[-30]C,R6C:R29C) -> 16 | O48: =RANK(R[-30]C,R6C:R29C) -> 13 | P48: =RANK(R[-30]C,R6C:R29C) -> 12 | Q48: =RANK(R[-30]C,R6C:R29C) -> 19 | R48: =RANK(R[-30]C,R6C:R29C) -> 13 | S48: =RANK(R[-30]C,R6C:R29C) -> 17 | T48: =RANK(R[-30]C,R6C:R29C) -> 12 | U48: =RANK(R[-30]C,R6C:R29C) -> 12 | V48: =RANK(R[-30]C,R6C:R29C) -> 12 | W48: =RANK(R[-30]C,R6C:R29C) -> 15 | X48: =RANK(R[-30]C,R6C:R29C) -> 15 | Y48: =RANK(R[-30]C,R6C:R29C) -> 10 | Z48: =RANK(R[-30]C,R6C:R29C) -> 12 | AA48: =RANK(R[-30]C,R6C:R29C) -> 10 | AB48: =RANK(R[-30]C,R6C:R29C) -> 10 | AC48: =RANK(R[-30]C,R6C:R29C) -> 12 | AD48: =RANK(R[-30]C,R6C:R29C) -> 13
C49: =RANK(R[-30]C,R6C:R29C) -> 9 | D49: =RANK(R[-30]C,R6C:R29C) -> 15 | E49: =RANK(R[-30]C,R6C:R29C) -> 11 | F49: =RANK(R[-30]C,R6C:R29C) -> 13 | G49: =RANK(R[-30]C,R6C:R29C) -> 10 | H49: =RANK(R[-30]C,R6C:R29C) -> 9 | I49: =RANK(R[-30]C,R6C:R29C) -> 9 | J49: =RANK(R[-30]C,R6C:R29C) -> 20 | K49: =RANK(R[-30]C,R6C:R29C) -> 15 | L49: =RANK(R[-30]C,R6C:R29C) -> 15 | M49: =RANK(R[-30]C,R6C:R29C) -> 15 | N49: =RANK(R[-30]C,R6C:R29C) -> 17 | O49: =RANK(R[-30]C,R6C:R29C) -> 10 | P49: =RANK(R[-30]C,R6C:R29C) -> 9 | Q49: =RANK(R[-30]C,R6C:R29C) -> 13 | R49: =RANK(R[-30]C,R6C:R29C) -> 12 | S49: =RANK(R[-30]C,R6C:R29C) -> 16 | T49: =RANK(R[-30]C,R6C:R29C) -> 11 | U49: =RANK(R[-30]C,R6C:R29C) -> 13 | V49: =RANK(R[-30]C,R6C:R29C) -> 11 | W49: =RANK(R[-30]C,R6C:R29C) -> 14 | X49: =RANK(R[-30]C,R6C:R29C) -> 12 | Y49: =RANK(R[-30]C,R6C:R29C) -> 9 | Z49: =RANK(R[-30]C,R6C:R29C) -> 10 | AA49: =RANK(R[-30]C,R6C:R29C) -> 9 | AB49: =RANK(R[-30]C,R6C:R29C) -> 9 | AC49: =RANK(R[-30]C,R6C:R29C) -> 9 | AD49: =RANK(R[-30]C,R6C:R29C) -> 11
C50: =RANK(R[-30]C,R6C:R29C) -> 6 | D50: =RANK(R[-30]C,R6C:R29C) -> 10 | E50: =RANK(R[-30]C,R6C:R29C) -> 9 | F50: =RANK(R[-30]C,R6C:R29C) -> 8 | G50: =RANK(R[-30]C,R6C:R29C) -> 8 | H50: =RANK(R[-30]C,R6C:R29C) -> 7 | I50: =RANK(R[-30]C,R6C:R29C) -> 7 | J50: =RANK(R[-30]C,R6C:R29C) -> 16 | K50: =RANK(R[-30]C,R6C:R29C) -> 9 | L50: =RANK(R[-30]C,R6C:R29C) -> 10 | M50: =RANK(R[-30]C,R6C:R29C) -> 10 | N50: =RANK(R[-30]C,R6C:R29C) -> 8 | O50: =RANK(R[-30]C,R6C:R29C) -> 8 | P50: =RANK(R[-30]C,R6C:R29C) -> 7 | Q50: =RANK(R[-30]C,R6C:R29C) -> 8 | R50: =RANK(R[-30]C,R6C:R29C) -> 8 | S50: =RANK(R[-30]C,R6C:R29C) -> 11 | T50: =RANK(R[-30]C,R6C:R29C) -> 8 | U50: =RANK(R[-30]C,R6C:R29C) -> 8 | V50: =RANK(R[-30]C,R6C:R29C) -> 8 | W50: =RANK(R[-30]C,R6C:R29C) -> 8 | X50: =RANK(R[-30]C,R6C:R29C) -> 7 | Y50: =RANK(R[-30]C,R6C:R29C) -> 7 | Z50: =RANK(R[-30]C,R6C:R29C) -> 7 | AA50: =RANK(R[-30]C,R6C:R29C) -> 8 | AB50: =RANK(R[-30]C,R6C:R29C) -> 8 | AC50: =RANK(R[-30]C,R6C:R29C) -> 8 | AD50: =RANK(R[-30]C,R6C:R29C) -> 7
C51: =RANK(R[-30]C,R6C:R29C) -> 6 | D51: =RANK(R[-30]C,R6C:R29C) -> 6 | E51: =RANK(R[-30]C,R6C:R29C) -> 5 | F51: =RANK(R[-30]C,R6C:R29C) -> 6 | G51: =RANK(R[-30]C,R6C:R29C) -> 5 | H51: =RANK(R[-30]C,R6C:R29C) -> 5 | I51: =RANK(R[-30]C,R6C:R29C) -> 6 | J51: =RANK(R[-30]C,R6C:R29C) -> 8 | K51: =RANK(R[-30]C,R6C:R29C) -> 6 | L51: =RANK(R[-30]C,R6C:R29C) -> 6 | M51: =RANK(R[-30]C,R6C:R29C) -> 6 | N51: =RANK(R[-30]C,R6C:R29C) -> 6 | O51: =RANK(R[-30]C,R6C:R29C) -> 6 | P51: =RANK(R[-30]C,R6C:R29C) -> 5 | Q51: =RANK(R[-30]C,R6C:R29C) -> 4 | R51: =RANK(R[-30]C,R6C:R29C) -> 4 | S51: =RANK(R[-30]C,R6C:R29C) -> 4 | T51: =RANK(R[-30]C,R6C:R29C) -> 4 | U51: =RANK(R[-30]C,R6C:R29C) -> 4 | V51: =RANK(R[-30]C,R6C:R29C) -> 4 | W51: =RANK(R[-30]C,R6C:R29C) -> 4 | X51: =RANK(R[-30]C,R6C:R29C) -> 6 | Y51: =RANK(R[-30]C,R6C:R29C) -> 4 | Z51: =RANK(R[-30]C,R6C:R29C) -> 4 | AA51: =RANK(R[-30]C,R6C:R29C) -> 6 | AB51: =RANK(R[-30]C,R6C:R29C) -> 5 | AC51: =RANK(R[-30]C,R6C:R29C) -> 5 | AD51: =RANK(R[-30]C,R6C:R29C) -> 5
C52: =RANK(R[-30]C,R6C:R29C) -> 3 | D52: =RANK(R[-30]C,R6C:R29C) -> 2 | E52: =RANK(R[-30]C,R6C:R29C) -> 2 | F52: =RANK(R[-30]C,R6C:R29C) -> 2 | G52: =RANK(R[-30]C,R6C:R29C) -> 2 | H52: =RANK(R[-30]C,R6C:R29C) -> 2 | I52: =RANK(R[-30]C,R6C:R29C) -> 2 | J52: =RANK(R[-30]C,R6C:R29C) -> 3 | K52: =RANK(R[-30]C,R6C:R29C) -> 2 | L52: =RANK(R[-30]C,R6C:R29C) -> 2 | M52: =RANK(R[-30]C,R6C:R29C) -> 2 | N52: =RANK(R[-30]C,R6C:R29C) -> 2 | O52: =RANK(R[-30]C,R6C:R29C) -> 2 | P52: =RANK(R[-30]C,R6C:R29C) -> 3 | Q52: =RANK(R[-30]C,R6C:R29C) -> 3 | R52: =RANK(R[-30]C,R6C:R29C) -> 2 | S52: =RANK(R[-30]C,R6C:R29C) -> 2 | T52: =RANK(R[-30]C,R6C:R29C) -> 3 | U52: =RANK(R[-30]C,R6C:R29C) -> 2 | V52: =RANK(R[-30]C,R6C:R29C) -> 2 | W52: =RANK(R[-30]C,R6C:R29C) -> 2 | X52: =RANK(R[-30]C,R6C:R29C) -> 2 | Y52: =RANK(R[-30]C,R6C:R29C) -> 2 | Z52: =RANK(R[-30]C,R6C:R29C) -> 2 | AA52: =RANK(R[-30]C,R6C:R29C) -> 3 | AB52: =RANK(R[-30]C,R6C:R29C) -> 3 | AC52: =RANK(R[-30]C,R6C:R29C) -> 3 | AD52: =RANK(R[-30]C,R6C:R29C) -> 4
C53: =RANK(R[-30]C,R6C:R29C) -> 1 | D53: =RANK(R[-30]C,R6C:R29C) -> 1 | E53: =RANK(R[-30]C,R6C:R29C) -> 1 | F53: =RANK(R[-30]C,R6C:R29C) -> 1 | G53: =RANK(R[-30]C,R6C:R29C) -> 1 | H53: =RANK(R[-30]C,R6C:R29C) -> 1 | I53: =RANK(R[-30]C,R6C:R29C) -> 1 | J53: =RANK(R[-30]C,R6C:R29C) -> 1 | K53: =RANK(R[-30]C,R6C:R29C) -> 1 | L53: =RANK(R[-30]C,R6C:R29C) -> 1 | M53: =RANK(R[-30]C,R6C:R29C) -> 1 | N53: =RANK(R[-30]C,R6C:R29C) -> 1 | O53: =RANK(R[-30]C,R6C:R29C) -> 1 | P53: =RANK(R[-30]C,R6C:R29C) -> 1 | Q53: =RANK(R[-30]C,R6C:R29C) -> 1 | R53: =RANK(R[-30]C,R6C:R29C) -> 1 | S53: =RANK(R[-30]C,R6C:R29C) -> 1 | T53: =RANK(R[-30]C,R6C:R29C) -> 1 | U53: =RANK(R[-30]C,R6C:R29C) -> 1 | V53: =RANK(R[-30]C,R6C:R29C) -> 1 | W53: =RANK(R[-30]C,R6C:R29C) -> 1 | X53: =RANK(R[-30]C,R6C:R29C) -> 1 | Y53: =RANK(R[-30]C,R6C:R29C) -> 1 | Z53: =RANK(R[-30]C,R6C:R29C) -> 1 | AA53: =RANK(R[-30]C,R6C:R29C) -> 1 | AB53: =RANK(R[-30]C,R6C:R29C) -> 1 | AC53: =RANK(R[-30]C,R6C:R29C) -> 1 | AD53: =RANK(R[-30]C,R6C:R29C) -> 2
C54: =RANK(R[-30]C,R6C:R29C) -> 2 | D54: =RANK(R[-30]C,R6C:R29C) -> 2 | E54: =RANK(R[-30]C,R6C:R29C) -> 3 | F54: =RANK(R[-30]C,R6C:R29C) -> 4 | G54: =RANK(R[-30]C,R6C:R29C) -> 3 | H54: =RANK(R[-30]C,R6C:R29C) -> 4 | I54: =RANK(R[-30]C,R6C:R29C) -> 5 | J54: =RANK(R[-30]C,R6C:R29C) -> 2 | K54: =RANK(R[-30]C,R6C:R29C) -> 3 | L54: =RANK(R[-30]C,R6C:R29C) -> 3 | M54: =RANK(R[-30]C,R6C:R29C) -> 5 | N54: =RANK(R[-30]C,R6C:R29C) -> 5 | O54: =RANK(R[-30]C,R6C:R29C) -> 5 | P54: =RANK(R[-30]C,R6C:R29C) -> 5 | Q54: =RANK(R[-30]C,R6C:R29C) -> 2 | R54: =RANK(R[-30]C,R6C:R29C) -> 3 | S54: =RANK(R[-30]C,R6C:R29C) -> 3 | T54: =RANK(R[-30]C,R6C:R29C) -> 2 | U54: =RANK(R[-30]C,R6C:R29C) -> 3 | V54: =RANK(R[-30]C,R6C:R29C) -> 3 | W54: =RANK(R[-30]C,R6C:R29C) -> 3 | X54: =RANK(R[-30]C,R6C:R29C) -> 4 | Y54: =RANK(R[-30]C,R6C:R29C) -> 5 | Z54: =RANK(R[-30]C,R6C:R29C) -> 5 | AA54: =RANK(R[-30]C,R6C:R29C) -> 5 | AB54: =RANK(R[-30]C,R6C:R29C) -> 6 | AC54: =RANK(R[-30]C,R6C:R29C) -> 6 | AD54: =RANK(R[-30]C,R6C:R29C) -> 6
C55: =RANK(R[-30]C,R6C:R29C) -> 16 | D55: =RANK(R[-30]C,R6C:R29C) -> 7 | E55: =RANK(R[-30]C,R6C:R29C) -> 7 | F55: =RANK(R[-30]C,R6C:R29C) -> 9 | G55: =RANK(R[-30]C,R6C:R29C) -> 12 | H55: =RANK(R[-30]C,R6C:R29C) -> 10 | I55: =RANK(R[-30]C,R6C:R29C) -> 13 | J55: =RANK(R[-30]C,R6C:R29C) -> 8 | K55: =RANK(R[-30]C,R6C:R29C) -> 8 | L55: =RANK(R[-30]C,R6C:R29C) -> 8 | M55: =RANK(R[-30]C,R6C:R29C) -> 12 | N55: =RANK(R[-30]C,R6C:R29C) -> 13 | O55: =RANK(R[-30]C,R6C:R29C) -> 10 | P55: =RANK(R[-30]C,R6C:R29C) -> 14 | Q55: =RANK(R[-30]C,R6C:R29C) -> 5 | R55: =RANK(R[-30]C,R6C:R29C) -> 7 | S55: =RANK(R[-30]C,R6C:R29C) -> 5 | T55: =RANK(R[-30]C,R6C:R29C) -> 6 | U55: =RANK(R[-30]C,R6C:R29C) -> 7 | V55: =RANK(R[-30]C,R6C:R29C) -> 7 | W55: =RANK(R[-30]C,R6C:R29C) -> 11 | X55: =RANK(R[-30]C,R6C:R29C) -> 8 | Y55: =RANK(R[-30]C,R6C:R29C) -> 14 | Z55: =RANK(R[-30]C,R6C:R29C) -> 11 | AA55: =RANK(R[-30]C,R6C:R29C) -> 12 | AB55: =RANK(R[-30]C,R6C:R29C) -> 14 | AC55: =RANK(R[-30]C,R6C:R29C) -> 14 | AD55: =RANK(R[-30]C,R6C:R29C) -> 17
C56: =RANK(R[-30]C,R6C:R29C) -> 12 | D56: =RANK(R[-30]C,R6C:R29C) -> 8 | E56: =RANK(R[-30]C,R6C:R29C) -> 10 | F56: =RANK(R[-30]C,R6C:R29C) -> 23 | G56: =RANK(R[-30]C,R6C:R29C) -> 21 | H56: =RANK(R[-30]C,R6C:R29C) -> 19 | I56: =RANK(R[-30]C,R6C:R29C) -> 21 | J56: =RANK(R[-30]C,R6C:R29C) -> 12 | K56: =RANK(R[-30]C,R6C:R29C) -> 10 | L56: =RANK(R[-30]C,R6C:R29C) -> 8 | M56: =RANK(R[-30]C,R6C:R29C) -> 22 | N56: =RANK(R[-30]C,R6C:R29C) -> 21 | O56: =RANK(R[-30]C,R6C:R29C) -> 20 | P56: =RANK(R[-30]C,R6C:R29C) -> 21 | Q56: =RANK(R[-30]C,R6C:R29C) -> 10 | R56: =RANK(R[-30]C,R6C:R29C) -> 14 | S56: =RANK(R[-30]C,R6C:R29C) -> 10 | T56: =RANK(R[-30]C,R6C:R29C) -> 14 | U56: =RANK(R[-30]C,R6C:R29C) -> 15 | V56: =RANK(R[-30]C,R6C:R29C) -> 14 | W56: =RANK(R[-30]C,R6C:R29C) -> 18 | X56: =RANK(R[-30]C,R6C:R29C) -> 10 | Y56: =RANK(R[-30]C,R6C:R29C) -> 11 | Z56: =RANK(R[-30]C,R6C:R29C) -> 9 | AA56: =RANK(R[-30]C,R6C:R29C) -> 19 | AB56: =RANK(R[-30]C,R6C:R29C) -> 19 | AC56: =RANK(R[-30]C,R6C:R29C) -> 17 | AD56: =RANK(R[-30]C,R6C:R29C) -> 19
C57: =RANK(R[-30]C,R6C:R29C) -> 15 | D57: =RANK(R[-30]C,R6C:R29C) -> 18 | E57: =RANK(R[-30]C,R6C:R29C) -> 20 | F57: =RANK(R[-30]C,R6C:R29C) -> 16 | G57: =RANK(R[-30]C,R6C:R29C) -> 16 | H57: =RANK(R[-30]C,R6C:R29C) -> 14 | I57: =RANK(R[-30]C,R6C:R29C) -> 20 | J57: =RANK(R[-30]C,R6C:R29C) -> 7 | K57: =RANK(R[-30]C,R6C:R29C) -> 19 | L57: =RANK(R[-30]C,R6C:R29C) -> 21 | M57: =RANK(R[-30]C,R6C:R29C) -> 21 | N57: =RANK(R[-30]C,R6C:R29C) -> 15 | O57: =RANK(R[-30]C,R6C:R29C) -> 16 | P57: =RANK(R[-30]C,R6C:R29C) -> 19 | Q57: =RANK(R[-30]C,R6C:R29C) -> 13 | R57: =RANK(R[-30]C,R6C:R29C) -> 18 | S57: =RANK(R[-30]C,R6C:R29C) -> 15 | T57: =RANK(R[-30]C,R6C:R29C) -> 17 | U57: =RANK(R[-30]C,R6C:R29C) -> 17 | V57: =RANK(R[-30]C,R6C:R29C) -> 16 | W57: =RANK(R[-30]C,R6C:R29C) -> 9 | X57: =RANK(R[-30]C,R6C:R29C) -> 16 | Y57: =RANK(R[-30]C,R6C:R29C) -> 19 | Z57: =RANK(R[-30]C,R6C:R29C) -> 17 | AA57: =RANK(R[-30]C,R6C:R29C) -> 17 | AB57: =RANK(R[-30]C,R6C:R29C) -> 18 | AC57: =RANK(R[-30]C,R6C:R29C) -> 19 | AD57: =RANK(R[-30]C,R6C:R29C) -> 10
C58: =RANK(R[-30]C,R6C:R29C) -> 17 | D58: =RANK(R[-30]C,R6C:R29C) -> 12 | E58: =RANK(R[-30]C,R6C:R29C) -> 18 | F58: =RANK(R[-30]C,R6C:R29C) -> 12 | G58: =RANK(R[-30]C,R6C:R29C) -> 11 | H58: =RANK(R[-30]C,R6C:R29C) -> 12 | I58: =RANK(R[-30]C,R6C:R29C) -> 15 | J58: =RANK(R[-30]C,R6C:R29C) -> 6 | K58: =RANK(R[-30]C,R6C:R29C) -> 17 | L58: =RANK(R[-30]C,R6C:R29C) -> 18 | M58: =RANK(R[-30]C,R6C:R29C) -> 20 | N58: =RANK(R[-30]C,R6C:R29C) -> 10 | O58: =RANK(R[-30]C,R6C:R29C) -> 18 | P58: =RANK(R[-30]C,R6C:R29C) -> 16 | Q58: =RANK(R[-30]C,R6C:R29C) -> 18 | R58: =RANK(R[-30]C,R6C:R29C) -> 15 | S58: =RANK(R[-30]C,R6C:R29C) -> 6 | T58: =RANK(R[-30]C,R6C:R29C) -> 15 | U58: =RANK(R[-30]C,R6C:R29C) -> 16 | V58: =RANK(R[-30]C,R6C:R29C) -> 19 | W58: =RANK(R[-30]C,R6C:R29C) -> 7 | X58: =RANK(R[-30]C,R6C:R29C) -> 21 | Y58: =RANK(R[-30]C,R6C:R29C) -> 15 | Z58: =RANK(R[-30]C,R6C:R29C) -> 13 | AA58: =RANK(R[-30]C,R6C:R29C) -> 12 | AB58: =RANK(R[-30]C,R6C:R29C) -> 16 | AC58: =RANK(R[-30]C,R6C:R29C) -> 17 | AD58: =RANK(R[-30]C,R6C:R29C) -> 9
C59: =RANK(R[-30]C,R6C:R29C) -> 20 | D59: =RANK(R[-30]C,R6C:R29C) -> 11 | E59: =RANK(R[-30]C,R6C:R29C) -> 12 | F59: =RANK(R[-30]C,R6C:R29C) -> 10 | G59: =RANK(R[-30]C,R6C:R29C) -> 9 | H59: =RANK(R[-30]C,R6C:R29C) -> 11 | I59: =RANK(R[-30]C,R6C:R29C) -> 15 | J59: =RANK(R[-30]C,R6C:R29C) -> 11 | K59: =RANK(R[-30]C,R6C:R29C) -> 16 | L59: =RANK(R[-30]C,R6C:R29C) -> 16 | M59: =RANK(R[-30]C,R6C:R29C) -> 17 | N59: =RANK(R[-30]C,R6C:R29C) -> 11 | O59: =RANK(R[-30]C,R6C:R29C) -> 15 | P59: =RANK(R[-30]C,R6C:R29C) -> 15 | Q59: =RANK(R[-30]C,R6C:R29C) -> 19 | R59: =RANK(R[-30]C,R6C:R29C) -> 17 | S59: =RANK(R[-30]C,R6C:R29C) -> 9 | T59: =RANK(R[-30]C,R6C:R29C) -> 18 | U59: =RANK(R[-30]C,R6C:R29C) -> 18 | V59: =RANK(R[-30]C,R6C:R29C) -> 17 | W59: =RANK(R[-30]C,R6C:R29C) -> 17 | X59: =RANK(R[-30]C,R6C:R29C) -> 18 | Y59: =RANK(R[-30]C,R6C:R29C) -> 16 | Z59: =RANK(R[-30]C,R6C:R29C) -> 16 | AA59: =RANK(R[-30]C,R6C:R29C) -> 16 | AB59: =RANK(R[-30]C,R6C:R29C) -> 13 | AC59: =RANK(R[-30]C,R6C:R29C) -> 15 | AD59: =RANK(R[-30]C,R6C:R29C) -> 12
C62: Northbound | J62: Southbound | Q62: Eastbound | X62: Westbound
C63: NPMRDS from HERE (Trucks and passenger vehicles) | J63: NPMRDS from HERE (Trucks and passenger vehicles) | Q63: NPMRDS from HERE (Trucks and passenger vehicles) | X63: NPMRDS from HERE (Trucks and passenger vehicles)
C64: 2011 (Every weekday) | D64: 2012 (Every weekday) | E64: 2013 (Every weekday) | F64: 2014 (Every weekday) | G64: 2015 (Every weekday) | H64: 2016 (Every weekday) | I64: 2017 (Every weekday) | J64: 2011 (Every weekday) | K64: 2012 (Every weekday) | L64: 2013 (Every weekday) | M64: 2014 (Every weekday) | N64: 2015 (Every weekday) | O64: 2016 (Every weekday) | P64: 2017 (Every weekday) | Q64: 2011 (Every weekday) | R64: 2012 (Every weekday) | S64: 2013 (Every weekday) | T64: 2014 (Every weekday) | U64: 2015 (Every weekday) | V64: 2016 (Every weekday) | W64: 2017 (Every weekday) | X64: 2011 (Every weekday) | Y64: 2012 (Every weekday) | Z64: 2013 (Every weekday) | AA64: 2014 (Every weekday) | AB64: 2015 (Every weekday) | AC64: 2016 (Every weekday) | AD64: 2017 (Every weekday)
C65: =IF(R[-29]C<3,R[-59]C,"") ->  | D65: =IF(R[-29]C<3,R[-59]C,"") ->  | E65: =IF(R[-29]C<3,R[-59]C,"") ->  | F65: =IF(R[-29]C<3,R[-59]C,"") ->  | G65: =IF(R[-29]C<3,R[-59]C,"") ->  | H65: =IF(R[-29]C<3,R[-59]C,"") ->  | I65: =IF(R[-29]C<3,R[-59]C,"") ->  | J65: =IF(R[-29]C<3,R[-59]C,"") ->  | K65: =IF(R[-29]C<3,R[-59]C,"") ->  | L65: =IF(R[-29]C<3,R[-59]C,"") ->  | M65: =IF(R[-29]C<3,R[-59]C,"") ->  | N65: =IF(R[-29]C<3,R[-59]C,"") ->  | O65: =IF(R[-29]C<3,R[-59]C,"") ->  | P65: =IF(R[-29]C<3,R[-59]C,"") ->  | Q65: =IF(R[-29]C<3,R[-59]C,"") ->  | R65: =IF(R[-29]C<3,R[-59]C,"") ->  | S65: =IF(R[-29]C<3,R[-59]C,"") ->  | T65: =IF(R[-29]C<3,R[-59]C,"") ->  | U65: =IF(R[-29]C<3,R[-59]C,"") ->  | V65: =IF(R[-29]C<3,R[-59]C,"") ->  | W65: =IF(R[-29]C<3,R[-59]C,"") ->  | X65: =IF(R[-29]C<3,R[-59]C,"") ->  | Y65: =IF(R[-29]C<3,R[-59]C,"") ->  | Z65: =IF(R[-29]C<3,R[-59]C,"") ->  | AA65: =IF(R[-29]C<3,R[-59]C,"") ->  | AB65: =IF(R[-29]C<3,R[-59]C,"") ->  | AC65: =IF(R[-29]C<3,R[-59]C,"") ->  | AD65: =IF(R[-29]C<3,R[-59]C,"") -> 
C66: =IF(R[-29]C<3,R[-59]C,"") ->  | D66: =IF(R[-29]C<3,R[-59]C,"") ->  | E66: =IF(R[-29]C<3,R[-59]C,"") ->  | F66: =IF(R[-29]C<3,R[-59]C,"") ->  | G66: =IF(R[-29]C<3,R[-59]C,"") ->  | H66: =IF(R[-29]C<3,R[-59]C,"") ->  | I66: =IF(R[-29]C<3,R[-59]C,"") ->  | J66: =IF(R[-29]C<3,R[-59]C,"") ->  | K66: =IF(R[-29]C<3,R[-59]C,"") ->  | L66: =IF(R[-29]C<3,R[-59]C,"") ->  | M66: =IF(R[-29]C<3,R[-59]C,"") ->  | N66: =IF(R[-29]C<3,R[-59]C,"") ->  | O66: =IF(R[-29]C<3,R[-59]C,"") ->  | P66: =IF(R[-29]C<3,R[-59]C,"") ->  | Q66: =IF(R[-29]C<3,R[-59]C,"") ->  | R66: =IF(R[-29]C<3,R[-59]C,"") ->  | S66: =IF(R[-29]C<3,R[-59]C,"") ->  | T66: =IF(R[-29]C<3,R[-59]C,"") ->  | U66: =IF(R[-29]C<3,R[-59]C,"") ->  | V66: =IF(R[-29]C<3,R[-59]C,"") ->  | W66: =IF(R[-29]C<3,R[-59]C,"") ->  | X66: =IF(R[-29]C<3,R[-59]C,"") ->  | Y66: =IF(R[-29]C<3,R[-59]C,"") ->  | Z66: =IF(R[-29]C<3,R[-59]C,"") ->  | AA66: =IF(R[-29]C<3,R[-59]C,"") ->  | AB66: =IF(R[-29]C<3,R[-59]C,"") ->  | AC66: =IF(R[-29]C<3,R[-59]C,"") ->  | AD66: =IF(R[-29]C<3,R[-59]C,"") -> 
C67: =IF(R[-29]C<3,R[-59]C,"") ->  | D67: =IF(R[-29]C<3,R[-59]C,"") ->  | E67: =IF(R[-29]C<3,R[-59]C,"") ->  | F67: =IF(R[-29]C<3,R[-59]C,"") ->  | G67: =IF(R[-29]C<3,R[-59]C,"") ->  | H67: =IF(R[-29]C<3,R[-59]C,"") ->  | I67: =IF(R[-29]C<3,R[-59]C,"") ->  | J67: =IF(R[-29]C<3,R[-59]C,"") ->  | K67: =IF(R[-29]C<3,R[-59]C,"") ->  | L67: =IF(R[-29]C<3,R[-59]C,"") ->  | M67: =IF(R[-29]C<3,R[-59]C,"") ->  | N67: =IF(R[-29]C<3,R[-59]C,"") ->  | O67: =IF(R[-29]C<3,R[-59]C,"") ->  | P67: =IF(R[-29]C<3,R[-59]C,"") ->  | Q67: =IF(R[-29]C<3,R[-59]C,"") ->  | R67: =IF(R[-29]C<3,R[-59]C,"") ->  | S67: =IF(R[-29]C<3,R[-59]C,"") ->  | T67: =IF(R[-29]C<3,R[-59]C,"") ->  | U67: =IF(R[-29]C<3,R[-59]C,"") ->  | V67: =IF(R[-29]C<3,R[-59]C,"") ->  | W67: =IF(R[-29]C<3,R[-59]C,"") ->  | X67: =IF(R[-29]C<3,R[-59]C,"") ->  | Y67: =IF(R[-29]C<3,R[-59]C,"") ->  | Z67: =IF(R[-29]C<3,R[-59]C,"") ->  | AA67: =IF(R[-29]C<3,R[-59]C,"") ->  | AB67: =IF(R[-29]C<3,R[-59]C,"") ->  | AC67: =IF(R[-29]C<3,R[-59]C,"") ->  | AD67: =IF(R[-29]C<3,R[-59]C,"") -> 
C68: =IF(R[-29]C<3,R[-59]C,"") ->  | D68: =IF(R[-29]C<3,R[-59]C,"") ->  | E68: =IF(R[-29]C<3,R[-59]C,"") ->  | F68: =IF(R[-29]C<3,R[-59]C,"") ->  | G68: =IF(R[-29]C<3,R[-59]C,"") ->  | H68: =IF(R[-29]C<3,R[-59]C,"") ->  | I68: =IF(R[-29]C<3,R[-59]C,"") ->  | J68: =IF(R[-29]C<3,R[-59]C,"") ->  | K68: =IF(R[-29]C<3,R[-59]C,"") ->  | L68: =IF(R[-29]C<3,R[-59]C,"") ->  | M68: =IF(R[-29]C<3,R[-59]C,"") ->  | N68: =IF(R[-29]C<3,R[-59]C,"") ->  | O68: =IF(R[-29]C<3,R[-59]C,"") ->  | P68: =IF(R[-29]C<3,R[-59]C,"") ->  | Q68: =IF(R[-29]C<3,R[-59]C,"") ->  | R68: =IF(R[-29]C<3,R[-59]C,"") ->  | S68: =IF(R[-29]C<3,R[-59]C,"") ->  | T68: =IF(R[-29]C<3,R[-59]C,"") ->  | U68: =IF(R[-29]C<3,R[-59]C,"") ->  | V68: =IF(R[-29]C<3,R[-59]C,"") ->  | W68: =IF(R[-29]C<3,R[-59]C,"") ->  | X68: =IF(R[-29]C<3,R[-59]C,"") ->  | Y68: =IF(R[-29]C<3,R[-59]C,"") ->  | Z68: =IF(R[-29]C<3,R[-59]C,"") ->  | AA68: =IF(R[-29]C<3,R[-59]C,"") ->  | AB68: =IF(R[-29]C<3,R[-59]C,"") ->  | AC68: =IF(R[-29]C<3,R[-59]C,"") ->  | AD68: =IF(R[-29]C<3,R[-59]C,"") -> 
C69: =IF(R[-29]C<3,R[-59]C,"") ->  | D69: =IF(R[-29]C<3,R[-59]C,"") ->  | E69: =IF(R[-29]C<3,R[-59]C,"") ->  | F69: =IF(R[-29]C<3,R[-59]C,"") ->  | G69: =IF(R[-29]C<3,R[-59]C,"") ->  | H69: =IF(R[-29]C<3,R[-59]C,"") ->  | I69: =IF(R[-29]C<3,R[-59]C,"") ->  | J69: =IF(R[-29]C<3,R[-59]C,"") ->  | K69: =IF(R[-29]C<3,R[-59]C,"") ->  | L69: =IF(R[-29]C<3,R[-59]C,"") ->  | M69: =IF(R[-29]C<3,R[-59]C,"") ->  | N69: =IF(R[-29]C<3,R[-59]C,"") ->  | O69: =IF(R[-29]C<3,R[-59]C,"") ->  | P69: =IF(R[-29]C<3,R[-59]C,"") ->  | Q69: =IF(R[-29]C<3,R[-59]C,"") ->  | R69: =IF(R[-29]C<3,R[-59]C,"") ->  | S69: =IF(R[-29]C<3,R[-59]C,"") ->  | T69: =IF(R[-29]C<3,R[-59]C,"") ->  | U69: =IF(R[-29]C<3,R[-59]C,"") ->  | V69: =IF(R[-29]C<3,R[-59]C,"") ->  | W69: =IF(R[-29]C<3,R[-59]C,"") ->  | X69: =IF(R[-29]C<3,R[-59]C,"") ->  | Y69: =IF(R[-29]C<3,R[-59]C,"") ->  | Z69: =IF(R[-29]C<3,R[-59]C,"") ->  | AA69: =IF(R[-29]C<3,R[-59]C,"") ->  | AB69: =IF(R[-29]C<3,R[-59]C,"") ->  | AC69: =IF(R[-29]C<3,R[-59]C,"") ->  | AD69: =IF(R[-29]C<3,R[-59]C,"") -> 
C70: =IF(R[-29]C<3,R[-59]C,"") ->  | D70: =IF(R[-29]C<3,R[-59]C,"") ->  | E70: =IF(R[-29]C<3,R[-59]C,"") ->  | F70: =IF(R[-29]C<3,R[-59]C,"") ->  | G70: =IF(R[-29]C<3,R[-59]C,"") ->  | H70: =IF(R[-29]C<3,R[-59]C,"") ->  | I70: =IF(R[-29]C<3,R[-59]C,"") ->  | J70: =IF(R[-29]C<3,R[-59]C,"") ->  | K70: =IF(R[-29]C<3,R[-59]C,"") ->  | L70: =IF(R[-29]C<3,R[-59]C,"") ->  | M70: =IF(R[-29]C<3,R[-59]C,"") ->  | N70: =IF(R[-29]C<3,R[-59]C,"") ->  | O70: =IF(R[-29]C<3,R[-59]C,"") ->  | P70: =IF(R[-29]C<3,R[-59]C,"") ->  | Q70: =IF(R[-29]C<3,R[-59]C,"") ->  | R70: =IF(R[-29]C<3,R[-59]C,"") ->  | S70: =IF(R[-29]C<3,R[-59]C,"") ->  | T70: =IF(R[-29]C<3,R[-59]C,"") ->  | U70: =IF(R[-29]C<3,R[-59]C,"") ->  | V70: =IF(R[-29]C<3,R[-59]C,"") ->  | W70: =IF(R[-29]C<3,R[-59]C,"") ->  | X70: =IF(R[-29]C<3,R[-59]C,"") ->  | Y70: =IF(R[-29]C<3,R[-59]C,"") ->  | Z70: =IF(R[-29]C<3,R[-59]C,"") ->  | AA70: =IF(R[-29]C<3,R[-59]C,"") ->  | AB70: =IF(R[-29]C<3,R[-59]C,"") ->  | AC70: =IF(R[-29]C<3,R[-59]C,"") ->  | AD70: =IF(R[-29]C<3,R[-59]C,"") -> 
C71: =IF(R[-29]C<3,R[-59]C,"") ->  | D71: =IF(R[-29]C<3,R[-59]C,"") ->  | E71: =IF(R[-29]C<3,R[-59]C,"") ->  | F71: =IF(R[-29]C<3,R[-59]C,"") ->  | G71: =IF(R[-29]C<3,R[-59]C,"") ->  | H71: =IF(R[-29]C<3,R[-59]C,"") ->  | I71: =IF(R[-29]C<3,R[-59]C,"") ->  | J71: =IF(R[-29]C<3,R[-59]C,"") ->  | K71: =IF(R[-29]C<3,R[-59]C,"") ->  | L71: =IF(R[-29]C<3,R[-59]C,"") ->  | M71: =IF(R[-29]C<3,R[-59]C,"") ->  | N71: =IF(R[-29]C<3,R[-59]C,"") ->  | O71: =IF(R[-29]C<3,R[-59]C,"") ->  | P71: =IF(R[-29]C<3,R[-59]C,"") ->  | Q71: =IF(R[-29]C<3,R[-59]C,"") ->  | R71: =IF(R[-29]C<3,R[-59]C,"") ->  | S71: =IF(R[-29]C<3,R[-59]C,"") ->  | T71: =IF(R[-29]C<3,R[-59]C,"") ->  | U71: =IF(R[-29]C<3,R[-59]C,"") ->  | V71: =IF(R[-29]C<3,R[-59]C,"") ->  | W71: =IF(R[-29]C<3,R[-59]C,"") ->  | X71: =IF(R[-29]C<3,R[-59]C,"") ->  | Y71: =IF(R[-29]C<3,R[-59]C,"") ->  | Z71: =IF(R[-29]C<3,R[-59]C,"") ->  | AA71: =IF(R[-29]C<3,R[-59]C,"") ->  | AB71: =IF(R[-29]C<3,R[-59]C,"") ->  | AC71: =IF(R[-29]C<3,R[-59]C,"") ->  | AD71: =IF(R[-29]C<3,R[-59]C,"") -> 
C72: =IF(R[-29]C<3,R[-59]C,"") ->  | D72: =IF(R[-29]C<3,R[-59]C,"") ->  | E72: =IF(R[-29]C<3,R[-59]C,"") ->  | F72: =IF(R[-29]C<3,R[-59]C,"") ->  | G72: =IF(R[-29]C<3,R[-59]C,"") ->  | H72: =IF(R[-29]C<3,R[-59]C,"") ->  | I72: =IF(R[-29]C<3,R[-59]C,"") ->  | J72: =IF(R[-29]C<3,R[-59]C,"") ->  | K72: =IF(R[-29]C<3,R[-59]C,"") ->  | L72: =IF(R[-29]C<3,R[-59]C,"") ->  | M72: =IF(R[-29]C<3,R[-59]C,"") ->  | N72: =IF(R[-29]C<3,R[-59]C,"") ->  | O72: =IF(R[-29]C<3,R[-59]C,"") ->  | P72: =IF(R[-29]C<3,R[-59]C,"") -> 3.21 | Q72: =IF(R[-29]C<3,R[-59]C,"") ->  | R72: =IF(R[-29]C<3,R[-59]C,"") ->  | S72: =IF(R[-29]C<3,R[-59]C,"") ->  | T72: =IF(R[-29]C<3,R[-59]C,"") ->  | U72: =IF(R[-29]C<3,R[-59]C,"") ->  | V72: =IF(R[-29]C<3,R[-59]C,"") ->  | W72: =IF(R[-29]C<3,R[-59]C,"") ->  | X72: =IF(R[-29]C<3,R[-59]C,"") ->  | Y72: =IF(R[-29]C<3,R[-59]C,"") ->  | Z72: =IF(R[-29]C<3,R[-59]C,"") ->  | AA72: =IF(R[-29]C<3,R[-59]C,"") ->  | AB72: =IF(R[-29]C<3,R[-59]C,"") ->  | AC72: =IF(R[-29]C<3,R[-59]C,"") ->  | AD72: =IF(R[-29]C<3,R[-59]C,"") -> 3.53
C73: =IF(R[-29]C<3,R[-59]C,"") ->  | D73: =IF(R[-29]C<3,R[-59]C,"") ->  | E73: =IF(R[-29]C<3,R[-59]C,"") ->  | F73: =IF(R[-29]C<3,R[-59]C,"") ->  | G73: =IF(R[-29]C<3,R[-59]C,"") ->  | H73: =IF(R[-29]C<3,R[-59]C,"") ->  | I73: =IF(R[-29]C<3,R[-59]C,"") ->  | J73: =IF(R[-29]C<3,R[-59]C,"") ->  | K73: =IF(R[-29]C<3,R[-59]C,"") ->  | L73: =IF(R[-29]C<3,R[-59]C,"") ->  | M73: =IF(R[-29]C<3,R[-59]C,"") ->  | N73: =IF(R[-29]C<3,R[-59]C,"") ->  | O73: =IF(R[-29]C<3,R[-59]C,"") ->  | P73: =IF(R[-29]C<3,R[-59]C,"") ->  | Q73: =IF(R[-29]C<3,R[-59]C,"") ->  | R73: =IF(R[-29]C<3,R[-59]C,"") ->  | S73: =IF(R[-29]C<3,R[-59]C,"") ->  | T73: =IF(R[-29]C<3,R[-59]C,"") ->  | U73: =IF(R[-29]C<3,R[-59]C,"") ->  | V73: =IF(R[-29]C<3,R[-59]C,"") ->  | W73: =IF(R[-29]C<3,R[-59]C,"") ->  | X73: =IF(R[-29]C<3,R[-59]C,"") ->  | Y73: =IF(R[-29]C<3,R[-59]C,"") ->  | Z73: =IF(R[-29]C<3,R[-59]C,"") ->  | AA73: =IF(R[-29]C<3,R[-59]C,"") -> 3.46 | AB73: =IF(R[-29]C<3,R[-59]C,"") -> 4.47 | AC73: =IF(R[-29]C<3,R[-59]C,"") -> 3.88 | AD73: =IF(R[-29]C<3,R[-59]C,"") -> 3.81
C74: =IF(R[-29]C<3,R[-59]C,"") ->  | D74: =IF(R[-29]C<3,R[-59]C,"") ->  | E74: =IF(R[-29]C<3,R[-59]C,"") ->  | F74: =IF(R[-29]C<3,R[-59]C,"") ->  | G74: =IF(R[-29]C<3,R[-59]C,"") ->  | H74: =IF(R[-29]C<3,R[-59]C,"") ->  | I74: =IF(R[-29]C<3,R[-59]C,"") ->  | J74: =IF(R[-29]C<3,R[-59]C,"") ->  | K74: =IF(R[-29]C<3,R[-59]C,"") ->  | L74: =IF(R[-29]C<3,R[-59]C,"") ->  | M74: =IF(R[-29]C<3,R[-59]C,"") ->  | N74: =IF(R[-29]C<3,R[-59]C,"") ->  | O74: =IF(R[-29]C<3,R[-59]C,"") ->  | P74: =IF(R[-29]C<3,R[-59]C,"") ->  | Q74: =IF(R[-29]C<3,R[-59]C,"") ->  | R74: =IF(R[-29]C<3,R[-59]C,"") ->  | S74: =IF(R[-29]C<3,R[-59]C,"") ->  | T74: =IF(R[-29]C<3,R[-59]C,"") ->  | U74: =IF(R[-29]C<3,R[-59]C,"") ->  | V74: =IF(R[-29]C<3,R[-59]C,"") ->  | W74: =IF(R[-29]C<3,R[-59]C,"") ->  | X74: =IF(R[-29]C<3,R[-59]C,"") ->  | Y74: =IF(R[-29]C<3,R[-59]C,"") ->  | Z74: =IF(R[-29]C<3,R[-59]C,"") ->  | AA74: =IF(R[-29]C<3,R[-59]C,"") ->  | AB74: =IF(R[-29]C<3,R[-59]C,"") ->  | AC74: =IF(R[-29]C<3,R[-59]C,"") ->  | AD74: =IF(R[-29]C<3,R[-59]C,"") -> 
C75: =IF(R[-29]C<3,R[-59]C,"") ->  | D75: =IF(R[-29]C<3,R[-59]C,"") ->  | E75: =IF(R[-29]C<3,R[-59]C,"") ->  | F75: =IF(R[-29]C<3,R[-59]C,"") ->  | G75: =IF(R[-29]C<3,R[-59]C,"") ->  | H75: =IF(R[-29]C<3,R[-59]C,"") ->  | I75: =IF(R[-29]C<3,R[-59]C,"") ->  | J75: =IF(R[-29]C<3,R[-59]C,"") ->  | K75: =IF(R[-29]C<3,R[-59]C,"") ->  | L75: =IF(R[-29]C<3,R[-59]C,"") ->  | M75: =IF(R[-29]C<3,R[-59]C,"") ->  | N75: =IF(R[-29]C<3,R[-59]C,"") ->  | O75: =IF(R[-29]C<3,R[-59]C,"") ->  | P75: =IF(R[-29]C<3,R[-59]C,"") ->  | Q75: =IF(R[-29]C<3,R[-59]C,"") ->  | R75: =IF(R[-29]C<3,R[-59]C,"") ->  | S75: =IF(R[-29]C<3,R[-59]C,"") ->  | T75: =IF(R[-29]C<3,R[-59]C,"") ->  | U75: =IF(R[-29]C<3,R[-59]C,"") ->  | V75: =IF(R[-29]C<3,R[-59]C,"") ->  | W75: =IF(R[-29]C<3,R[-59]C,"") ->  | X75: =IF(R[-29]C<3,R[-59]C,"") ->  | Y75: =IF(R[-29]C<3,R[-59]C,"") ->  | Z75: =IF(R[-29]C<3,R[-59]C,"") ->  | AA75: =IF(R[-29]C<3,R[-59]C,"") ->  | AB75: =IF(R[-29]C<3,R[-59]C,"") ->  | AC75: =IF(R[-29]C<3,R[-59]C,"") ->  | AD75: =IF(R[-29]C<3,R[-59]C,"") -> 
C76: =IF(R[-29]C<3,R[-59]C,"") ->  | D76: =IF(R[-29]C<3,R[-59]C,"") ->  | E76: =IF(R[-29]C<3,R[-59]C,"") ->  | F76: =IF(R[-29]C<3,R[-59]C,"") ->  | G76: =IF(R[-29]C<3,R[-59]C,"") ->  | H76: =IF(R[-29]C<3,R[-59]C,"") ->  | I76: =IF(R[-29]C<3,R[-59]C,"") ->  | J76: =IF(R[-29]C<3,R[-59]C,"") ->  | K76: =IF(R[-29]C<3,R[-59]C,"") ->  | L76: =IF(R[-29]C<3,R[-59]C,"") ->  | M76: =IF(R[-29]C<3,R[-59]C,"") ->  | N76: =IF(R[-29]C<3,R[-59]C,"") ->  | O76: =IF(R[-29]C<3,R[-59]C,"") ->  | P76: =IF(R[-29]C<3,R[-59]C,"") ->  | Q76: =IF(R[-29]C<3,R[-59]C,"") ->  | R76: =IF(R[-29]C<3,R[-59]C,"") ->  | S76: =IF(R[-29]C<3,R[-59]C,"") ->  | T76: =IF(R[-29]C<3,R[-59]C,"") ->  | U76: =IF(R[-29]C<3,R[-59]C,"") ->  | V76: =IF(R[-29]C<3,R[-59]C,"") ->  | W76: =IF(R[-29]C<3,R[-59]C,"") ->  | X76: =IF(R[-29]C<3,R[-59]C,"") ->  | Y76: =IF(R[-29]C<3,R[-59]C,"") ->  | Z76: =IF(R[-29]C<3,R[-59]C,"") ->  | AA76: =IF(R[-29]C<3,R[-59]C,"") ->  | AB76: =IF(R[-29]C<3,R[-59]C,"") ->  | AC76: =IF(R[-29]C<3,R[-59]C,"") ->  | AD76: =IF(R[-29]C<3,R[-59]C,"") -> 
C77: =IF(R[-29]C<3,R[-59]C,"") ->  | D77: =IF(R[-29]C<3,R[-59]C,"") ->  | E77: =IF(R[-29]C<3,R[-59]C,"") ->  | F77: =IF(R[-29]C<3,R[-59]C,"") ->  | G77: =IF(R[-29]C<3,R[-59]C,"") ->  | H77: =IF(R[-29]C<3,R[-59]C,"") ->  | I77: =IF(R[-29]C<3,R[-59]C,"") ->  | J77: =IF(R[-29]C<3,R[-59]C,"") ->  | K77: =IF(R[-29]C<3,R[-59]C,"") ->  | L77: =IF(R[-29]C<3,R[-59]C,"") ->  | M77: =IF(R[-29]C<3,R[-59]C,"") ->  | N77: =IF(R[-29]C<3,R[-59]C,"") ->  | O77: =IF(R[-29]C<3,R[-59]C,"") ->  | P77: =IF(R[-29]C<3,R[-59]C,"") ->  | Q77: =IF(R[-29]C<3,R[-59]C,"") ->  | R77: =IF(R[-29]C<3,R[-59]C,"") ->  | S77: =IF(R[-29]C<3,R[-59]C,"") ->  | T77: =IF(R[-29]C<3,R[-59]C,"") ->  | U77: =IF(R[-29]C<3,R[-59]C,"") ->  | V77: =IF(R[-29]C<3,R[-59]C,"") ->  | W77: =IF(R[-29]C<3,R[-59]C,"") ->  | X77: =IF(R[-29]C<3,R[-59]C,"") ->  | Y77: =IF(R[-29]C<3,R[-59]C,"") ->  | Z77: =IF(R[-29]C<3,R[-59]C,"") ->  | AA77: =IF(R[-29]C<3,R[-59]C,"") ->  | AB77: =IF(R[-29]C<3,R[-59]C,"") ->  | AC77: =IF(R[-29]C<3,R[-59]C,"") ->  | AD77: =IF(R[-29]C<3,R[-59]C,"") -> 
C78: =IF(R[-29]C<3,R[-59]C,"") ->  | D78: =IF(R[-29]C<3,R[-59]C,"") ->  | E78: =IF(R[-29]C<3,R[-59]C,"") ->  | F78: =IF(R[-29]C<3,R[-59]C,"") ->  | G78: =IF(R[-29]C<3,R[-59]C,"") ->  | H78: =IF(R[-29]C<3,R[-59]C,"") ->  | I78: =IF(R[-29]C<3,R[-59]C,"") ->  | J78: =IF(R[-29]C<3,R[-59]C,"") ->  | K78: =IF(R[-29]C<3,R[-59]C,"") ->  | L78: =IF(R[-29]C<3,R[-59]C,"") ->  | M78: =IF(R[-29]C<3,R[-59]C,"") ->  | N78: =IF(R[-29]C<3,R[-59]C,"") ->  | O78: =IF(R[-29]C<3,R[-59]C,"") ->  | P78: =IF(R[-29]C<3,R[-59]C,"") ->  | Q78: =IF(R[-29]C<3,R[-59]C,"") ->  | R78: =IF(R[-29]C<3,R[-59]C,"") ->  | S78: =IF(R[-29]C<3,R[-59]C,"") ->  | T78: =IF(R[-29]C<3,R[-59]C,"") ->  | U78: =IF(R[-29]C<3,R[-59]C,"") ->  | V78: =IF(R[-29]C<3,R[-59]C,"") ->  | W78: =IF(R[-29]C<3,R[-59]C,"") ->  | X78: =IF(R[-29]C<3,R[-59]C,"") ->  | Y78: =IF(R[-29]C<3,R[-59]C,"") ->  | Z78: =IF(R[-29]C<3,R[-59]C,"") ->  | AA78: =IF(R[-29]C<3,R[-59]C,"") ->  | AB78: =IF(R[-29]C<3,R[-59]C,"") ->  | AC78: =IF(R[-29]C<3,R[-59]C,"") ->  | AD78: =IF(R[-29]C<3,R[-59]C,"") -> 
C79: =IF(R[-29]C<3,R[-59]C,"") ->  | D79: =IF(R[-29]C<3,R[-59]C,"") ->  | E79: =IF(R[-29]C<3,R[-59]C,"") ->  | F79: =IF(R[-29]C<3,R[-59]C,"") ->  | G79: =IF(R[-29]C<3,R[-59]C,"") ->  | H79: =IF(R[-29]C<3,R[-59]C,"") ->  | I79: =IF(R[-29]C<3,R[-59]C,"") ->  | J79: =IF(R[-29]C<3,R[-59]C,"") ->  | K79: =IF(R[-29]C<3,R[-59]C,"") ->  | L79: =IF(R[-29]C<3,R[-59]C,"") ->  | M79: =IF(R[-29]C<3,R[-59]C,"") ->  | N79: =IF(R[-29]C<3,R[-59]C,"") ->  | O79: =IF(R[-29]C<3,R[-59]C,"") ->  | P79: =IF(R[-29]C<3,R[-59]C,"") ->  | Q79: =IF(R[-29]C<3,R[-59]C,"") ->  | R79: =IF(R[-29]C<3,R[-59]C,"") ->  | S79: =IF(R[-29]C<3,R[-59]C,"") ->  | T79: =IF(R[-29]C<3,R[-59]C,"") ->  | U79: =IF(R[-29]C<3,R[-59]C,"") ->  | V79: =IF(R[-29]C<3,R[-59]C,"") ->  | W79: =IF(R[-29]C<3,R[-59]C,"") ->  | X79: =IF(R[-29]C<3,R[-59]C,"") ->  | Y79: =IF(R[-29]C<3,R[-59]C,"") ->  | Z79: =IF(R[-29]C<3,R[-59]C,"") ->  | AA79: =IF(R[-29]C<3,R[-59]C,"") ->  | AB79: =IF(R[-29]C<3,R[-59]C,"") ->  | AC79: =IF(R[-29]C<3,R[-59]C,"") ->  | AD79: =IF(R[-29]C<3,R[-59]C,"") -> 
C80: =IF(R[-29]C<3,R[-59]C,"") ->  | D80: =IF(R[-29]C<3,R[-59]C,"") ->  | E80: =IF(R[-29]C<3,R[-59]C,"") ->  | F80: =IF(R[-29]C<3,R[-59]C,"") ->  | G80: =IF(R[-29]C<3,R[-59]C,"") ->  | H80: =IF(R[-29]C<3,R[-59]C,"") ->  | I80: =IF(R[-29]C<3,R[-59]C,"") ->  | J80: =IF(R[-29]C<3,R[-59]C,"") ->  | K80: =IF(R[-29]C<3,R[-59]C,"") ->  | L80: =IF(R[-29]C<3,R[-59]C,"") ->  | M80: =IF(R[-29]C<3,R[-59]C,"") ->  | N80: =IF(R[-29]C<3,R[-59]C,"") ->  | O80: =IF(R[-29]C<3,R[-59]C,"") ->  | P80: =IF(R[-29]C<3,R[-59]C,"") ->  | Q80: =IF(R[-29]C<3,R[-59]C,"") ->  | R80: =IF(R[-29]C<3,R[-59]C,"") ->  | S80: =IF(R[-29]C<3,R[-59]C,"") ->  | T80: =IF(R[-29]C<3,R[-59]C,"") ->  | U80: =IF(R[-29]C<3,R[-59]C,"") ->  | V80: =IF(R[-29]C<3,R[-59]C,"") ->  | W80: =IF(R[-29]C<3,R[-59]C,"") ->  | X80: =IF(R[-29]C<3,R[-59]C,"") ->  | Y80: =IF(R[-29]C<3,R[-59]C,"") ->  | Z80: =IF(R[-29]C<3,R[-59]C,"") ->  | AA80: =IF(R[-29]C<3,R[-59]C,"") ->  | AB80: =IF(R[-29]C<3,R[-59]C,"") ->  | AC80: =IF(R[-29]C<3,R[-59]C,"") ->  | AD80: =IF(R[-29]C<3,R[-59]C,"") -> 
C81: =IF(R[-29]C<3,R[-59]C,"") ->  | D81: =IF(R[-29]C<3,R[-59]C,"") -> 2.61 | E81: =IF(R[-29]C<3,R[-59]C,"") -> 3.08 | F81: =IF(R[-29]C<3,R[-59]C,"") -> 2.88 | G81: =IF(R[-29]C<3,R[-59]C,"") -> 3.78 | H81: =IF(R[-29]C<3,R[-59]C,"") -> 3.27 | I81: =IF(R[-29]C<3,R[-59]C,"") -> 3.15 | J81: =IF(R[-29]C<3,R[-59]C,"") ->  | K81: =IF(R[-29]C<3,R[-59]C,"") -> 2.5 | L81: =IF(R[-29]C<3,R[-59]C,"") -> 2.91 | M81: =IF(R[-29]C<3,R[-59]C,"") -> 2.77 | N81: =IF(R[-29]C<3,R[-59]C,"") -> 3.35 | O81: =IF(R[-29]C<3,R[-59]C,"") -> 3.12 | P81: =IF(R[-29]C<3,R[-59]C,"") ->  | Q81: =IF(R[-29]C<3,R[-59]C,"") ->  | R81: =IF(R[-29]C<3,R[-59]C,"") -> 3.72 | S81: =IF(R[-29]C<3,R[-59]C,"") -> 3.8 | T81: =IF(R[-29]C<3,R[-59]C,"") ->  | U81: =IF(R[-29]C<3,R[-59]C,"") -> 4.66 | V81: =IF(R[-29]C<3,R[-59]C,"") -> 4.2300000000000004 | W81: =IF(R[-29]C<3,R[-59]C,"") -> 3.75 | X81: =IF(R[-29]C<3,R[-59]C,"") -> 3.68 | Y81: =IF(R[-29]C<3,R[-59]C,"") -> 3.48 | Z81: =IF(R[-29]C<3,R[-59]C,"") -> 3.47 | AA81: =IF(R[-29]C<3,R[-59]C,"") ->  | AB81: =IF(R[-29]C<3,R[-59]C,"") ->  | AC81: =IF(R[-29]C<3,R[-59]C,"") ->  | AD81: =IF(R[-29]C<3,R[-59]C,"") -> 
C82: =IF(R[-29]C<3,R[-59]C,"") -> 3.28 | D82: =IF(R[-29]C<3,R[-59]C,"") -> 2.99 | E82: =IF(R[-29]C<3,R[-59]C,"") -> 3.59 | F82: =IF(R[-29]C<3,R[-59]C,"") -> 3.18 | G82: =IF(R[-29]C<3,R[-59]C,"") -> 4.07 | H82: =IF(R[-29]C<3,R[-59]C,"") -> 3.5 | I82: =IF(R[-29]C<3,R[-59]C,"") -> 3.37 | J82: =IF(R[-29]C<3,R[-59]C,"") -> 3.1 | K82: =IF(R[-29]C<3,R[-59]C,"") -> 2.91 | L82: =IF(R[-29]C<3,R[-59]C,"") -> 3.21 | M82: =IF(R[-29]C<3,R[-59]C,"") -> 3.07 | N82: =IF(R[-29]C<3,R[-59]C,"") -> 3.59 | O82: =IF(R[-29]C<3,R[-59]C,"") -> 3.24 | P82: =IF(R[-29]C<3,R[-59]C,"") -> 3.27 | Q82: =IF(R[-29]C<3,R[-59]C,"") -> 4.95 | R82: =IF(R[-29]C<3,R[-59]C,"") -> 4.51 | S82: =IF(R[-29]C<3,R[-59]C,"") -> 4.42 | T82: =IF(R[-29]C<3,R[-59]C,"") -> 4.7300000000000004 | U82: =IF(R[-29]C<3,R[-59]C,"") -> 5.31 | V82: =IF(R[-29]C<3,R[-59]C,"") -> 4.82 | W82: =IF(R[-29]C<3,R[-59]C,"") -> 4.1100000000000003 | X82: =IF(R[-29]C<3,R[-59]C,"") -> 4.04 | Y82: =IF(R[-29]C<3,R[-59]C,"") -> 3.67 | Z82: =IF(R[-29]C<3,R[-59]C,"") -> 3.78 | AA82: =IF(R[-29]C<3,R[-59]C,"") -> 3.81 | AB82: =IF(R[-29]C<3,R[-59]C,"") -> 4.53 | AC82: =IF(R[-29]C<3,R[-59]C,"") -> 4.03 | AD82: =IF(R[-29]C<3,R[-59]C,"") -> 3.53
C83: =IF(R[-29]C<3,R[-59]C,"") -> 2.91 | D83: =IF(R[-29]C<3,R[-59]C,"") -> 2.61 | E83: =IF(R[-29]C<3,R[-59]C,"") ->  | F83: =IF(R[-29]C<3,R[-59]C,"") ->  | G83: =IF(R[-29]C<3,R[-59]C,"") ->  | H83: =IF(R[-29]C<3,R[-59]C,"") ->  | I83: =IF(R[-29]C<3,R[-59]C,"") ->  | J83: =IF(R[-29]C<3,R[-59]C,"") -> 2.5499999999999998 | K83: =IF(R[-29]C<3,R[-59]C,"") ->  | L83: =IF(R[-29]C<3,R[-59]C,"") ->  | M83: =IF(R[-29]C<3,R[-59]C,"") ->  | N83: =IF(R[-29]C<3,R[-59]C,"") ->  | O83: =IF(R[-29]C<3,R[-59]C,"") ->  | P83: =IF(R[-29]C<3,R[-59]C,"") ->  | Q83: =IF(R[-29]C<3,R[-59]C,"") -> 4.13 | R83: =IF(R[-29]C<3,R[-59]C,"") ->  | S83: =IF(R[-29]C<3,R[-59]C,"") ->  | T83: =IF(R[-29]C<3,R[-59]C,"") -> 3.97 | U83: =IF(R[-29]C<3,R[-59]C,"") ->  | V83: =IF(R[-29]C<3,R[-59]C,"") ->  | W83: =IF(R[-29]C<3,R[-59]C,"") ->  | X83: =IF(R[-29]C<3,R[-59]C,"") ->  | Y83: =IF(R[-29]C<3,R[-59]C,"") ->  | Z83: =IF(R[-29]C<3,R[-59]C,"") ->  | AA83: =IF(R[-29]C<3,R[-59]C,"") ->  | AB83: =IF(R[-29]C<3,R[-59]C,"") ->  | AC83: =IF(R[-29]C<3,R[-59]C,"") ->  | AD83: =IF(R[-29]C<3,R[-59]C,"") -> 
C84: =IF(R[-29]C<3,R[-59]C,"") ->  | D84: =IF(R[-29]C<3,R[-59]C,"") ->  | E84: =IF(R[-29]C<3,R[-59]C,"") ->  | F84: =IF(R[-29]C<3,R[-59]C,"") ->  | G84: =IF(R[-29]C<3,R[-59]C,"") ->  | H84: =IF(R[-29]C<3,R[-59]C,"") ->  | I84: =IF(R[-29]C<3,R[-59]C,"") ->  | J84: =IF(R[-29]C<3,R[-59]C,"") ->  | K84: =IF(R[-29]C<3,R[-59]C,"") ->  | L84: =IF(R[-29]C<3,R[-59]C,"") ->  | M84: =IF(R[-29]C<3,R[-59]C,"") ->  | N84: =IF(R[-29]C<3,R[-59]C,"") ->  | O84: =IF(R[-29]C<3,R[-59]C,"") ->  | P84: =IF(R[-29]C<3,R[-59]C,"") ->  | Q84: =IF(R[-29]C<3,R[-59]C,"") ->  | R84: =IF(R[-29]C<3,R[-59]C,"") ->  | S84: =IF(R[-29]C<3,R[-59]C,"") ->  | T84: =IF(R[-29]C<3,R[-59]C,"") ->  | U84: =IF(R[-29]C<3,R[-59]C,"") ->  | V84: =IF(R[-29]C<3,R[-59]C,"") ->  | W84: =IF(R[-29]C<3,R[-59]C,"") ->  | X84: =IF(R[-29]C<3,R[-59]C,"") ->  | Y84: =IF(R[-29]C<3,R[-59]C,"") ->  | Z84: =IF(R[-29]C<3,R[-59]C,"") ->  | AA84: =IF(R[-29]C<3,R[-59]C,"") ->  | AB84: =IF(R[-29]C<3,R[-59]C,"") ->  | AC84: =IF(R[-29]C<3,R[-59]C,"") ->  | AD84: =IF(R[-29]C<3,R[-59]C,"") -> 
C85: =IF(R[-29]C<3,R[-59]C,"") ->  | D85: =IF(R[-29]C<3,R[-59]C,"") ->  | E85: =IF(R[-29]C<3,R[-59]C,"") ->  | F85: =IF(R[-29]C<3,R[-59]C,"") ->  | G85: =IF(R[-29]C<3,R[-59]C,"") ->  | H85: =IF(R[-29]C<3,R[-59]C,"") ->  | I85: =IF(R[-29]C<3,R[-59]C,"") ->  | J85: =IF(R[-29]C<3,R[-59]C,"") ->  | K85: =IF(R[-29]C<3,R[-59]C,"") ->  | L85: =IF(R[-29]C<3,R[-59]C,"") ->  | M85: =IF(R[-29]C<3,R[-59]C,"") ->  | N85: =IF(R[-29]C<3,R[-59]C,"") ->  | O85: =IF(R[-29]C<3,R[-59]C,"") ->  | P85: =IF(R[-29]C<3,R[-59]C,"") ->  | Q85: =IF(R[-29]C<3,R[-59]C,"") ->  | R85: =IF(R[-29]C<3,R[-59]C,"") ->  | S85: =IF(R[-29]C<3,R[-59]C,"") ->  | T85: =IF(R[-29]C<3,R[-59]C,"") ->  | U85: =IF(R[-29]C<3,R[-59]C,"") ->  | V85: =IF(R[-29]C<3,R[-59]C,"") ->  | W85: =IF(R[-29]C<3,R[-59]C,"") ->  | X85: =IF(R[-29]C<3,R[-59]C,"") ->  | Y85: =IF(R[-29]C<3,R[-59]C,"") ->  | Z85: =IF(R[-29]C<3,R[-59]C,"") ->  | AA85: =IF(R[-29]C<3,R[-59]C,"") ->  | AB85: =IF(R[-29]C<3,R[-59]C,"") ->  | AC85: =IF(R[-29]C<3,R[-59]C,"") ->  | AD85: =IF(R[-29]C<3,R[-59]C,"") -> 
C86: =IF(R[-29]C<3,R[-59]C,"") ->  | D86: =IF(R[-29]C<3,R[-59]C,"") ->  | E86: =IF(R[-29]C<3,R[-59]C,"") ->  | F86: =IF(R[-29]C<3,R[-59]C,"") ->  | G86: =IF(R[-29]C<3,R[-59]C,"") ->  | H86: =IF(R[-29]C<3,R[-59]C,"") ->  | I86: =IF(R[-29]C<3,R[-59]C,"") ->  | J86: =IF(R[-29]C<3,R[-59]C,"") ->  | K86: =IF(R[-29]C<3,R[-59]C,"") ->  | L86: =IF(R[-29]C<3,R[-59]C,"") ->  | M86: =IF(R[-29]C<3,R[-59]C,"") ->  | N86: =IF(R[-29]C<3,R[-59]C,"") ->  | O86: =IF(R[-29]C<3,R[-59]C,"") ->  | P86: =IF(R[-29]C<3,R[-59]C,"") ->  | Q86: =IF(R[-29]C<3,R[-59]C,"") ->  | R86: =IF(R[-29]C<3,R[-59]C,"") ->  | S86: =IF(R[-29]C<3,R[-59]C,"") ->  | T86: =IF(R[-29]C<3,R[-59]C,"") ->  | U86: =IF(R[-29]C<3,R[-59]C,"") ->  | V86: =IF(R[-29]C<3,R[-59]C,"") ->  | W86: =IF(R[-29]C<3,R[-59]C,"") ->  | X86: =IF(R[-29]C<3,R[-59]C,"") ->  | Y86: =IF(R[-29]C<3,R[-59]C,"") ->  | Z86: =IF(R[-29]C<3,R[-59]C,"") ->  | AA86: =IF(R[-29]C<3,R[-59]C,"") ->  | AB86: =IF(R[-29]C<3,R[-59]C,"") ->  | AC86: =IF(R[-29]C<3,R[-59]C,"") ->  | AD86: =IF(R[-29]C<3,R[-59]C,"") -> 
C87: =IF(R[-29]C<3,R[-59]C,"") ->  | D87: =IF(R[-29]C<3,R[-59]C,"") ->  | E87: =IF(R[-29]C<3,R[-59]C,"") ->  | F87: =IF(R[-29]C<3,R[-59]C,"") ->  | G87: =IF(R[-29]C<3,R[-59]C,"") ->  | H87: =IF(R[-29]C<3,R[-59]C,"") ->  | I87: =IF(R[-29]C<3,R[-59]C,"") ->  | J87: =IF(R[-29]C<3,R[-59]C,"") ->  | K87: =IF(R[-29]C<3,R[-59]C,"") ->  | L87: =IF(R[-29]C<3,R[-59]C,"") ->  | M87: =IF(R[-29]C<3,R[-59]C,"") ->  | N87: =IF(R[-29]C<3,R[-59]C,"") ->  | O87: =IF(R[-29]C<3,R[-59]C,"") ->  | P87: =IF(R[-29]C<3,R[-59]C,"") ->  | Q87: =IF(R[-29]C<3,R[-59]C,"") ->  | R87: =IF(R[-29]C<3,R[-59]C,"") ->  | S87: =IF(R[-29]C<3,R[-59]C,"") ->  | T87: =IF(R[-29]C<3,R[-59]C,"") ->  | U87: =IF(R[-29]C<3,R[-59]C,"") ->  | V87: =IF(R[-29]C<3,R[-59]C,"") ->  | W87: =IF(R[-29]C<3,R[-59]C,"") ->  | X87: =IF(R[-29]C<3,R[-59]C,"") ->  | Y87: =IF(R[-29]C<3,R[-59]C,"") ->  | Z87: =IF(R[-29]C<3,R[-59]C,"") ->  | AA87: =IF(R[-29]C<3,R[-59]C,"") ->  | AB87: =IF(R[-29]C<3,R[-59]C,"") ->  | AC87: =IF(R[-29]C<3,R[-59]C,"") ->  | AD87: =IF(R[-29]C<3,R[-59]C,"") -> 
C88: =IF(R[-29]C<3,R[-59]C,"") ->  | D88: =IF(R[-29]C<3,R[-59]C,"") ->  | E88: =IF(R[-29]C<3,R[-59]C,"") ->  | F88: =IF(R[-29]C<3,R[-59]C,"") ->  | G88: =IF(R[-29]C<3,R[-59]C,"") ->  | H88: =IF(R[-29]C<3,R[-59]C,"") ->  | I88: =IF(R[-29]C<3,R[-59]C,"") ->  | J88: =IF(R[-29]C<3,R[-59]C,"") ->  | K88: =IF(R[-29]C<3,R[-59]C,"") ->  | L88: =IF(R[-29]C<3,R[-59]C,"") ->  | M88: =IF(R[-29]C<3,R[-59]C,"") ->  | N88: =IF(R[-29]C<3,R[-59]C,"") ->  | O88: =IF(R[-29]C<3,R[-59]C,"") ->  | P88: =IF(R[-29]C<3,R[-59]C,"") ->  | Q88: =IF(R[-29]C<3,R[-59]C,"") ->  | R88: =IF(R[-29]C<3,R[-59]C,"") ->  | S88: =IF(R[-29]C<3,R[-59]C,"") ->  | T88: =IF(R[-29]C<3,R[-59]C,"") ->  | U88: =IF(R[-29]C<3,R[-59]C,"") ->  | V88: =IF(R[-29]C<3,R[-59]C,"") ->  | W88: =IF(R[-29]C<3,R[-59]C,"") ->  | X88: =IF(R[-29]C<3,R[-59]C,"") ->  | Y88: =IF(R[-29]C<3,R[-59]C,"") ->  | Z88: =IF(R[-29]C<3,R[-59]C,"") ->  | AA88: =IF(R[-29]C<3,R[-59]C,"") ->  | AB88: =IF(R[-29]C<3,R[-59]C,"") ->  | AC88: =IF(R[-29]C<3,R[-59]C,"") ->  | AD88: =IF(R[-29]C<3,R[-59]C,"") -> 
C91: 2011 | D91: 2012 | E91: 2013 | F91: 2014 | G91: 2015 | H91: 2016 | I91: 2017 | J91: 2011-17 | K91: 2013-17
A92: PA Counties Freeway | B92: 1 | C92: =AVERAGE(R[-27]C:R[-4]C,R[-27]C[7]:R[-4]C[7],R[-27]C[14]:R[-4]C[14],R[-27]C[21]:R[-4]C[21]) -> 3.5799999999999996 | D92: =AVERAGE(R[-27]C:R[-4]C,R[-27]C[7]:R[-4]C[7],R[-27]C[14]:R[-4]C[14],R[-27]C[21]:R[-4]C[21]) -> 3.2222222222222223 | E92: =AVERAGE(R[-27]C:R[-4]C,R[-27]C[7]:R[-4]C[7],R[-27]C[14]:R[-4]C[14],R[-27]C[21]:R[-4]C[21]) -> 3.5324999999999998 | F92: =AVERAGE(R[-27]C:R[-4]C,R[-27]C[7]:R[-4]C[7],R[-27]C[14]:R[-4]C[14],R[-27]C[21]:R[-4]C[21]) -> 3.4837500000000001 | G92: =AVERAGE(R[-27]C:R[-4]C,R[-27]C[7]:R[-4]C[7],R[-27]C[14]:R[-4]C[14],R[-27]C[21]:R[-4]C[21]) -> 4.22 | H92: =AVERAGE(R[-27]C:R[-4]C,R[-27]C[7]:R[-4]C[7],R[-27]C[14]:R[-4]C[14],R[-27]C[21]:R[-4]C[21]) -> 3.76125 | I92: =AVERAGE(R[-27]C:R[-4]C,R[-27]C[7]:R[-4]C[7],R[-27]C[14]:R[-4]C[14],R[-27]C[21]:R[-4]C[21]) -> 3.5255555555555556
A93: PA Counties Freeway | B93: 2 | C93: 2.0264583333333337 | D93: 1.9672916666666669 | E93: 1.8863541666666681 | F93: 1.9366666666666659 | G93: 2.3020833333333335 | H93: 2.0306250000000001 | I93: 1.9870833333333335